comment,score,created_utc,author,episode_post_id,episode_title
"### **SORT** this Discussion &#x1F3A8;
---
- sort **by** [BEST](https://www.reddit.com/r/LoveIslandUSA/comments/1lfsbxo/season_7_episode_15_post_episode_discussion//?sort=confidence) comments
- sort **by** [FIRST](https://www.reddit.com/r/LoveIslandUSA/comments/1lfsbxo/season_7_episode_15_post_episode_discussion//?sort=old) comments
- sort **by** [CONTROVERSIAL](https://www.reddit.com/r/LoveIslandUSA/comments/1lfsbxo/season_7_episode_15_post_episode_discussion//?sort=controversial) comments

*I am a bot, and this action was performed automatically. Please [contact the moderators of this subreddit](/message/compose/?to=/r/LoveIslandUSA) if you have any questions or concerns.*",1,1750384858.0,AutoModerator,1lfsbxo,Season 7 - Episode 15 - Post Episode Discussion
Taylor being Huda's probation officer was sending me 😭,1188,1750384886.0,waxedwookiee,1lfsbxo,Season 7 - Episode 15 - Post Episode Discussion
"Ok when Huda interrupted Iris and Jeremiah’s chat and they hugged at the end, did anyone else feel like she was looking at him hoping he’d kiss her when they pulled away? Idk if I’m just reading into that moment a lil too hard lmao",1008,1750386033.0,Itskbee_,1lfsbxo,Season 7 - Episode 15 - Post Episode Discussion
"This is all I see when Amaya and Austin are together

https://preview.redd.it/foss7aqwpz7f1.jpeg?width=1200&format=pjpg&auto=webp&s=612db4a37725232bf34dc41fc15776822a1c5f3a",1013,1750385215.0,rachellethebelle,1lfsbxo,Season 7 - Episode 15 - Post Episode Discussion
Olandria omg you have a gift straight from the lord,760,1750384933.0,Posietuck,1lfsbxo,Season 7 - Episode 15 - Post Episode Discussion
Meg and the producers making this a fun light hearted episode was so perfect. This show is supposed to be fun!!,686,1750385316.0,_L00sey_G00sey_,1lfsbxo,Season 7 - Episode 15 - Post Episode Discussion
lowkey an ick how overly excited ace gets when a new bombshell comes in,1050,1750385127.0,PalpitationUpstairs8,1lfsbxo,Season 7 - Episode 15 - Post Episode Discussion
"https://preview.redd.it/tq9vsym0pz7f1.jpeg?width=1161&format=pjpg&auto=webp&s=df8986cfbbcd19ddb6a6c4376cc27df9196c7810

The fact that this even has to be said is CRAZY!",997,1750384923.0,AdvisorContent7778,1lfsbxo,Season 7 - Episode 15 - Post Episode Discussion
This literally felt like a different villa. We needed this episode so bad lol,463,1750385403.0,Ten_Cent_Pistol_,1lfsbxo,Season 7 - Episode 15 - Post Episode Discussion
Cierra was an ACTUAL girls’ girl tonight: she held her friend accountable but empowered her to do and be better ❤️,1221,1750384888.0,birdnoa,1lfsbxo,Season 7 - Episode 15 - Post Episode Discussion
the vibes were so much better this episode omg we really needed this 😭,414,1750384896.0,waxedwookiee,1lfsbxo,Season 7 - Episode 15 - Post Episode Discussion
"Taylor when he pulled up on Huda talking to Jeremiah after she promised not deal with him no more:

https://preview.redd.it/vc4xrj4wuz7f1.png?width=1170&format=png&auto=webp&s=94c408e55074e8cee859fbe3097984d91957b4e6",404,1750386918.0,djmalik278,1lfsbxo,Season 7 - Episode 15 - Post Episode Discussion
"Amaya cracked me up so much this episode, from “I don’t know how to iron how am I gonna get married” to her stretching out her knees to meet Meg 😂😂😂",800,1750384897.0,birdnoa,1lfsbxo,Season 7 - Episode 15 - Post Episode Discussion
meg saying her favorite part so far was huda telling nic about her kid lolol she's one of us,396,1750385107.0,ediblepatellas,1lfsbxo,Season 7 - Episode 15 - Post Episode Discussion
I'm so sorry but ya'll we cannot complain about Iris with the bombshell. We used her as a human sacrifice to split up Huda and Jeremiah. Girl deserves to have some fun lmao,1288,1750385348.0,Particular-Ad5787,1lfsbxo,Season 7 - Episode 15 - Post Episode Discussion
"love that Megan WATCHES the show!!! her favorite moment is my favorite moment!! ""mamacita?!""",656,1750384935.0,maunzer,1lfsbxo,Season 7 - Episode 15 - Post Episode Discussion
I’m happy for Megan because it’s not an easy thing to cameo on your favorite show and have it go well. She killed it.,636,1750385309.0,harperblossom,1lfsbxo,Season 7 - Episode 15 - Post Episode Discussion
if i was on love island and andrina came in i literally would’ve went home like,298,1750385234.0,rllytheworst,1lfsbxo,Season 7 - Episode 15 - Post Episode Discussion
Taylor saying “finally something to work with” after seeing the bombshell👀 sir wym by that?..,579,1750385276.0,Adventurous-Berry199,1lfsbxo,Season 7 - Episode 15 - Post Episode Discussion
Pepe was breaking out the Spanish for Andreina. Hannah you in danger girl,279,1750387728.0,Carolina_Blues,1lfsbxo,Season 7 - Episode 15 - Post Episode Discussion
Producers nailed it. After all the toxicity we needed Meg and the islanders having fun together! Plus two actually hot bombshells! Loved it!,789,1750384894.0,duochromepalmtree,1lfsbxo,Season 7 - Episode 15 - Post Episode Discussion
"Everyone needs a Cierra, her advice was so thoughtful and sweet.. I hope Huda truly takes it",255,1750384945.0,AdvisorContent7778,1lfsbxo,Season 7 - Episode 15 - Post Episode Discussion
"It’s so funny bc out of everyone, Taylor was the last person I expected to be the first person to tell Huda she needs to quit with all the bullshit lol",497,1750385153.0,Cinemaniacc,1lfsbxo,Season 7 - Episode 15 - Post Episode Discussion
Andreina is a next level bombshell holyyyyyy,669,1750384879.0,lazypoorasian,1lfsbxo,Season 7 - Episode 15 - Post Episode Discussion
"https://preview.redd.it/dn7aq9tytz7f1.png?width=1094&format=png&auto=webp&s=cac5d38c1364876c6e2d1efbf29d3db9f33517b4

love island please count your days for continuously sending in chopped, red pill males",226,1750386602.0,thrrowwwawayyyyy,1lfsbxo,Season 7 - Episode 15 - Post Episode Discussion
"Andreina is a BOMBSHELL

https://preview.redd.it/ot83g7b1pz7f1.jpeg?width=845&format=pjpg&auto=webp&s=4c53932f8274e78667c7559fc696d2e34186b0fa",653,1750384921.0,Acheesycookie,1lfsbxo,Season 7 - Episode 15 - Post Episode Discussion
iris potentially taking huda’s next man too omg 😭,224,1750385652.0,brunettedemon,1lfsbxo,Season 7 - Episode 15 - Post Episode Discussion
okay but can we all agree that this was one of the most fun episodes all season!!??? i loved meg as the game host and the islanders looked like they had so much fun!,218,1750385270.0,Inspectoran,1lfsbxo,Season 7 - Episode 15 - Post Episode Discussion
Ace is definitely not done exploring,216,1750385448.0,SufficientSport9561,1lfsbxo,Season 7 - Episode 15 - Post Episode Discussion
I’m starting to question Chelley taste because from her confessional I was expecting a MAN but why he look like someone I would run into at a frat party 🙁🙁,216,1750385672.0,Asleep_Tap6199,1lfsbxo,Season 7 - Episode 15 - Post Episode Discussion
One of my favourite parts of the episode was Megan shadily reminding Hannah of Charlie's existence.,215,1750385781.0,Lost-and-dumbfound,1lfsbxo,Season 7 - Episode 15 - Post Episode Discussion
Ace with the height advantage during limbo,417,1750385876.0,tinkerfairy09,1lfsbxo,Season 7 - Episode 15 - Post Episode Discussion
amaya is funnier and funnier with every episode she’s such a treasure,408,1750385413.0,PalpitationUpstairs8,1lfsbxo,Season 7 - Episode 15 - Post Episode Discussion
Meg saying her favorite moment was Nic’s “mommy mamacita” had me dyingggg,197,1750385750.0,Reasonable_Fun3170,1lfsbxo,Season 7 - Episode 15 - Post Episode Discussion
Meg Thee Stallion being a real fan of the show and this season was EVERYTHINGGGG that scene in the dressing room was so fun,735,1750384870.0,birdnoa,1lfsbxo,Season 7 - Episode 15 - Post Episode Discussion
HUDA TRYING TO GET THE GOODBYE KISS LMAOZAHSH,195,1750386912.0,tinkerfairy09,1lfsbxo,Season 7 - Episode 15 - Post Episode Discussion
"https://preview.redd.it/ahmjx93dpz7f1.jpeg?width=1077&format=pjpg&auto=webp&s=1ddc4e9206263862afa0c82b8a07ce2b711da279

That gold bathing suit on Cierra",550,1750385054.0,T-H-She,1lfsbxo,Season 7 - Episode 15 - Post Episode Discussion
MEGAN CHANGED THE VIBES IN THE VILLA THIS IS THE HAPPIEST I'VE EVER SEEN ANY OF THEM LOOK,189,1750385067.0,ihrtly,1lfsbxo,Season 7 - Episode 15 - Post Episode Discussion
"https://preview.redd.it/1722a73rrz7f1.png?width=1094&format=png&auto=webp&s=57908ba4883984baf5f32dc266f825d5d0ea7cce

I’M SCREAMING AT THIS COMMENT",363,1750385836.0,stardustlovrr,1lfsbxo,Season 7 - Episode 15 - Post Episode Discussion
Megan might've just saved this season holy shit,169,1750385535.0,SmallWarlock,1lfsbxo,Season 7 - Episode 15 - Post Episode Discussion
The guys don’t deserve Andreina!!! What a bombshell,490,1750384877.0,powervee,1lfsbxo,Season 7 - Episode 15 - Post Episode Discussion
The craziest part of this episode was when Huda tried to kiss Jeremiah,340,1750385931.0,Federal-Parfait-7780,1lfsbxo,Season 7 - Episode 15 - Post Episode Discussion
"Hannah was crying blood over Charlie only to be fucking Pepe 2 days later lmfaooooo

Yeah it’s for the best that he said he wasn’t watching any recent episodes 😭

https://preview.redd.it/l3ksp2acqz7f1.jpeg?width=647&format=pjpg&auto=webp&s=99f7b379fcd30b7619765f0b92b2b55f4daaef51",479,1750385252.0,oliviaaivilo06,1lfsbxo,Season 7 - Episode 15 - Post Episode Discussion
Megan bringing up Nic’s “mamacita”. Same girl 😂,163,1750386216.0,P149049,1lfsbxo,Season 7 - Episode 15 - Post Episode Discussion
"https://preview.redd.it/hixqqrlb208f1.jpeg?width=1179&format=pjpg&auto=webp&s=254697d07463ca16fff7d380998eb48948712fc9

Tomorrow on love island.. 😂😂",162,1750389396.0,kyl4h,1lfsbxo,Season 7 - Episode 15 - Post Episode Discussion
Do you guys believe Cierra’s head is actually turning? I feel like she’s bored,150,1750384881.0,vyzyxy,1lfsbxo,Season 7 - Episode 15 - Post Episode Discussion
are the girlies ever gonna get their own guy bombshells without other girls coming in?? like be fr,152,1750385592.0,4everinlovewithrhys,1lfsbxo,Season 7 - Episode 15 - Post Episode Discussion
Shoutout to Cierra for being real in this episode,151,1750385127.0,Fancy_Gene_9814,1lfsbxo,Season 7 - Episode 15 - Post Episode Discussion
"the men don’t deserve a good looking bombshell like that, i’m pissed",145,1750385506.0,thrrowwwawayyyyy,1lfsbxo,Season 7 - Episode 15 - Post Episode Discussion
"Unpopular opinion: The female bombshells being fine as hell and the male bombshells being “meh” is kind of a reflection of how it’s like in the real world. I think generally women are prettier than men.

https://preview.redd.it/uf92g055zz7f1.jpeg?width=400&format=pjpg&auto=webp&s=05dd8794d224f460f77ae5cf4c029d0ca66ed7c1",290,1750388326.0,nosy4fun,1lfsbxo,Season 7 - Episode 15 - Post Episode Discussion
"Andrina???

https://preview.redd.it/ww8vb0oxqz7f1.jpeg?width=622&format=pjpg&auto=webp&s=929ac2b4473ee4f9ef8f637257f1dce4c7b87af3",134,1750385558.0,daemonxcaraxes,1lfsbxo,Season 7 - Episode 15 - Post Episode Discussion
Casa is going to be one for the books this year I’m so excited there’s gonna be 16 new couples 😭,134,1750385817.0,Queen1taurus2,1lfsbxo,Season 7 - Episode 15 - Post Episode Discussion
Did anyone else notice how much Megan likes Cierra?? She’s def her fav and I love that.,390,1750385838.0,snazikin,1lfsbxo,Season 7 - Episode 15 - Post Episode Discussion
Megan thee stallion deserves an Emmy for this episode,462,1750384999.0,lilly_1005_2007,1lfsbxo,Season 7 - Episode 15 - Post Episode Discussion
"meg literally made this episode so enjoyable, it was like a negative, miserable cloud looming this past week and her entering the villa made it sunshine and rainbows",256,1750385803.0,thrrowwwawayyyyy,1lfsbxo,Season 7 - Episode 15 - Post Episode Discussion
"That was such a fun episode, I was CRYING during the game. We totally needed that!",124,1750384878.0,birdnoa,1lfsbxo,Season 7 - Episode 15 - Post Episode Discussion
Cierra might’ve secured top girl for me this episode. That moment with Huda was the most real and raw conversation of the whole season so far imo. Brutally honest and coming from a place of a concerned friend holding their girl accountable but also letting her know this doesn’t have to define who she is and what she becomes going forward. Huda will still need a lot more healing but she needed this and I’m glad she heard it.,119,1750392073.0,neongem,1lfsbxo,Season 7 - Episode 15 - Post Episode Discussion
"That talk with Cierra was so good, she showed so much empathy but also tough love without coming across as scolding. Love her even more now!",345,1750385273.0,_valiii,1lfsbxo,Season 7 - Episode 15 - Post Episode Discussion
"https://preview.redd.it/o7lypcu2sz7f1.jpeg?width=800&format=pjpg&auto=webp&s=7b23c4597b26254e23f400a14fbcf016c070e80b

Me this whole episode because the villa set a boundary with Huda and I could enjoy a fun chill vibe",244,1750385999.0,Particular-Ad5787,1lfsbxo,Season 7 - Episode 15 - Post Episode Discussion
Ace the same height as the bar at its lowest,111,1750384958.0,Internal-Hawk-5057,1lfsbxo,Season 7 - Episode 15 - Post Episode Discussion
“I feel like I could fart in front of him and he’d just fart back” LMFAOOOO AMAYA 😂😭,117,1750386555.0,thejeffphone,1lfsbxo,Season 7 - Episode 15 - Post Episode Discussion
Chelley clocked Ace’s reactions to the bombshell and was NOT happy.,233,1750385357.0,EconomistFriendly629,1lfsbxo,Season 7 - Episode 15 - Post Episode Discussion
I like that Meg was able to talk to the girls and give them a lil taste of the reception this season is getting on the outside. They looked so shocked that she was quoting things they said & talking about moments that happened 😭,110,1750385634.0,Looseunicornssss,1lfsbxo,Season 7 - Episode 15 - Post Episode Discussion
Two Dominican baddies in the villa 😫😫😫 none of those little boys deserve these women,111,1750385808.0,Sea-Dragonfly6609,1lfsbxo,Season 7 - Episode 15 - Post Episode Discussion
Meg talking about Mamacita in the confessional was my fave moment this season period!,108,1750386000.0,pickled_peppers13,1lfsbxo,Season 7 - Episode 15 - Post Episode Discussion
Cierra's speech to huda healed something in me,108,1750386268.0,GlitteringDot5177,1lfsbxo,Season 7 - Episode 15 - Post Episode Discussion
They send in these HOT ass women and men I see at Trader Joe’s,312,1750386259.0,Queen1taurus2,1lfsbxo,Season 7 - Episode 15 - Post Episode Discussion
im intrigued as to how huda will react to finding out iris and the bombshell have a connection,105,1750384997.0,Jazzlike_Sun778,1lfsbxo,Season 7 - Episode 15 - Post Episode Discussion
Whoever found Andreina needs a raise ASAPP,104,1750385844.0,Possible_Phone_4019,1lfsbxo,Season 7 - Episode 15 - Post Episode Discussion
Amaya is my Liv for this season. like im sorry I know shes not gonna win but I need her in there as long as possible,107,1750386276.0,lexivance7,1lfsbxo,Season 7 - Episode 15 - Post Episode Discussion
I’m sorry but Austin consistently has the funniest parts in every episode for me. His twerk off this episode had me on the floor dying.,309,1750385679.0,vrschikasanaa,1lfsbxo,Season 7 - Episode 15 - Post Episode Discussion
"Bringing in Meg this episode was the perfect thing to lift the mood of the villa, and in turn the show. It was getting a little spooky for a second",214,1750384961.0,Critical_Fig1798,1lfsbxo,Season 7 - Episode 15 - Post Episode Discussion
"ace about to tell chelley he’s a slow burner and he doesn’t want to cuddle next ep

https://preview.redd.it/bc8pz0fnrz7f1.jpeg?width=1290&format=pjpg&auto=webp&s=ff157998772798b814c896f0111d8427e14253a6",459,1750385801.0,gatita888,1lfsbxo,Season 7 - Episode 15 - Post Episode Discussion
Say what you want ab Huda but that girl can TWERK lol,458,1750384965.0,birdnoa,1lfsbxo,Season 7 - Episode 15 - Post Episode Discussion
"Taylor winning the twerking battle over Chelley 🤐 that was a crime but Olandria’s face tho lmao

https://preview.redd.it/rvk642xrtz7f1.jpeg?width=4284&format=pjpg&auto=webp&s=ac9cc43c5f866d48c0d6a297ea05ee47617760e4",100,1750386530.0,uglybug14,1lfsbxo,Season 7 - Episode 15 - Post Episode Discussion
Looks like Huda is about to be outta here. Think Iris and Jeremiah will prob each take a bombshell,284,1750384904.0,Ok_Management_2695,1lfsbxo,Season 7 - Episode 15 - Post Episode Discussion
"I think Chelley is gonna realize real soon how unserious Ace is. She looked pretty irritated at how Ace was acting when Adrina walked in, Huda looked at her and even mentioned it.",98,1750385734.0,vrschikasanaa,1lfsbxo,Season 7 - Episode 15 - Post Episode Discussion
"https://preview.redd.it/fngrurmntz7f1.jpeg?width=1125&format=pjpg&auto=webp&s=e4a00d9b56cc513bfea46df63468d4ed28556d2b

Mommy? Mamacita ✅",95,1750386504.0,9500140351,1lfsbxo,Season 7 - Episode 15 - Post Episode Discussion
"Cierra’s chat with Huda this episode solidified for me that she’s one of my favorite girls. I absolutely LOVED how she sat her down and was completely honest, telling her what she needed to hear, while lifting her up. She is a true girls girl and such a good friend",97,1750427966.0,Strawberry2772,1lfsbxo,Season 7 - Episode 15 - Post Episode Discussion
Pepe immediately started speaking Spanish when the bombshell walked in,190,1750385155.0,Beyoncespinkytoe,1lfsbxo,Season 7 - Episode 15 - Post Episode Discussion
IMAGINE GETTING VOTED OFF BEFORE YOU GET TO MEET MEGAN THEE STALLION OH MY GOD 😭😭😭 RIP JALEN,189,1750386686.0,Euphoric_Horse8973,1lfsbxo,Season 7 - Episode 15 - Post Episode Discussion
The female bombshell is out of these guys’ league by farrr I can’t 😭,181,1750385669.0,aimedless,1lfsbxo,Season 7 - Episode 15 - Post Episode Discussion
Jeremiah loving Ponyo actually huge green flag,185,1750386578.0,duskoath,1lfsbxo,Season 7 - Episode 15 - Post Episode Discussion
Meg quoting Nic’s mommy mamacita is so iconic. Like you mean to tell me Meg and myself are bonded by this moment?!??,94,1750385935.0,Zestyclose-Walrus883,1lfsbxo,Season 7 - Episode 15 - Post Episode Discussion
tj looks like a hinge profile personified (derogatory),90,1750386199.0,stardustlovrr,1lfsbxo,Season 7 - Episode 15 - Post Episode Discussion
"Huda when she walked up on Iris & Jeremiah after promising to be done with him:

https://preview.redd.it/johxi21euz7f1.jpeg?width=950&format=pjpg&auto=webp&s=112b39cdb247accf55eaa2dd9afd876d4f74663d",92,1750386739.0,djmalik278,1lfsbxo,Season 7 - Episode 15 - Post Episode Discussion
"I was so proud of Cierra for her talk to Huda. She gave the best advice. That’s a true girls girl! She’s classy, genuine, smart, and beautiful. I wish we saw more of her the last few days. Her and Olandria are my favorites!",92,1750387595.0,survivorfreak789,1lfsbxo,Season 7 - Episode 15 - Post Episode Discussion
 I love how Meg reminded the audience that the contestants are still human!! That message was definitely needed,262,1750385411.0,UnluckyAnywhere5522,1lfsbxo,Season 7 - Episode 15 - Post Episode Discussion
"https://preview.redd.it/amqk3snwoz7f1.jpeg?width=1085&format=pjpg&auto=webp&s=eb236e04a85b3229bcacd9271d262dc3acf10a96

Mans wanted to risk it all so bad lmao",743,1750384882.0,AdvisorContent7778,1lfsbxo,Season 7 - Episode 15 - Post Episode Discussion
"The guys this season are getting Love Island on easy mode. Forget a bombshell, Andreina is a NUKE.",172,1750385169.0,kimmiecla,1lfsbxo,Season 7 - Episode 15 - Post Episode Discussion
This was definitely the light hearted episode we needed after the last couple of ones lol,87,1750385360.0,Automatic-Growth-613,1lfsbxo,Season 7 - Episode 15 - Post Episode Discussion
The new girl bombshell's vanity is gonna have about 6 plates of pancakes and eggs,86,1750395372.0,ChiTaurus,1lfsbxo,Season 7 - Episode 15 - Post Episode Discussion
Cierra is my current winner my queen,242,1750384943.0,Cinemaniacc,1lfsbxo,Season 7 - Episode 15 - Post Episode Discussion
"Hannah and Pepe…LOL

Loved Meg downnn, her little confessionals were so cute. She really brought the energy back up into the villa. 

Lowkey thought Huda was trying to get Jeremiah to kiss her after their hug in the speakeasy 

Cierra really came through talking to Huda, I really hope she takes it to heart

Andrina’s face card and her ass is a planet, my jaw was on the floor I can’t lie, she’s gonna be a problem",242,1750385195.0,ayxc_,1lfsbxo,Season 7 - Episode 15 - Post Episode Discussion
It was truly PAINFUL to watch Huda wait there for a kiss with Jeremiah🤣🤣 like???🤣,364,1750384973.0,AdvisorContent7778,1lfsbxo,Season 7 - Episode 15 - Post Episode Discussion
Austin had me in TEARS in the twerk off. Oh my gosh I was laughing so hard. Needed that,167,1750385245.0,katiesb228,1lfsbxo,Season 7 - Episode 15 - Post Episode Discussion
"huda and jeremiah over, megan thee stallion girls chat, fun twerking challenge, cute bombshell puzzle, two new bombshells like 10/10 episode thank u producers",83,1750385025.0,PalpitationUpstairs8,1lfsbxo,Season 7 - Episode 15 - Post Episode Discussion
Did anyone else notice Hannah & Pepe boning?,82,1750385712.0,Dusty_Harvest,1lfsbxo,Season 7 - Episode 15 - Post Episode Discussion
[removed],85,1750387085.0,None,1lfsbxo,Season 7 - Episode 15 - Post Episode Discussion
Andrina is quite possibly the most attractive bombshell EVER. TJ does nothing for me.,233,1750385245.0,Reasonable_Body7661,1lfsbxo,Season 7 - Episode 15 - Post Episode Discussion
"The bombshell kissing Iris when Huda wants him… maybe karma is real after all

https://preview.redd.it/bjuy8lihpz7f1.jpeg?width=851&format=pjpg&auto=webp&s=3fc02ad4c9cd882790c2cd2159939526c2e4edbf",223,1750385070.0,nancy__drew,1lfsbxo,Season 7 - Episode 15 - Post Episode Discussion
Andreina is literally serving Miguel levels of bombshell,224,1750385608.0,chiquitabrujita,1lfsbxo,Season 7 - Episode 15 - Post Episode Discussion
"The men will be waiting in single file line to talk to Andrina lmaoo, can’t blame them bc I would be first in line",74,1750385188.0,Illustrious-Insect26,1lfsbxo,Season 7 - Episode 15 - Post Episode Discussion
"Andreina’s body is COFFEE bc tea isn’t strong enough 🥵🥵Waist non existent, face card lethal 🥵🥵 and her damn tan lines yall im having heart palpitations",75,1750385243.0,blairecock,1lfsbxo,Season 7 - Episode 15 - Post Episode Discussion
Ace get too excited everytime there’s a new bombshell 😭,76,1750385356.0,AdministrativeCell24,1lfsbxo,Season 7 - Episode 15 - Post Episode Discussion
"Andrina is Miguel level bombshell. My God. The women have blessed this episode from Megan in a bikini, Olandria twerking and then Andrina. 

I’m listening to god is a women after this episode",149,1750385398.0,lilly_1005_2007,1lfsbxo,Season 7 - Episode 15 - Post Episode Discussion
iris dipping on jeremiah immediately and i’m not even mad bc huda probably scared the shit out of her lmao,323,1750385206.0,PalpitationUpstairs8,1lfsbxo,Season 7 - Episode 15 - Post Episode Discussion
"Just based off looks, Andrina would turn my head sooo quickly💀💀",74,1750385441.0,BeginningJello4774,1lfsbxo,Season 7 - Episode 15 - Post Episode Discussion
Hannah with the spit start on tv was WILD. Production will pay for their crimes.,73,1750386960.0,kewlvintagesoul,1lfsbxo,Season 7 - Episode 15 - Post Episode Discussion
I want to be Cierra’s bestie. She kept it real with Huda in their chat today and she just seems like she would be such a good friend. Love her,68,1750391143.0,lving_in_a_daydream,1lfsbxo,Season 7 - Episode 15 - Post Episode Discussion
"I have a feeling it’s hudas time to go soon. I do like that we go this episode because it was nice to see her smiling and a more likeable side to her, but the bombshell not really seeming gunning for her but Iris makes me think production is fine with her going before casa",317,1750384992.0,SuccessfulCoffee4407,1lfsbxo,Season 7 - Episode 15 - Post Episode Discussion
"Did anyone notice that when Huda pulled Jerimiah for the chat, and they hugged at the end, it was clear she was hoping he would kiss her but he just went in for a second hug.",247,1750385519.0,Distinct_Tomato_9025,1lfsbxo,Season 7 - Episode 15 - Post Episode Discussion
Dude Megan fixed the vibe thank god. I don’t think I’ve seen Huda smile so much,67,1750385134.0,Ornery-Persimmon-968,1lfsbxo,Season 7 - Episode 15 - Post Episode Discussion
None of these men deserve Andreina,67,1750385579.0,Jewelry_lover,1lfsbxo,Season 7 - Episode 15 - Post Episode Discussion
why are the guys all so average looking but the girls stay absolutely stunning 😭 unfair,70,1750385706.0,Alert_File8960,1lfsbxo,Season 7 - Episode 15 - Post Episode Discussion
amaya killed me with the “WE BUILT YOU” 😹,69,1750388001.0,EfficientDrag8245,1lfsbxo,Season 7 - Episode 15 - Post Episode Discussion
queen amaya ironing her pajamas,67,1750391223.0,OriginalKale2854,1lfsbxo,Season 7 - Episode 15 - Post Episode Discussion
Am I the only one who thinks all the couples together rn actually have no chemistry?,66,1750391567.0,Jazzlike-Hall7987,1lfsbxo,Season 7 - Episode 15 - Post Episode Discussion
"https://preview.redd.it/qw23k171908f1.jpeg?width=3024&format=pjpg&auto=webp&s=d8cb75de92e622be83cc69bd6f75e362e1716921

Hannah was like “I’m screwed”",70,1750391653.0,Particular-Ad5787,1lfsbxo,Season 7 - Episode 15 - Post Episode Discussion
"Huda twerking it DOWN, everyone forgot all the atrocities for that brief moment",63,1750399190.0,basicbitchfries,1lfsbxo,Season 7 - Episode 15 - Post Episode Discussion
Lol I know Hannah wanted to throw up when Pepe started speaking Spanish to the new girl. That man is gone gone lol.,66,1750406383.0,Historical-Task1898,1lfsbxo,Season 7 - Episode 15 - Post Episode Discussion
am i the only one that thinks austin isn’t into amaya? my queen needs a new man immediately,295,1750385305.0,thxuand,1lfsbxo,Season 7 - Episode 15 - Post Episode Discussion
