comment,score,created_utc,author,episode_post_id,episode_title
Hate for her is forced,16,1750388490.0,eeyevoree,1lfsbxo,Season 7 - Episode 15 - Post Episode Discussion
I think she’s just an airhead and she piggybacks off people to match their energy. It’s giving Karen from Mean Girls. I don’t see it as trying too hard but I understand what you mean.,8,1750388369.0,mambaspice,1lfsbxo,Season 7 - Episode 15 - Post Episode Discussion
No I think she’s just being herself,5,1750389346.0,lynotyourwifey,1lfsbxo,Season 7 - Episode 15 - Post Episode Discussion
Yep,1,1750388515.0,tpauly0225,1lfsbxo,Season 7 - Episode 15 - Post Episode Discussion
She reminds me of I Love Lucy,1,1750389484.0,MulberryRow,1lfsbxo,Season 7 - Episode 15 - Post Episode Discussion
I actually said that when she was talking to Austin. Only time I got that vibe,1,1750388516.0,revanevan7,1lfsbxo,Season 7 - Episode 15 - Post Episode Discussion
Who?,9,1750389111.0,kelekele27,1lfsbxo,Season 7 - Episode 15 - Post Episode Discussion
he’s very ugly when you find out what ideology he subscribes to,13,1750386381.0,31cats,1lfsbxo,Season 7 - Episode 15 - Post Episode Discussion
hes not ugly but its disappointing as hell to look them up and they arent even self aware enough to clean up their damn ig. following andrew tate??? in this day and age???,11,1750386391.0,Ok_Yogurt3128,1lfsbxo,Season 7 - Episode 15 - Post Episode Discussion
"How is it forced if it’s true for TJ? Pepe, Charlie, and Jalen are all veryyyyy handsome. 🫦",8,1750386564.0,Designer-Ad7341,1lfsbxo,Season 7 - Episode 15 - Post Episode Discussion
"SO FORCED!!!

Pepe is fine as hell and even people were calling him ugly smh",0,1750386394.0,Curlingby,1lfsbxo,Season 7 - Episode 15 - Post Episode Discussion
that’s actually pretty cheaper than i was expecting 😭,2,1750387593.0,ribbcns,1lfsbxo,Season 7 - Episode 15 - Post Episode Discussion
"this is my first season too! tiktok clips of Huda made watch it lol but i do feel really bad for her at times because Jeremiah really was writing checks he couldn’t cash recklessly, and she clearly has a super insecure attachment style",0,1750408329.0,OrcaLuvr123,1lfsbxo,Season 7 - Episode 15 - Post Episode Discussion
Why do you love her so much,16,1750445792.0,InterviewWeary5708,1lfsbxo,Season 7 - Episode 15 - Post Episode Discussion
"good point! between all the CereVe, bikini lines, and makeup products i can’t stand how in my face it is",1,1750388891.0,Several_Sky_6249,1lfsbxo,Season 7 - Episode 15 - Post Episode Discussion
I disagree. Nic had several conversations with iris & Cierra also talked to pepe,16,1750390439.0,Brilliant_Chemical10,1lfsbxo,Season 7 - Episode 15 - Post Episode Discussion
This just isn’t true?  Nic talked with Cierra and Iris as bombshells and Cierra got pulled by Pepe and talked to almost every male when she entered (and every male but Jeremiah stood up for a chance with her).  Then to end your statement wishing Nic was still just with his original coupling ?  What are you even asking for?,7,1750390864.0,AllStarSpecial10001,1lfsbxo,Season 7 - Episode 15 - Post Episode Discussion
"They have spoken to the other bombshells and expressed wanting to get to know them. Nic had a chat with iris and cierra with pepe, and they both were open to them. I think we can also let go of belle-a, she's long gone lol",6,1750390950.0,cabbagemuncher101,1lfsbxo,Season 7 - Episode 15 - Post Episode Discussion
Any cuteness he may have had is immediately erased by him followimg Andrew Tate.,4,1750388325.0,SuspiciousCranberry6,1lfsbxo,Season 7 - Episode 15 - Post Episode Discussion
Nic and Cierra are boring to me and I think they’re both low key looking for something better,14,1750386426.0,Jealous-Original1968,1lfsbxo,Season 7 - Episode 15 - Post Episode Discussion
We need nicolandriaaaaa,1,1750387483.0,Civil-Department-347,1lfsbxo,Season 7 - Episode 15 - Post Episode Discussion
"Yeah sorry, creeping outside the door eavesdropping followed by interrupting their chat is just more of the same for her. They’re in the same villa, there’s plenty of opportunity for her to have a closure talk when it isn’t interrupting. 

Plus the whole thing stunk of guilt trip and she tried to kiss him 🫣",9,1750385710.0,Neusch22,1lfsbxo,Season 7 - Episode 15 - Post Episode Discussion
I’m not okay with irrational hatred of any islander but I find that most people who ride hard for her are the ones who relate to her anger,6,1750385605.0,Maleficent-Orchid755,1lfsbxo,Season 7 - Episode 15 - Post Episode Discussion
"I don’t think it’s an irrational hatred. We got to see how basically everyone was over her and her attitude today. They all had comments about not wanting to hear about it. 

A closure conversation wasn’t it the issue. It’s how she went about it. It’s her inability to think of any situation from anyone else’s perspective. Clearly it wasn’t a good choice to do it when she did as several people told her so. Taylor went to check in on how it was going. 

I think she’s just been given too many chance. This post again is saying “yea she shouldn’t have done this… but… let’s forgive her”. She’s had too many chances imo. 

Besides that though it was a good episode. Needed some positive energy… Austin dancing… 🤣",6,1750385686.0,bologna_fingers,1lfsbxo,Season 7 - Episode 15 - Post Episode Discussion
Huda has called every new bombshell girl a bitch and gossips that they aren’t girl’s girls. She made rude faces whenever a girl got close to jeremiah. She crashed out and screamed across the villa that jeremiah was a “pussy” a “bitch” etc. she confronted iris in such a way that pepe and jalen were worried for iris’ safety. She secretly listens to conversations she’s not a part of then proceeds to cherry pick the things she hears to tell others. She has been toxic since the early days. This is a literal game show and it hasn’t even been that long.,6,1750386344.0,Guhbrew,1lfsbxo,Season 7 - Episode 15 - Post Episode Discussion
Agreed,2,1750385682.0,Fancytingslikecheeze,1lfsbxo,Season 7 - Episode 15 - Post Episode Discussion
"Not only that, but I thought it was disgusting the way Jeremiah and Iris were shitting on her together in the speakeasy. Like focus on your so-called “connection” and rise above it.",1,1750386070.0,KDSD628,1lfsbxo,Season 7 - Episode 15 - Post Episode Discussion
"I am getting short vibes from him too, lol

Do you think he is taller than Ace or not?",2,1750388049.0,Separate-Smile-9745,1lfsbxo,Season 7 - Episode 15 - Post Episode Discussion
I think he's hot as hell ... not sure what people are smoking.,2,1750390764.0,lukaeber,1lfsbxo,Season 7 - Episode 15 - Post Episode Discussion
"Seriously, they just love to hate watch her when there were so many other fun things that happened this episode to discuss 😵‍💫",-1,1750391121.0,Ordinary-Shelter6184,1lfsbxo,Season 7 - Episode 15 - Post Episode Discussion
They will discuss a riveting game of uno…coursing find more boring people it’s crazy,1,1750390944.0,Mindless_Ad5823,1lfsbxo,Season 7 - Episode 15 - Post Episode Discussion
Def watch the last 3 episodes. It’s generational reality tv crash out material.,12,1750385021.0,Impossible-Pizza2994,1lfsbxo,Season 7 - Episode 15 - Post Episode Discussion
America split them up and she crashed out,4,1750385074.0,IdiditfordaRock25,1lfsbxo,Season 7 - Episode 15 - Post Episode Discussion
Just go read anything on this subreddit….,1,1750385298.0,Spiritual_Pizza40,1lfsbxo,Season 7 - Episode 15 - Post Episode Discussion
"If that man was really out to win it, he would’ve been Huda’s lap dog like she wanted. Please stop with this narrative.",6,1750390968.0,badbunnygirl,1lfsbxo,Season 7 - Episode 15 - Post Episode Discussion
Stop,13,1750386396.0,gtlgdp,1lfsbxo,Season 7 - Episode 15 - Post Episode Discussion
Loved seeing her glow during the challenge💓,2,1750386512.0,Curlingby,1lfsbxo,Season 7 - Episode 15 - Post Episode Discussion
I wanna see!!,1,1750389816.0,CJcorky,1lfsbxo,Season 7 - Episode 15 - Post Episode Discussion
This sentence gives me the ick i despise when attraction to a black women is referred to like this,10,1750435467.0,EmpireTikes,1lfsbxo,Season 7 - Episode 15 - Post Episode Discussion
No way,6,1750385997.0,Important-Promise10,1lfsbxo,Season 7 - Episode 15 - Post Episode Discussion
TRUST people will see our vision by the end of the season,-19,1750387285.0,Curlingby,1lfsbxo,Season 7 - Episode 15 - Post Episode Discussion
Breaks the 4th wall? You mean how the islanders constantly reference “America”?,12,1750396548.0,Due_Service8731,1lfsbxo,Season 7 - Episode 15 - Post Episode Discussion
I think people had issue because she again interrupted Iris and her conversation with Jeremiah,27,1750405130.0,vanessamoth,1lfsbxo,Season 7 - Episode 15 - Post Episode Discussion
I agree with you but also see it as line could she not just wait for the AM or when they're not chatting,12,1750405207.0,GiftRecent,1lfsbxo,Season 7 - Episode 15 - Post Episode Discussion
Your flair 😄 🤣  I didn't even read what you said it had me hollering so much,1,1750412209.0,codingcrystal,1lfsbxo,Season 7 - Episode 15 - Post Episode Discussion
Instead of downvoting how about answering the question 🎤,-3,1750404755.0,Admirable_Writer354,1lfsbxo,Season 7 - Episode 15 - Post Episode Discussion
Lol. Good one,9,1750388429.0,OldApricot944,1lfsbxo,Season 7 - Episode 15 - Post Episode Discussion
Did you watch the USA version?,9,1750388415.0,spikespiegell1,1lfsbxo,Season 7 - Episode 15 - Post Episode Discussion
They didn’t.,1,1750409995.0,LaughingAtNonsense,1lfsbxo,Season 7 - Episode 15 - Post Episode Discussion
Are you Andrew Tate or something?,1,1750388980.0,MulberryRow,1lfsbxo,Season 7 - Episode 15 - Post Episode Discussion
Sometimes I find myself liking Austin but then I remember his reposts on TikTok 😭,6,1750440535.0,Admirable_Writer354,1lfsbxo,Season 7 - Episode 15 - Post Episode Discussion
I don't like amaya at alllll,-8,1750440886.0,Slight-Cook1329,1lfsbxo,Season 7 - Episode 15 - Post Episode Discussion
Ace is a grifter 10000%,1,1750460499.0,Top-Cake7923,1lfsbxo,Season 7 - Episode 15 - Post Episode Discussion
Ace is great. He's the only realist here,-5,1750449060.0,Jaded_Performance713,1lfsbxo,Season 7 - Episode 15 - Post Episode Discussion
I did until Megan pointed out both her hands were on the same side of the puzzle and the camera zoomed in on it hahaha,15,1750391134.0,SQ-Pedalian,1lfsbxo,Season 7 - Episode 15 - Post Episode Discussion
Mamacita?,15,1750391478.0,jumponitrik,1lfsbxo,Season 7 - Episode 15 - Post Episode Discussion
Girl what? That’s interrupting the conversation. She asked the for spot iris was sitting in even while looking at the whole couch 💀,26,1750391540.0,bambimoony,1lfsbxo,Season 7 - Episode 15 - Post Episode Discussion
?? She literally did interrupt what,20,1750391462.0,TotalInstruction1957,1lfsbxo,Season 7 - Episode 15 - Post Episode Discussion
If two people are talking and you walk in and say “hey can I talk” you are interrupting the conversation.,14,1750391508.0,Ok_Artist_2092,1lfsbxo,Season 7 - Episode 15 - Post Episode Discussion
Yeah so that’s actually the definition of interrupting,15,1750391525.0,Neusch22,1lfsbxo,Season 7 - Episode 15 - Post Episode Discussion
“You can say no” Because everything Iris has seen from Huda so far totally indicates that Huda would have gracefully backed down and accepted her declining without flying off the handle?,8,1750391773.0,lilalolola,1lfsbxo,Season 7 - Episode 15 - Post Episode Discussion
"Well I would think they would sleep in the same villa.. how else would the film, produce, jump in (when need be), set up lunch/dinner, etc.. 

And how exactly is Iris part of the crew?",4,1750455089.0,trushmariehh,1lfsbxo,Season 7 - Episode 15 - Post Episode Discussion
What I will say is that Iris has seemed anywhere on a scale between ambivalent and annoyed about being there,2,1750454777.0,Shoddy-Designer-3740,1lfsbxo,Season 7 - Episode 15 - Post Episode Discussion
This honestly doesn’t surprise me.,1,1750455638.0,Firm-Armadillo2188,1lfsbxo,Season 7 - Episode 15 - Post Episode Discussion
"she didn’t get booted, she passed out from heat exhaustion + was throwing up. she’ll be on Aftersun this week!",10,1750387555.0,GEMINl13,1lfsbxo,Season 7 - Episode 15 - Post Episode Discussion
I doubt Paige was judging a twerking contest..,2,1750388295.0,Ok_Reporter_8350,1lfsbxo,Season 7 - Episode 15 - Post Episode Discussion
reread what you just said for me,2,1750435269.0,YourDadsHouse11,1lfsbxo,Season 7 - Episode 15 - Post Episode Discussion
“Misogyny” and “don’t see bad” are words and phrases that should never go together lol,2,1750435281.0,TomatilloNo5269,1lfsbxo,Season 7 - Episode 15 - Post Episode Discussion
Girl take your chaos self to temptation island lol,4,1750387322.0,Queasy-Net-8324,1lfsbxo,Season 7 - Episode 15 - Post Episode Discussion
i feel like its over but if the new bombshell isn’t interested in jeremiah and iris moves on then maybe. its still a game show and they would want to survive on the show,3,1750387091.0,kaguraa,1lfsbxo,Season 7 - Episode 15 - Post Episode Discussion
"I really truly did love them together and it hurts my heart knowing they’re not together anymore, and I do want them to get back together but like…. way down the road like, in a way healthier way obviously. it would be really romantic but also i hate the way things went with them like hudas reactions are too far gone for that to happen honestly",-1,1750387081.0,Perfect_Top_4565,1lfsbxo,Season 7 - Episode 15 - Post Episode Discussion
"Yes, delusional",0,1750387624.0,littleewanderer,1lfsbxo,Season 7 - Episode 15 - Post Episode Discussion
nope I’m delusional too but not sure how everything is going to play out. they will just isolate away from everyone again. like they did before belle-a confirmed that.,0,1750387900.0,Outrageous_Ad6776,1lfsbxo,Season 7 - Episode 15 - Post Episode Discussion
wym it was so much fun and the boys were so funny,10,1750387630.0,Marguerite8,1lfsbxo,Season 7 - Episode 15 - Post Episode Discussion
all that ass jumping around and you were cringed out? wow.,8,1750387657.0,hopepeacelove1,1lfsbxo,Season 7 - Episode 15 - Post Episode Discussion
he’s a grown man what makes him “just stupid”,4,1750393393.0,Aggressive-Fix4803,1lfsbxo,Season 7 - Episode 15 - Post Episode Discussion
It’s not a stretch. He’s Gen z and he literally follows them,7,1750393228.0,Valuable-League-645,1lfsbxo,Season 7 - Episode 15 - Post Episode Discussion
But Ace and Taylor being terrible people is facts and yesss lmaooo,2,1750393458.0,KindaTomas,1lfsbxo,Season 7 - Episode 15 - Post Episode Discussion
"You’ve lost me ngl 😭 if my conversation was interrupted like that then I too would have gone to my friend and told her what just happened + I’m pretty sure Jeremiah brought it up to clear the air bc Taylor saw them and gave them a look. Jeremiah even said out loud, when talking about it to the boys, “because someone came in and interrupted”",30,1750409940.0,d1ond1on,1lfsbxo,Season 7 - Episode 15 - Post Episode Discussion
i rebuke this pls don’t speak this out in the universe,1,1750388467.0,lovebbygrapes,1lfsbxo,Season 7 - Episode 15 - Post Episode Discussion
"*in couples therapy, not on my screen",1,1750388905.0,Glittering-Bus-9971,1lfsbxo,Season 7 - Episode 15 - Post Episode Discussion
are we talking about the same Iris and the same TJ ?????,17,1750389626.0,stardustlovrr,1lfsbxo,Season 7 - Episode 15 - Post Episode Discussion
I thought him and Iris and the new girl with Jeremiah,3,1750389655.0,CJcorky,1lfsbxo,Season 7 - Episode 15 - Post Episode Discussion
Corny ahh,3,1750384995.0,Bebbybeb1,1lfsbxo,Season 7 - Episode 15 - Post Episode Discussion
I think they just picked the girls with the biggest butts lol,10,1750387188.0,Curlingby,1lfsbxo,Season 7 - Episode 15 - Post Episode Discussion
"There’s a chance they got to pick which one they wanted to do, or decided as a team or something",7,1750387112.0,Tacobelle_90,1lfsbxo,Season 7 - Episode 15 - Post Episode Discussion
They probably got to choose which challenge they wanted to do,6,1750387169.0,bootyandpeaches,1lfsbxo,Season 7 - Episode 15 - Post Episode Discussion
Because y’all usually twerk better than all the other races take it as a compliment why tf yall try finding a problem in everything. the other ones most likely weren’t worth the screen time,8,1750387138.0,MrSuperBlooper,1lfsbxo,Season 7 - Episode 15 - Post Episode Discussion
I assume they got to choose who did which challenge.,6,1750387242.0,tbhjustbored,1lfsbxo,Season 7 - Episode 15 - Post Episode Discussion
"with all due respect, please get those eyes checked 😂",22,1750394157.0,JulienGianni,1lfsbxo,Season 7 - Episode 15 - Post Episode Discussion
"https://preview.redd.it/mcn5zghwg08f1.jpeg?width=1284&format=pjpg&auto=webp&s=5c3f6bb7f4faa5c53fdfb93083eb8a32024d5dbb

Now what does ‘meh’ mean to you?",22,1750394311.0,AnotherAnon688264759,1lfsbxo,Season 7 - Episode 15 - Post Episode Discussion
https://preview.redd.it/06vkz5amg08f1.jpeg?width=884&format=pjpg&auto=webp&s=eda4e322b55762339f84df4923a0782b063bdf0a,15,1750394195.0,JacquesTheHawk,1lfsbxo,Season 7 - Episode 15 - Post Episode Discussion
She’s so fire you’re not doing well,13,1750394253.0,No_Peach1605,1lfsbxo,Season 7 - Episode 15 - Post Episode Discussion
Nah. Easily one of the most gorgeous in LI USA. Another one is Flo of Casa Amor in season 3.,4,1750394617.0,Lovieloony,1lfsbxo,Season 7 - Episode 15 - Post Episode Discussion
Jeremiah went for the awkward second hug too lol he totally saw what she was trying to do. So glad he’s finally standing up for himself.,188,1750387875.0,BeckBristow89,1lfsbxo,Season 7 - Episode 15 - Post Episode Discussion
Yup. Generational run of toxicity,49,1750388401.0,Extra-Cap2029,1lfsbxo,Season 7 - Episode 15 - Post Episode Discussion
"I do like when Jeremiah said after that talk if she tries to pull him for any more chats, he’s  going to have to politely decline. He’s got the message.",100,1750386834.0,TinyEmployment8020,1lfsbxo,Season 7 - Episode 15 - Post Episode Discussion
"Tbf I don't think anyone can match Amaya's energy.

my bigger worry is that I genuinely don't think Austin has finished a single sentence when talking to Amaya. She's constantly talking over him.",114,1750387476.0,Simple-Motor-2889,1lfsbxo,Season 7 - Episode 15 - Post Episode Discussion
I’m not convinced either is that into the other. I think they’re each others life rafts for the moment.,36,1750388226.0,CeeFourecks,1lfsbxo,Season 7 - Episode 15 - Post Episode Discussion
"I thought that too but then I also thought he was probably tired, it felt like a long night and everyone looked kind of sleepy ",10,1750388977.0,shopgirlnyc3,1lfsbxo,Season 7 - Episode 15 - Post Episode Discussion
Ya I thought the same. I hope not because I can’t see her hurt that would be so upsetting,22,1750387084.0,Popular-Difficulty29,1lfsbxo,Season 7 - Episode 15 - Post Episode Discussion
She's kinda just like that though lol I think with anyone she latches her focus on,2,1750418531.0,Nwildcat,1lfsbxo,Season 7 - Episode 15 - Post Episode Discussion
"That would be my fun fact for the rest of my life, my IG bio, maybe even add it to my resume",107,1750385818.0,Tacobelle_90,1lfsbxo,Season 7 - Episode 15 - Post Episode Discussion
i’d get so big headed,43,1750385345.0,Early_Entertainer11,1lfsbxo,Season 7 - Episode 15 - Post Episode Discussion
no literally,30,1750386673.0,Full_Market_5298,1lfsbxo,Season 7 - Episode 15 - Post Episode Discussion
I loved her episodes 1-4 but how are people still riding for her over other islanders,44,1750390614.0,kentoddsbiggestfan,1lfsbxo,Season 7 - Episode 15 - Post Episode Discussion
Lowkey wish she paid more attention to the fact that a tattoo of his own name covers half of his back,29,1750391304.0,meriendaselgato,1lfsbxo,Season 7 - Episode 15 - Post Episode Discussion
"lol please let it rest. Who is she going to leave him for? Y’all keep acting like she has options. She’s open to the bombshells when they walk in but in case you haven’t noticed, nobody else has tried pulling her for chats besides Ace (and Austin who she initially coupled up with). Austin didn’t care that much for her either. He didn’t even try to kiss her lol and he was down Amaya’s throat within 3 hours of meeting her. Oh yeah he also planned a whole private meditation session for Amaya but couldn’t drum up the initiative to do anything for Chelley until someone gave him the idea after Ace put pressure on him.
So please give that girl a rest. Talmabout “how many times will she let him embarrass her”. Where are her options??? Where???",2,1750396208.0,TalkToMeNice100,1lfsbxo,Season 7 - Episode 15 - Post Episode Discussion
i hope they bring some heavy hitters for casa because most of these girls need their heads turned,50,1750386981.0,Phone_home22,1lfsbxo,Season 7 - Episode 15 - Post Episode Discussion
Ace is literally a minion next to Andreina. ,17,1750393350.0,Busy-Economics-4816,1lfsbxo,Season 7 - Episode 15 - Post Episode Discussion
I mean she wasn’t wrong lol,3,1750398400.0,Valuable-League-645,1lfsbxo,Season 7 - Episode 15 - Post Episode Discussion
"https://preview.redd.it/v86fp05lsz7f1.jpeg?width=1161&format=pjpg&auto=webp&s=a18b61253b27ea210892c753c078732d75d8301c

Like “WE JUST TALKED ABOUT THIS SHIT”🤣🤣",495,1750386127.0,AdvisorContent7778,1lfsbxo,Season 7 - Episode 15 - Post Episode Discussion
the real mom & dad of the villa now,136,1750386081.0,Realistic-Nobody-64,1lfsbxo,Season 7 - Episode 15 - Post Episode Discussion
I also liked that he went to check in when Jeremiah and Huda were in the Speakeasy.,67,1750385911.0,soup4breakfast,1lfsbxo,Season 7 - Episode 15 - Post Episode Discussion
Im kinda stunned that of ALL people Taylor was the one to hold Huda accountable. I would’ve assumed it would be Ace or Nic but damn Taylor stepped up. In front of his girl and not in front of her I KNOW Olandria loved it.,50,1750387640.0,BeckBristow89,1lfsbxo,Season 7 - Episode 15 - Post Episode Discussion
"I don’t like him romantically for Olandria but I don’t understand the contempt and vitriol for him on this sub. Dude is chill asf, is a walking meme and there’s a reason both the boys and girls respect him and go to him with their baggage. Always measured and level headed.",24,1750390033.0,neongem,1lfsbxo,Season 7 - Episode 15 - Post Episode Discussion
He's fine. He's just obviously not really into Olandria. She deserves better.,3,1750390535.0,lukaeber,1lfsbxo,Season 7 - Episode 15 - Post Episode Discussion
This!!,4,1750385273.0,AdvisorContent7778,1lfsbxo,Season 7 - Episode 15 - Post Episode Discussion
Yes! I hated that. It’s like a toddler who keeps misbehaving because they think the adults find it cute,1,1750428784.0,SydTheStreetFighter,1lfsbxo,Season 7 - Episode 15 - Post Episode Discussion
olandria did tell her to stop being mean to iris! but i wish it was addressed more directly… i also really thought huda was going to pull iris for a chat to apologize NOT KICK HER OUT AND TRY TO KISS JEREMIAH 😭,318,1750385061.0,neuroticneurolover,1lfsbxo,Season 7 - Episode 15 - Post Episode Discussion
Olandria told her that. We don’t see every minute of a conversation.,92,1750385003.0,Top_Dentist2464,1lfsbxo,Season 7 - Episode 15 - Post Episode Discussion
"Huda already had apologized to Iris for that, so it didn’t need to be resaid",-17,1750388346.0,KDSD628,1lfsbxo,Season 7 - Episode 15 - Post Episode Discussion
"I think because she was in the second round (limbo), same with Hannah and Iris!",7,1750389418.0,birdnoa,1lfsbxo,Season 7 - Episode 15 - Post Episode Discussion
If they become a dynamic best friend duo I would eat it uppppp,25,1750389307.0,birdnoa,1lfsbxo,Season 7 - Episode 15 - Post Episode Discussion
she did not look happy when Andreina came in,2,1750395094.0,AlienTracker2000,1lfsbxo,Season 7 - Episode 15 - Post Episode Discussion
Jeremiah said that was cool too! They have an understanding.,49,1750387393.0,Complex-Present3609,1lfsbxo,Season 7 - Episode 15 - Post Episode Discussion
exactly this!,2,1750442231.0,ces_bravodocket,1lfsbxo,Season 7 - Episode 15 - Post Episode Discussion
not that it would be toxic of her to go for the bombshell at all…,29,1750392942.0,Chromure215,1lfsbxo,Season 7 - Episode 15 - Post Episode Discussion
I wish they did the stand up if you want to recouple thing they did with cierra and see if he gets up,61,1750385625.0,bingewatcher101,1lfsbxo,Season 7 - Episode 15 - Post Episode Discussion
"Yupp, the producers mix up the confessional tapes to cause more drama. You never know what’s real and what’s not",52,1750386300.0,Possible_Phone_4019,1lfsbxo,Season 7 - Episode 15 - Post Episode Discussion
"As we’ve seen already, that’s not enough to keep a man",54,1750387971.0,Carolina_Blues,1lfsbxo,Season 7 - Episode 15 - Post Episode Discussion
are we talking about the spit in hand thing ? cuz I gagged,6,1750403571.0,WisdomOtter,1lfsbxo,Season 7 - Episode 15 - Post Episode Discussion
It's really hard to tell if they're actually close or if Huda just thinks they're close because Taylor just shuts up when she's talking to him because he doesn't feel like dealing with her shit. There's been multiple instances of Huda complaining to Taylor and he's just looked bored lol.,27,1750387924.0,Simple-Motor-2889,1lfsbxo,Season 7 - Episode 15 - Post Episode Discussion
"The body is beyond tea, its NUCLEAR 🤯",81,1750385498.0,Illustrious-Insect26,1lfsbxo,Season 7 - Episode 15 - Post Episode Discussion
yea “foreign latina”. but tbh she’s everyone’s type,19,1750394850.0,Early_Entertainer11,1lfsbxo,Season 7 - Episode 15 - Post Episode Discussion
shipping her with chelley or cierra bc for real!,25,1750390307.0,moonprincess642,1lfsbxo,Season 7 - Episode 15 - Post Episode Discussion
