comment,score,created_utc,author,episode_post_id,episode_title
i liked the competition for new a bomshell that was cute! TJ is a cutie! i also liked the fact that they still brought in the other bombshell cus at the end of the day it’s not survivor or big brother but it’s was still some fun competition! i also rlly liked that we got to see more of the other couples today!,12,1750386199.0,CookieCrispes,1lfsbxo,Season 7 - Episode 15 - Post Episode Discussion
all of the girls (including the new bombshell) are GORGEOUSSSS what did the boys do to deserve this 😩,14,1750386235.0,Fit-Bonus353,1lfsbxo,Season 7 - Episode 15 - Post Episode Discussion
Why do I have so many mutuals with TJ lmao,12,1750386416.0,Mediocre_Kale711,1lfsbxo,Season 7 - Episode 15 - Post Episode Discussion
slow burn this friendship that.. i love that for u guys and respect it but i will always relate to the horny girls who are kinda slutty (complimentary) and that's why i'm ride or die for hannah,13,1750386803.0,sprgraphicultramodrn,1lfsbxo,Season 7 - Episode 15 - Post Episode Discussion
"https://preview.redd.it/f7xkuutruz7f1.jpeg?width=3295&format=pjpg&auto=webp&s=85d304f2c210b43973ae564adf3bc162e7f9f88e

??? 🤦🏾🤦🏾🤦🏾🤦🏾",13,1750386849.0,Sung__Jin-W00,1lfsbxo,Season 7 - Episode 15 - Post Episode Discussion
absolutely losing it at the dancing part. taylor had me dead,13,1750387382.0,SupRamadanSteve_,1lfsbxo,Season 7 - Episode 15 - Post Episode Discussion
wait guys hear me out casa amor cierra and chelley will be without the guys and usually they have games during casa amor 😔,13,1750389453.0,ribbcns,1lfsbxo,Season 7 - Episode 15 - Post Episode Discussion
The boys are hilarious. Best episode!!!,12,1750390152.0,swazon500,1lfsbxo,Season 7 - Episode 15 - Post Episode Discussion
over 5700 comments -- POST EPISODE. WOW,11,1750401345.0,gluemanmw,1lfsbxo,Season 7 - Episode 15 - Post Episode Discussion
none of the guys deserve the new bombshell give her to chelley,54,1750385956.0,Acrobatic-Grocery387,1lfsbxo,Season 7 - Episode 15 - Post Episode Discussion
"Im sorry, but they needed a tall, fine, tatted black guy to really have the girls drooling. Tj Maxx ain't do nooooothing for me.",54,1750387486.0,ChiTaurus,1lfsbxo,Season 7 - Episode 15 - Post Episode Discussion
Chelley and Ace scenes are so skippable,61,1750398948.0,vanessamoth,1lfsbxo,Season 7 - Episode 15 - Post Episode Discussion
huda start packing those bags mama,26,1750384949.0,foundsolace,1lfsbxo,Season 7 - Episode 15 - Post Episode Discussion
Huda and Olandria killed that challenge,25,1750385078.0,cape_buffalo09,1lfsbxo,Season 7 - Episode 15 - Post Episode Discussion
I was actually considering giving up on this season bc I was so disappointed they saved Huda and bc I was so sure it would become Ace/Chelley island - this episode redeemed it fully for me!,21,1750385665.0,Cinemaniacc,1lfsbxo,Season 7 - Episode 15 - Post Episode Discussion
Tonight’s episode was FUN!!!! More of these pleaseeeee!!!! I’m also hoping Meg knocked some sense in Huda from an outsider & hot girl perspective plssssss give her a bombshell,27,1750385740.0,Please-Hold-The,1lfsbxo,Season 7 - Episode 15 - Post Episode Discussion
I don’t think they’ve ever had this many Hispanic people on a season before.,26,1750385809.0,Mangoandcashew,1lfsbxo,Season 7 - Episode 15 - Post Episode Discussion
That male bombshell…… well he’s there 😕,25,1750385959.0,Free-Battle9854,1lfsbxo,Season 7 - Episode 15 - Post Episode Discussion
dude they better make me gasp for the casa men.,26,1750386136.0,VanillaOk4286,1lfsbxo,Season 7 - Episode 15 - Post Episode Discussion
"https://preview.redd.it/kh14knsosz7f1.jpeg?width=3128&format=pjpg&auto=webp&s=c82b55d9e28d442100e8beeabf9f5384394ecb89

austin after amaya’s dance",28,1750386155.0,Formal_Piano_8834,1lfsbxo,Season 7 - Episode 15 - Post Episode Discussion
Where is my Miguel level bombshell. I’m so tired,28,1750386169.0,Outrageous-Hunter-12,1lfsbxo,Season 7 - Episode 15 - Post Episode Discussion
huda really needs to stop with those b words fr,27,1750386218.0,thrrowwwawayyyyy,1lfsbxo,Season 7 - Episode 15 - Post Episode Discussion
"There's never going to be a bombshell for Huda. After tonight's bombshell, I realized that. He's gonna go straight for Iris ",24,1750386286.0,Pizzaface1993,1lfsbxo,Season 7 - Episode 15 - Post Episode Discussion
amayas one liners always kill me. shes definitely grown on me 😭,27,1750386324.0,Ok_Yogurt3128,1lfsbxo,Season 7 - Episode 15 - Post Episode Discussion
I also love how Megan was able to converse with the girls so naturally. It didn’t seem awkward at all and the way she gave the girls a little encouragement🥹🥹🥹,28,1750386385.0,MysteriousResearch86,1lfsbxo,Season 7 - Episode 15 - Post Episode Discussion
Chelly was robbed of that win I can’t even lie 😢😢,24,1750386385.0,Commercial_Mud8004,1lfsbxo,Season 7 - Episode 15 - Post Episode Discussion
"US producers ate with this one. They NEEDED this after keeping huda on the island

https://preview.redd.it/zpuvtvmqtz7f1.jpeg?width=1284&format=pjpg&auto=webp&s=9a50a15ef57d49613fcc2b1cd6ac39b739611765",26,1750386501.0,KlutchSama,1lfsbxo,Season 7 - Episode 15 - Post Episode Discussion
it’s kinda nice to see huda playing nice with the bombshell,25,1750386529.0,Chemical_Range5333,1lfsbxo,Season 7 - Episode 15 - Post Episode Discussion
"This was so fun to watch! I was cheesin the whole time Meg was there, she was having such a blast. Our hearts needed this light episode lol",25,1750386646.0,Outside-Carpet7479,1lfsbxo,Season 7 - Episode 15 - Post Episode Discussion
Jalen was a fine ass bombshell but yall want lanky boys and don’t want football players 😫 we losing recipes,27,1750386718.0,Beyoncespinkytoe,1lfsbxo,Season 7 - Episode 15 - Post Episode Discussion
"https://preview.redd.it/9ocdie8buz7f1.jpeg?width=1125&format=pjpg&auto=webp&s=92be72af050ab83ebc140fba485bfc4b8d28a18f

Jeremiah about to forget about Iris SO fast",25,1750386728.0,9500140351,1lfsbxo,Season 7 - Episode 15 - Post Episode Discussion
TJ better have a good personality 😒 cause what is this,26,1750386928.0,Independent-Dog2247,1lfsbxo,Season 7 - Episode 15 - Post Episode Discussion
We didn't know ANYTHING about Jeremiah until his conversation with Iris and we hadn't seen Huda be so cheerful and happy this whole time. I actually love the fact they ended,25,1750387210.0,spikespiegell1,1lfsbxo,Season 7 - Episode 15 - Post Episode Discussion
Ace had no problem fittin under that damn bar,24,1750387227.0,UnderstandingLong630,1lfsbxo,Season 7 - Episode 15 - Post Episode Discussion
I'm proud of Jeremiah for standing firm in his boundaries and declining chats from Huda. I hope he sticks to that,24,1750387236.0,noprah_winfrey,1lfsbxo,Season 7 - Episode 15 - Post Episode Discussion
They just released the biggie baddie In love island history. Dominican shorty is the definition of a bomb shell,23,1750387272.0,LilChopCheese,1lfsbxo,Season 7 - Episode 15 - Post Episode Discussion
pepe and andreina couple would be deadly looks-wise,24,1750387426.0,credditcardyougotit,1lfsbxo,Season 7 - Episode 15 - Post Episode Discussion
Sorry but I do not care if TJ goes for Iris. Sweet girl but I hate when bombshells I don’t care much about go for other bombshells I don’t care much,27,1750387636.0,Odd_Nefariousness_53,1lfsbxo,Season 7 - Episode 15 - Post Episode Discussion
"Tonight’s episode was so fun!!! It was nice to see Huda actually smile and have fun with everyone. I hope we see more of this lighthearted side. TJ is cute but not hot if that makes sense. Adriena is so badddd ngl, she’s 🔥",25,1750388229.0,hitthatwoah3000,1lfsbxo,Season 7 - Episode 15 - Post Episode Discussion
"You think Hannah’s bad, yall have no idea what I’d do with Nic in a bed, cameras and everything",23,1750389002.0,Queen1taurus2,1lfsbxo,Season 7 - Episode 15 - Post Episode Discussion
"am i the only one that just straight up doesn’t have an opinion on nic and cierra?? like we haven’t seen a one on one convo the last 4 episodes… besides tonight and it was less than a minute. last time we saw them was in a group convo talking about huda. 

like can we see more so we can get an accurate reading on them?!?! so many couples were getting pushed behind the huda and jeremiah drama and i’m hoping we’ll see more now that it’s over (?)",25,1750389012.0,bentleyrocks2,1lfsbxo,Season 7 - Episode 15 - Post Episode Discussion
chelley saw an opportunity with that lady and she took it,24,1750389632.0,meatpotpie,1lfsbxo,Season 7 - Episode 15 - Post Episode Discussion
ANDREINA… NOW THATS HOW YOU BOMBSHELL!!!! the men aren’t deserving at all,23,1750389989.0,rvdicxll,1lfsbxo,Season 7 - Episode 15 - Post Episode Discussion
the chemistry between these couples is lacking this season,29,1750390286.0,OriginalKale2854,1lfsbxo,Season 7 - Episode 15 - Post Episode Discussion
I looked up TJ’s story on Instagram and all his friends were having watch parties for him. If he has THAT many friends who are hosting watch parties for him all over the country I am expecting a big personality here. Bc no offense Andreina blew him out of the water in terms of the looks department.,25,1750390605.0,kaIeidoscope-,1lfsbxo,Season 7 - Episode 15 - Post Episode Discussion
"I'm not worried for Hannah, yeah Pepe is obviously going to be interested in the bombshell but she's going to have her pic out of all the boys and I don't see her picking a balding man over Nic or Jeremiah respectfully. 

He also has fully icked me out by being that down bad after you just slept with a different girl not to mention the stuff going around tiktok about him.",23,1750390922.0,Extreme_Awareness198,1lfsbxo,Season 7 - Episode 15 - Post Episode Discussion
And ik ace / chelley not together at all very much still exploring but the way he acts with the bombshells is so icky when Chelley right there…,24,1750392047.0,Jazzlike-Hall7987,1lfsbxo,Season 7 - Episode 15 - Post Episode Discussion
Have y’all seen Jeremiah’s book reviews? Now look at Andreina’s IG. If they’re not gonna match up well I have no more hope for this villa,23,1750392385.0,rhgreh,1lfsbxo,Season 7 - Episode 15 - Post Episode Discussion
"I look back and think about my younger self and how chaotic I used to be in relationships and dating and I've been diabolical and toxic so many times in my younger years. I'm 26 now but even just 4 years ago, I had so many moments I'm so glad were not on my tv. I've fallen for men I've known shortly and sleeping with them only made things more intense. I feel for her. We all need therapy in some way. I loved that this episode felt less heavy. Thank you Megan queen ❤️💅🏼",25,1750393737.0,Kellytime1,1lfsbxo,Season 7 - Episode 15 - Post Episode Discussion
"Thank you Megan for restoring my show 

This week episodes have been draining so I’m glad that tonight was kind of a filler episode in a way to restore the balance. New bombshells and new storylines thank you GAWD 🙏🏽🫶🏼",28,1750394995.0,SeauxSurvivor,1lfsbxo,Season 7 - Episode 15 - Post Episode Discussion
Amaya is so funny haha. Said all that about Meg teaching her how to twerk only to have that weak grind? I was floored 😂😂. At least she can split though ,24,1750395948.0,TalkToMeNice100,1lfsbxo,Season 7 - Episode 15 - Post Episode Discussion
They better not do a recoupling until another male bombshell has entered because it better be the LADIES CHOICE this time,25,1750396624.0,Admirable_Writer354,1lfsbxo,Season 7 - Episode 15 - Post Episode Discussion
"The guys getting an incredible bombshell while the girls get dropped with a chopped man who follows Andrew Tate...


At least they got to hang out with Megan Thee Stallion tho 🥰",25,1750402382.0,Nightwing1852,1lfsbxo,Season 7 - Episode 15 - Post Episode Discussion
Why are all the men 5? Like cmon. It feels like all of them are in their early early twenties.,25,1750403506.0,Whoevershewantstobe,1lfsbxo,Season 7 - Episode 15 - Post Episode Discussion
Megan we see you we know who your fav islanders are 🤣 and same!!,22,1750405647.0,Admirable_Writer354,1lfsbxo,Season 7 - Episode 15 - Post Episode Discussion
Megan the stallion is such a bright personality and it was so amazing to see her bring up the energy of these girls! So amazing love her so much,26,1750405966.0,rachelthevegan,1lfsbxo,Season 7 - Episode 15 - Post Episode Discussion
"Nic had me crying laughing oh my god I LOVE
HIM LMFAO",28,1750406466.0,Admirable_Writer354,1lfsbxo,Season 7 - Episode 15 - Post Episode Discussion
When did being a “scammer” become a thing? Everyone comes on the show trying to get brand deals and followers out of it I don’t understand how yall decide some people are faking and some aren’t.,26,1750424301.0,SydTheStreetFighter,1lfsbxo,Season 7 - Episode 15 - Post Episode Discussion
andreina is soo pretty omg but when are we going to get a fine ass male bombshell😞,11,1750384922.0,Southern_Yak393,1lfsbxo,Season 7 - Episode 15 - Post Episode Discussion
We have come a looooong way from a rooftop in Las Vegas okay 😂 Meg was PERFECT! That’s my coach!!!!!,11,1750384958.0,_valiii,1lfsbxo,Season 7 - Episode 15 - Post Episode Discussion
Great episode!! Felt so light compared to the past 3,9,1750384960.0,itsbrinny,1lfsbxo,Season 7 - Episode 15 - Post Episode Discussion
This was a fun episode. A good change from the last 3 stressful ones.,12,1750385055.0,SolarBeam12,1lfsbxo,Season 7 - Episode 15 - Post Episode Discussion
The producers last episode “I know it’s toxic but we scheduled a twerk off with Meg the stallion and Huda is 2013 Miami heat lebron please for the love of god save her”,9,1750385447.0,ResetterofPasswords,1lfsbxo,Season 7 - Episode 15 - Post Episode Discussion
Who to say Jeremiah can’t get the bombshell. I don’t see him and Huda getting back to together if he pursue Andreina,10,1750385807.0,P149049,1lfsbxo,Season 7 - Episode 15 - Post Episode Discussion
Normally don’t pay attention to commercials but this one was pretty good. We needed an overall lighthearted ep like this!,10,1750386033.0,millenZslut,1lfsbxo,Season 7 - Episode 15 - Post Episode Discussion
I’m a little behind but were they just porking?,11,1750386223.0,BigfootTundra,1lfsbxo,Season 7 - Episode 15 - Post Episode Discussion
I feel like seeing how Jeremiah moves now that Iris is clearly moving to the new bombshell will reveal his character👀,11,1750386466.0,Curlingby,1lfsbxo,Season 7 - Episode 15 - Post Episode Discussion
"Just catching up, but damn Andreina is a bombshell for real!!",11,1750386468.0,_thatgirlfelicia,1lfsbxo,Season 7 - Episode 15 - Post Episode Discussion
[removed],21,1750386875.0,None,1lfsbxo,Season 7 - Episode 15 - Post Episode Discussion
"Oh America you Taylandria stan's you

https://preview.redd.it/qwh56ek0wz7f1.jpeg?width=1179&format=pjpg&auto=webp&s=ff3699a44ff416da9d4c94bd876dc87629747b27",11,1750387266.0,JacquesTheHawk,1lfsbxo,Season 7 - Episode 15 - Post Episode Discussion
I think they asked Chelley how she felt about Morris Chestnut in The Best Man and then used her answer to act like it was about the bombshell. Yep that’s the story I’m running with.,11,1750387287.0,RazzmatazzWitty4175,1lfsbxo,Season 7 - Episode 15 - Post Episode Discussion
ANDREINA OMFG 😍,11,1750387672.0,JuLayLeeBee,1lfsbxo,Season 7 - Episode 15 - Post Episode Discussion
Nic sounds like napoleon dynamite,11,1750387686.0,jizzmae,1lfsbxo,Season 7 - Episode 15 - Post Episode Discussion
at some point yall have to get over the charlie dumping 😭 what is this villianization of hannah omg. reminder that her and charlie were together for about a week she owes him nothing.,11,1750388027.0,okayawkward,1lfsbxo,Season 7 - Episode 15 - Post Episode Discussion
now these are bombshells 🥵🥵🥵,10,1750388081.0,meattrap,1lfsbxo,Season 7 - Episode 15 - Post Episode Discussion
I’m convinced heels were made to make twerking easier,10,1750388630.0,skycat88,1lfsbxo,Season 7 - Episode 15 - Post Episode Discussion
HANNAHHHHH GIRLL,11,1750388731.0,Candid_Ad5220,1lfsbxo,Season 7 - Episode 15 - Post Episode Discussion
The budget this season is insane omg !!,13,1750391036.0,LegalBlueberry1,1lfsbxo,Season 7 - Episode 15 - Post Episode Discussion
"Finally!! Winning a challenge means something! I mean it was like 1 minute before the other bombshell was introduced but still… I liked that there was a high stakes incentive to win. 

Loved Megan Thee Stallion as a game host. Episode 12 really is the turning point of the season because these past episodes have been so entertaining.",11,1750392917.0,B00B51nCal1f0rn1a,1lfsbxo,Season 7 - Episode 15 - Post Episode Discussion
i’m like actually praying the girls get sent away from casa… cause the girls staying last season changed everything,12,1750393447.0,Aggressive-Fix4803,1lfsbxo,Season 7 - Episode 15 - Post Episode Discussion
Oh this new bombshell andriena is eatinggg,13,1750400511.0,StrawberryOk7670,1lfsbxo,Season 7 - Episode 15 - Post Episode Discussion
TJ reminds me of CT from the challenge,9,1750403832.0,NovellaJokes,1lfsbxo,Season 7 - Episode 15 - Post Episode Discussion
Where is the Jeremiah reaction to the bombshell picture someone please,10,1750437672.0,w00f-w00ff,1lfsbxo,Season 7 - Episode 15 - Post Episode Discussion
Andrina standing next to TJ at the end PMO - literal goddess next to basic white bro,33,1750385147.0,alleztaylor,1lfsbxo,Season 7 - Episode 15 - Post Episode Discussion
I NEED MEG TO BE THE FULL TIME HOST!! Sorry Ariana love you girl,36,1750385362.0,Swimming_Antelope_51,1lfsbxo,Season 7 - Episode 15 - Post Episode Discussion
I think Meg thought about coupling up with Olandria and Cierra on her way out hahahaha,35,1750385530.0,h_june,1lfsbxo,Season 7 - Episode 15 - Post Episode Discussion
 The turn on Hannah already is crazy. This sub is very unserious 💀,32,1750385663.0,Queen1taurus2,1lfsbxo,Season 7 - Episode 15 - Post Episode Discussion
Dawg Austin has gotta be one of the funniest dudes to come on this show. He’s an absolute riot lmao,33,1750385777.0,Dear-Surprise1894,1lfsbxo,Season 7 - Episode 15 - Post Episode Discussion
Andreina is the hottest bombshell I've ever seen holy SHIT. I also love that she gave the girls so much attention when she came in. love her already-granted it may be cause she's so damn gorgeous,34,1750385903.0,Mammoth-Independent2,1lfsbxo,Season 7 - Episode 15 - Post Episode Discussion
YES IRIS!!!! KISS THAT BOMBSHELL GIRL!! she deserves it!,31,1750386712.0,MarzipanSharp1843,1lfsbxo,Season 7 - Episode 15 - Post Episode Discussion
Huda all but confirmed the rumors with those moves tonight,32,1750387069.0,birthdaycake790,1lfsbxo,Season 7 - Episode 15 - Post Episode Discussion
Seeing Olandria continue to be one of the baddest just reminded me how sad it is she’s choosing to be with Taylor…. Girl please WANT BETTER!!!,34,1750387189.0,_phiiline_,1lfsbxo,Season 7 - Episode 15 - Post Episode Discussion
"https://preview.redd.it/qpprv2evvz7f1.jpeg?width=1170&format=pjpg&auto=webp&s=ae443caa20b84bc1c2d38fb9b77f9348f12faa84

Yeah no, what possible reason could you have for following Andrew Tate 🥴",29,1750387246.0,Content_Career8154,1lfsbxo,Season 7 - Episode 15 - Post Episode Discussion
"Taylor's ""goofy"" faces and stuff he does give me the biggest ick.",30,1750387363.0,spikespiegell1,1lfsbxo,Season 7 - Episode 15 - Post Episode Discussion
"https://preview.redd.it/2eo8i3os008f1.jpeg?width=439&format=pjpg&auto=webp&s=832953aae9f55da677e64a4f9e8819ab3965b159

i love pretty much anything amaya does w her hair.",33,1750388889.0,couuer,1lfsbxo,Season 7 - Episode 15 - Post Episode Discussion
Please tell me that it’s not so hard for the casting director to avoid red-pilled dude bros!! Why are the men awful?? 😞😞😭😭,34,1750389191.0,gidget_81,1lfsbxo,Season 7 - Episode 15 - Post Episode Discussion
"Maybe its just a preference thing. New male bombshell came through and i looked at my partner like ""another nic?"" And the girls are like OMG HE'S SO HOT. Im getting the rob vibes again, i just see a dork XD",34,1750410544.0,Fradward,1lfsbxo,Season 7 - Episode 15 - Post Episode Discussion
"The fact huda needs to be mothered in the villa by everyone, and she’s the only mother 😭 they say having a child young stunts your maturity, and she’s really been proven this statement",49,1750421423.0,nmata18,1lfsbxo,Season 7 - Episode 15 - Post Episode Discussion
Huda wanted Jeremiah to kiss her so bad in the speakeasy! She was looking so longingly during their goodbye hug.  All she would've done is use that against him.  Glad he didn't go for it.  ,41,1750390498.0,NameMeReddit,1lfsbxo,Season 7 - Episode 15 - Post Episode Discussion
So Huda shakes her ass and suddenly tiktok has forgiven her,45,1750434045.0,InterviewWeary5708,1lfsbxo,Season 7 - Episode 15 - Post Episode Discussion
Was nice seeing huda’s personality outside of just talking about Jeremiah and freaking out. Hopefully she keeps this up,48,1750385446.0,miiimee,1lfsbxo,Season 7 - Episode 15 - Post Episode Discussion
"I’m just watching now but I want to point out how much Iain hates huda 💀 and doing so many voiceovers about huda 💀 like when huda went to break up jeremiah and iris’s chat right away, iain said “huda promised not to yell at him anymore in the villa so she is going to creepily whisper at him instead”

honestly though. huda followed them immediately up the stairs, eavesdropped, then interrupted to once again tell jeremiah he was in the wrong too etc etc etc. so much deflection it’s crazy",55,1750418641.0,lbunny7,1lfsbxo,Season 7 - Episode 15 - Post Episode Discussion
It’s actually insane how hooked I am on this season,10,1750384937.0,artemis_dubois,1lfsbxo,Season 7 - Episode 15 - Post Episode Discussion
This ep was such a breath of fresh air after what we (and they) been through 🥹,11,1750384958.0,Jazzlike-Page-9811,1lfsbxo,Season 7 - Episode 15 - Post Episode Discussion
I hope they have more fun challenges like this!,11,1750385093.0,Summerflemingg,1lfsbxo,Season 7 - Episode 15 - Post Episode Discussion
YES these bombshells are what I'm talking about!!!,10,1750385332.0,ikeamonkey2,1lfsbxo,Season 7 - Episode 15 - Post Episode Discussion
great vibes this episode,10,1750385964.0,GlitteringDot5177,1lfsbxo,Season 7 - Episode 15 - Post Episode Discussion
Jeremiah better lock in cuz his escape goat type just came in.,10,1750386193.0,Garthtav,1lfsbxo,Season 7 - Episode 15 - Post Episode Discussion
did you guys see that next episode Iris and tj kissed??? So what’s going to happen with Jeremiah?,9,1750386304.0,Automatic-Leg3997,1lfsbxo,Season 7 - Episode 15 - Post Episode Discussion
They needed this episode to be lit and it was…ONG I called Ace doing push ups for Megan.,10,1750386535.0,RareCommission5962,1lfsbxo,Season 7 - Episode 15 - Post Episode Discussion
"OKAY IRIS!!! i was expecting jeremiah to be the one folding hella quick, not her 🤭",11,1750386841.0,blackflowerpetals,1lfsbxo,Season 7 - Episode 15 - Post Episode Discussion
super excited for who’s gonna go for andreina,11,1750386996.0,Glittering-Bus-9971,1lfsbxo,Season 7 - Episode 15 - Post Episode Discussion
"Guys if Iris and TJ get together and Andreina’s not into Jeremiah, he’s probably gonna end up being the one to have to dump Huda from the island 😬 

Because let’s say Andreina gets with Pepe and it’s Hannah + Huda up there with Jeremiah picking, he probably goes for a friendship couple with Hannah",10,1750387301.0,Tacobelle_90,1lfsbxo,Season 7 - Episode 15 - Post Episode Discussion
Feeling represented 🇩🇴,12,1750388345.0,poisionfruit,1lfsbxo,Season 7 - Episode 15 - Post Episode Discussion
Guys do the bombshells watch all the episodes before they go in? Like are they made aware of what is going on?,9,1750390011.0,Dangerous_Fudge_2468,1lfsbxo,Season 7 - Episode 15 - Post Episode Discussion
"I noticed during the challenge instead of saying Bitch, Huda referred to Megan as Girl",8,1750390195.0,Maleficent-Orchid755,1lfsbxo,Season 7 - Episode 15 - Post Episode Discussion
Anyone notice we never got the clip of Iris crying after Jalen got sent home at the end of Tuesday’s episode??,10,1750390856.0,Worried-Traffic-2332,1lfsbxo,Season 7 - Episode 15 - Post Episode Discussion
Is there any world where the outcome of this “challenge” doesn’t result in both bombshells coming in?,10,1750394292.0,Weakness_Infinite,1lfsbxo,Season 7 - Episode 15 - Post Episode Discussion
"Saw a TikTok pointing this out and now I can’t unsee it 👀 That kiss preview is adding up now… thoughts?

https://vt.tiktok.com/ZSknyMxk2/",9,1750434208.0,FlightMajestic7998,1lfsbxo,Season 7 - Episode 15 - Post Episode Discussion
huda’s twerk was next levelllll omg 🤩,41,1750385277.0,laneloveslipstick,1lfsbxo,Season 7 - Episode 15 - Post Episode Discussion
"“I don’t think this is something I want to keep exploring”

Baby girl, that choice wasn’t yours lmfao but if you need to convince yourself it was to move on, it’s fine. Stay delusional and move the fuck on.",47,1750385333.0,vrschikasanaa,1lfsbxo,Season 7 - Episode 15 - Post Episode Discussion
the way i want this season to turn queer SO BADLY,45,1750385335.0,hugemessanon,1lfsbxo,Season 7 - Episode 15 - Post Episode Discussion
love island please count your days because where are you finding these CHOPPED male bombshells? y’all better be getting the finest for casa because wth..,42,1750385569.0,thrrowwwawayyyyy,1lfsbxo,Season 7 - Episode 15 - Post Episode Discussion
It annoyed me so bad that when Ace cheered the female bombshell and then HUDA is all ‘chelley you hear that?” LIKE NOBODYS EXCLUSIVE. and Ace has made it clear he’s open. Like yes Ace should’ve been more respectful but it’s not chelleys/hudas  job to police what Ace does.,44,1750385857.0,Expensive-Bus-2227,1lfsbxo,Season 7 - Episode 15 - Post Episode Discussion
