comment,score,created_utc,author,episode_post_id,episode_title
Literally fuck Eeyore Musk for making Twitter likes private 😭. I’m sure he has some questionable likes,6,1750386392.0,PlSCESGROOVE,1lfsbxo,Season 7 - Episode 15 - Post Episode Discussion
Disgusting. wtf is casting doing this year!?,5,1750386592.0,berrikerri,1lfsbxo,Season 7 - Episode 15 - Post Episode Discussion
I’m scared of him lmaoooo wtf,3,1750386122.0,loo3601,1lfsbxo,Season 7 - Episode 15 - Post Episode Discussion
I hate it here 😭,3,1750386134.0,Ill-Ad5982,1lfsbxo,Season 7 - Episode 15 - Post Episode Discussion
Yuck,3,1750386149.0,Phoenix_legend33,1lfsbxo,Season 7 - Episode 15 - Post Episode Discussion
bestie we gotta go to work again im tired,4,1750386079.0,31cats,1lfsbxo,Season 7 - Episode 15 - Post Episode Discussion
Ughhhh,2,1750386544.0,BreakableSmile,1lfsbxo,Season 7 - Episode 15 - Post Episode Discussion
Noooooooooooooooooooooo,2,1750389091.0,Necessary_Nothing471,1lfsbxo,Season 7 - Episode 15 - Post Episode Discussion
"Please for us non Twitter users, do you mind explaining please?🥲",1,1750426240.0,FunnyManufacturer130,1lfsbxo,Season 7 - Episode 15 - Post Episode Discussion
I try to remind myself that time moves differently in the villa but like girl COME ON.,25,1750387477.0,mckittenpants,1lfsbxo,Season 7 - Episode 15 - Post Episode Discussion
And?,-10,1750389462.0,Unhappy_Cookie6839,1lfsbxo,Season 7 - Episode 15 - Post Episode Discussion
Did you not see the preview for the next episode? Iris and Whatever the new guys name kiss.,20,1750385530.0,YouthfulVibes,1lfsbxo,Season 7 - Episode 15 - Post Episode Discussion
Yall did that 💀,9,1750385442.0,Queen1taurus2,1lfsbxo,Season 7 - Episode 15 - Post Episode Discussion
Seems like it. And the producers showing Hannah licking her hand was diabolical af,24,1750387811.0,brucethePTA,1lfsbxo,Season 7 - Episode 15 - Post Episode Discussion
they were definitely fuckin,8,1750387910.0,blackflowerpetals,1lfsbxo,Season 7 - Episode 15 - Post Episode Discussion
Mhm mhm,3,1750387862.0,Civil-Department-347,1lfsbxo,Season 7 - Episode 15 - Post Episode Discussion
Absolutely they did,3,1750388047.0,kewlvintagesoul,1lfsbxo,Season 7 - Episode 15 - Post Episode Discussion
[deleted],1,1750387797.0,None,1lfsbxo,Season 7 - Episode 15 - Post Episode Discussion
Wondering this too….?,1,1750387839.0,Professional_Cat6026,1lfsbxo,Season 7 - Episode 15 - Post Episode Discussion
She absolutely withdrew and i don't blame her,28,1750392303.0,Icy-Atmosphere-1546,1lfsbxo,Season 7 - Episode 15 - Post Episode Discussion
She came in during a shitstorm and Huda intimidated all the girls into taking her side. She had to send her bombshell brother home. Her and Pepe don’t seem close. I wouldn’t feel the most comfortable either,19,1750392231.0,rave_kitty1,1lfsbxo,Season 7 - Episode 15 - Post Episode Discussion
I feel bad for her lowkey being Jeremiah’s emotional support. She deserves to find someone for her,5,1750393592.0,Competitive_Bake_950,1lfsbxo,Season 7 - Episode 15 - Post Episode Discussion
I think she’s still finding her footing and warming up to the girls honestly. And I don’t blame her,1,1750426304.0,FunnyManufacturer130,1lfsbxo,Season 7 - Episode 15 - Post Episode Discussion
"For now. Huda girl def got production level intervention and warning about the harassing. Everyone was too united on the message that enough was enough. That group can’t unite and make a good decision to save their lives, she def was told to stop",36,1750393343.0,Particular-Ad5787,1lfsbxo,Season 7 - Episode 15 - Post Episode Discussion
I AM FUCKING WEAK 🤣🤣,3,1750393275.0,Own-Lifeguard-9095,1lfsbxo,Season 7 - Episode 15 - Post Episode Discussion
"Huda seems to have some deep struggles. One conversation probably isn't going to change that, but repetition could help. It did seem like Cierra managed to strike something with Huda, though. She was loving, but didn't feed into victimizing narratives. I'm hopeful we can see Huda navigate the rest of her time on the island more gracefully, but we'll see.

Also, that was my thought on Andreina, too lol.",5,1750386965.0,Rachet_Bomb,1lfsbxo,Season 7 - Episode 15 - Post Episode Discussion
TJ got a Dolan Twins smile,2,1750385798.0,lavenderJayde,1lfsbxo,Season 7 - Episode 15 - Post Episode Discussion
I said the same thing lol TJ is giving JT,1,1750388827.0,Specialist-Shirt-380,1lfsbxo,Season 7 - Episode 15 - Post Episode Discussion
No because I seriously commend EVERYONE for being brave enough to twerk in front of MEGAN.,1,1750428138.0,Tangerin3dr34m,1lfsbxo,Season 7 - Episode 15 - Post Episode Discussion
Cierra is still one of rhe faves but that chat was not it lol. It was a pep talk but didn’t address anything,-2,1750386071.0,bassinlimbo,1lfsbxo,Season 7 - Episode 15 - Post Episode Discussion
NOT THE LE PEW 💀🤣,9,1750386816.0,Basic_Lemon_6226,1lfsbxo,Season 7 - Episode 15 - Post Episode Discussion
Hannah’s timing is so bad hahaha,4,1750387004.0,plantgurl420,1lfsbxo,Season 7 - Episode 15 - Post Episode Discussion
Peepee 😭,4,1750386930.0,AndreaThePsycho,1lfsbxo,Season 7 - Episode 15 - Post Episode Discussion
Loooool they going out saaaaaad,3,1750386850.0,Key_Relief8163,1lfsbxo,Season 7 - Episode 15 - Post Episode Discussion
Plsss the laugh I just let out at Pepe’s le pew 😭,2,1750388415.0,tbhjustbored,1lfsbxo,Season 7 - Episode 15 - Post Episode Discussion
She’s soooo stunning my goodness,9,1750386908.0,Dizzy_Respect1413,1lfsbxo,Season 7 - Episode 15 - Post Episode Discussion
mommy?,8,1750386912.0,Immediate-Storm6869,1lfsbxo,Season 7 - Episode 15 - Post Episode Discussion
mommy for sure,7,1750386948.0,srhiro-4777,1lfsbxo,Season 7 - Episode 15 - Post Episode Discussion
She’s unreal.,3,1750387166.0,Designer-Ad7341,1lfsbxo,Season 7 - Episode 15 - Post Episode Discussion
Like how is she real?,1,1750428181.0,Tangerin3dr34m,1lfsbxo,Season 7 - Episode 15 - Post Episode Discussion
they don’t. I can’t see it,5,1750415656.0,Outrageous_Ad6776,1lfsbxo,Season 7 - Episode 15 - Post Episode Discussion
They dont. They don’t like each other like that.,5,1750429014.0,AgreeableLaugh1171,1lfsbxo,Season 7 - Episode 15 - Post Episode Discussion
No chemistry .His eyes don’t sparkle like they do with Huda,-10,1750417151.0,miggyesq,1lfsbxo,Season 7 - Episode 15 - Post Episode Discussion
Naaaasttyyyy man,15,1750387862.0,No_Hippo,1lfsbxo,Season 7 - Episode 15 - Post Episode Discussion
Wtf???? I have the ick already.,15,1750388120.0,Separate-Smile-9745,1lfsbxo,Season 7 - Episode 15 - Post Episode Discussion
Ohh wtf,12,1750387882.0,Carolina_Blues,1lfsbxo,Season 7 - Episode 15 - Post Episode Discussion
"it’s the realest and most constructive conversation anyone’s had with huda so far, especially from the girls!",18,1750395856.0,swampy444,1lfsbxo,Season 7 - Episode 15 - Post Episode Discussion
Yes! Was firm and honest but still kind. 10/10 moment,12,1750395741.0,salisbury130,1lfsbxo,Season 7 - Episode 15 - Post Episode Discussion
And finally! Was hoping someone would say something,9,1750395516.0,jayziti,1lfsbxo,Season 7 - Episode 15 - Post Episode Discussion
Yesss this and the other episode where she gently told Huda to chill on the name calling.,5,1750397164.0,patthickwong,1lfsbxo,Season 7 - Episode 15 - Post Episode Discussion
She was trying to get him to kiss her. So manipulative. I’m glad she was happy and unproblematic during the challenge but honestly that’s the bare minimum. She needs to get it together.,93,1750384949.0,butiamthechosenone,1lfsbxo,Season 7 - Episode 15 - Post Episode Discussion
"He definitely did, painful watch💀",35,1750384992.0,Antique-Listen2799,1lfsbxo,Season 7 - Episode 15 - Post Episode Discussion
She was totally testing the waters to see if he'd kiss her. 100% a swerve!,35,1750385060.0,Nice-Ad-3805,1lfsbxo,Season 7 - Episode 15 - Post Episode Discussion
Oof. That Huda and Jeremiah moment with her wanting a kiss was a rough watch. :-/,16,1750385477.0,Acceptable_Account15,1lfsbxo,Season 7 - Episode 15 - Post Episode Discussion
"Hannah probably feels guilty and misses him a little, but she’s ultimately here to have a good time",3,1750389409.0,CeeFourecks,1lfsbxo,Season 7 - Episode 15 - Post Episode Discussion
"I noticed your point about Austin/Nic/Ace also. Austin really does feel like the best friend he has in there. I’m sure that everyone is tired of hearing about it, but Jeremiah just talking about how it’s over and done being met with immediate annoyance just irked me lol",3,1750406524.0,Spitfiiire,1lfsbxo,Season 7 - Episode 15 - Post Episode Discussion
Hannah will get with whatever guy looks at her most recently lmao,1,1750394576.0,cremebrubclee,1lfsbxo,Season 7 - Episode 15 - Post Episode Discussion
"I'm screaming at my husband like all these women are the hottest women I've ever seen in my life, and the men are..nyc 7s",15,1750385147.0,cookie5517,1lfsbxo,Season 7 - Episode 15 - Post Episode Discussion
His job was to thin down the herd and be sent home before casa I feel,9,1750385949.0,vyzyxy,1lfsbxo,Season 7 - Episode 15 - Post Episode Discussion
Basically,4,1750385943.0,kbange,1lfsbxo,Season 7 - Episode 15 - Post Episode Discussion
Ohhh. Yeah you right,3,1750386011.0,Dry_Excitement_2053,1lfsbxo,Season 7 - Episode 15 - Post Episode Discussion
I’m fine with that. I was scared it was gonna be Hannah and Pepe cause I need Hannah for Casa lol,2,1750386582.0,PlSCESGROOVE,1lfsbxo,Season 7 - Episode 15 - Post Episode Discussion
Nah Iris get behind me!!! She deserves to stay a while and have some fun,2,1750389035.0,Necessary_Nothing471,1lfsbxo,Season 7 - Episode 15 - Post Episode Discussion
JD VANCE I AM DEAD,5,1750387485.0,itsbooyeah,1lfsbxo,Season 7 - Episode 15 - Post Episode Discussion
LMAO NOT JD VANCE,3,1750386864.0,computercavemen,1lfsbxo,Season 7 - Episode 15 - Post Episode Discussion
Major preppy/ fratty vibes not what I want in my tropical hot girl summer island,2,1750387028.0,puigjay96,1lfsbxo,Season 7 - Episode 15 - Post Episode Discussion
Omg I won’t be able to unsee it now,2,1750387328.0,emforshort,1lfsbxo,Season 7 - Episode 15 - Post Episode Discussion
Omg THATS who he looks like ewwww,2,1750387823.0,HumanCatMan,1lfsbxo,Season 7 - Episode 15 - Post Episode Discussion
Squished is the best way to describe him,1,1750399990.0,EgoDraws,1lfsbxo,Season 7 - Episode 15 - Post Episode Discussion
"And honestly, holding her accountable. Sucks that he has to babysit her, but it has to be done.",9,1750388353.0,rave_kitty1,1lfsbxo,Season 7 - Episode 15 - Post Episode Discussion
But did she actually hear it lol?,2,1750388442.0,softassassin69,1lfsbxo,Season 7 - Episode 15 - Post Episode Discussion
His face when she stalked Jeremiah to the Speakesy 😂😂😂,1,1750390308.0,verasviva,1lfsbxo,Season 7 - Episode 15 - Post Episode Discussion
"no because when she hit THE strip club move, i had questions about where she learned that one.",11,1750388868.0,not_ellewoods,1lfsbxo,Season 7 - Episode 15 - Post Episode Discussion
I saw a girl on tik tok said she’s seen her before at a club (but of course you gotta take it w a grain of salt),6,1750388922.0,Hot-Tackle-1391,1lfsbxo,Season 7 - Episode 15 - Post Episode Discussion
yeah for sure did,1,1750389212.0,PreviousRoof4763,1lfsbxo,Season 7 - Episode 15 - Post Episode Discussion
I wish people wouls stop spreading this. It’s dangerous for her and her daughter. She also Palestinian.,-1,1750391539.0,Valuable-League-645,1lfsbxo,Season 7 - Episode 15 - Post Episode Discussion
I think there just really stable tbh well probally know the true answer after casa,7,1750390023.0,renagxde,1lfsbxo,Season 7 - Episode 15 - Post Episode Discussion
"I notice she will also repeat what he says after he says it, and it’s super surface level to me. There’s no spark. Like this episode he mentions the story about his mom pinching him with her toes and called it cab toes, and a joke about inheriting them… and she basically just laughs, says I hate that and she laughs more and says inherited is crazy. Like he’s got some good stories and he carries the conversation a lot. Like the hippo conversation he carried. And she repeated him a few times as the response.",8,1750391287.0,No_Necessary4424,1lfsbxo,Season 7 - Episode 15 - Post Episode Discussion
she seems bored of him,3,1750391608.0,tin-f0il-man,1lfsbxo,Season 7 - Episode 15 - Post Episode Discussion
"Yeah, I think they are both bored.",9,1750389934.0,Realistic-Lake5897,1lfsbxo,Season 7 - Episode 15 - Post Episode Discussion
"I think they're just waiting for Casa, more so on nic's side. They're boring but that's just me. I want a goofier girl for nic.",5,1750390016.0,Lovieloony,1lfsbxo,Season 7 - Episode 15 - Post Episode Discussion
I doubt andreina is gonna give him the time of day,23,1750393016.0,_sphynxie_,1lfsbxo,Season 7 - Episode 15 - Post Episode Discussion
"She’s not even looking his way, trust me",15,1750393942.0,Accurate-Drummer1986,1lfsbxo,Season 7 - Episode 15 - Post Episode Discussion
Andreina is legit gorgeous,7,1750393470.0,Own-Lifeguard-9095,1lfsbxo,Season 7 - Episode 15 - Post Episode Discussion
"Yeah, Jeremiah seems like a nerd trapped in a conventionally attractive body and now that you pointed it out, I feel like he and Cierra would have a lot of good conversation, especially since he has the ability to talk beyond surface level with someone he's interested in.",27,1750395252.0,hewitttt,1lfsbxo,Season 7 - Episode 15 - Post Episode Discussion
"this is what bothers me about huda and jeremiah, they could’ve explored more from the beginning and found people they were way more compatible with. so many missed opportunities",22,1750394943.0,swampy444,1lfsbxo,Season 7 - Episode 15 - Post Episode Discussion
Mmmmmm!!!🤏🏾⏰,4,1750395304.0,Embarrassed_Elk_9638,1lfsbxo,Season 7 - Episode 15 - Post Episode Discussion
They also both like to read,3,1750395675.0,archie_999,1lfsbxo,Season 7 - Episode 15 - Post Episode Discussion
lol well they said she’s his type,2,1750396107.0,vyzyxy,1lfsbxo,Season 7 - Episode 15 - Post Episode Discussion
she wanted a kiss it was bad,40,1750386458.0,Ok_Yogurt3128,1lfsbxo,Season 7 - Episode 15 - Post Episode Discussion
i think we was hoping for a kiss 😭,12,1750386530.0,gvttergrl,1lfsbxo,Season 7 - Episode 15 - Post Episode Discussion
She was trying to kiss him so bad 🙈,9,1750386702.0,Outside-Carpet7479,1lfsbxo,Season 7 - Episode 15 - Post Episode Discussion
She was on her way to start fight #37 but thankfully Taylor interrupted. I wonder how long that convo with Jeremiah was for real it looked like hours,1,1750390787.0,asspancakes,1lfsbxo,Season 7 - Episode 15 - Post Episode Discussion
And that’s totally fine. She did her job and she did it well.,40,1750385094.0,veronicaxrowena,1lfsbxo,Season 7 - Episode 15 - Post Episode Discussion
[removed],54,1750385158.0,None,1lfsbxo,Season 7 - Episode 15 - Post Episode Discussion
[removed],22,1750385176.0,None,1lfsbxo,Season 7 - Episode 15 - Post Episode Discussion
[removed],32,1750385178.0,None,1lfsbxo,Season 7 - Episode 15 - Post Episode Discussion
[removed],19,1750385173.0,None,1lfsbxo,Season 7 - Episode 15 - Post Episode Discussion
[removed],14,1750385142.0,None,1lfsbxo,Season 7 - Episode 15 - Post Episode Discussion
Then take it and twist it,76,1750385477.0,BeginningJello4774,1lfsbxo,Season 7 - Episode 15 - Post Episode Discussion
But at the same time she expects for others to give her privacy. Make it make sense.,32,1750391303.0,avii7,1lfsbxo,Season 7 - Episode 15 - Post Episode Discussion
It actually makes me soooo uncomfortable,29,1750387304.0,seastar11,1lfsbxo,Season 7 - Episode 15 - Post Episode Discussion
So disrespectful.,30,1750385480.0,Fancy_Gene_9814,1lfsbxo,Season 7 - Episode 15 - Post Episode Discussion
"Bro everyone does that on every season - they all know there is no real privacy. Mind you, everything is being recorded as part of a national tv show",-19,1750385840.0,KDSD628,1lfsbxo,Season 7 - Episode 15 - Post Episode Discussion
The irony of your username,9,1750385385.0,Soggy-Public-1966,1lfsbxo,Season 7 - Episode 15 - Post Episode Discussion
let her live!!!,11,1750385216.0,Few-Culture-4396,1lfsbxo,Season 7 - Episode 15 - Post Episode Discussion
I mean… we saw them in the speakeasy,3,1750385712.0,bbqsaucebaabe,1lfsbxo,Season 7 - Episode 15 - Post Episode Discussion
WAIT did they confirm this?? How did I miss this?,2,1750385435.0,cookie5517,1lfsbxo,Season 7 - Episode 15 - Post Episode Discussion
It’s let Hannah live but people were calling huda all sorts of names for sleeping with Jeremiah after 8 days? It took Hannah 2 but people just find that funny. Wonder why.,3,1750385491.0,tsbluebus,1lfsbxo,Season 7 - Episode 15 - Post Episode Discussion
"He’s not into her at all, he wanted away from Huda.",3,1750386274.0,whodoyoulove89,1lfsbxo,Season 7 - Episode 15 - Post Episode Discussion
"She was his ticket out of the Huda trap, but they both need to move on to better connections.",3,1750386339.0,21-nun_salute,1lfsbxo,Season 7 - Episode 15 - Post Episode Discussion
Didn’t he say the beginning that he liked exotic women or am I wrong?,2,1750386512.0,TinyEmployment8020,1lfsbxo,Season 7 - Episode 15 - Post Episode Discussion
honestly maybe it's just relief he's not in the toxic cycle anymore but I get what you're saying,1,1750386380.0,Full_Market_5298,1lfsbxo,Season 7 - Episode 15 - Post Episode Discussion
" He doesn’t like her and she doesn’t like him 😂

If that bombshell was reversed with Iris, he would’ve folded in 2 seconds. 

It’s probably best they didn’t do that because it really would’ve broke Huda 😭",1,1750386758.0,Cutiger29,1lfsbxo,Season 7 - Episode 15 - Post Episode Discussion
Nepo baby reporting for duty,8,1750389868.0,anxiousrebelde,1lfsbxo,Season 7 - Episode 15 - Post Episode Discussion
And he supports Tory Lanez ffs.,6,1750389939.0,OldApricot944,1lfsbxo,Season 7 - Episode 15 - Post Episode Discussion
Lol!,1,1750407635.0,LaughingAtNonsense,1lfsbxo,Season 7 - Episode 15 - Post Episode Discussion
"I was thinking this bombshell is at least a step up from the current men and Charlie IMO. So at least they’re moving in the right direction.    
Edit; this was before I saw he was an Andrew Tate fan. Can we get a good looking guy in the villa who’s not a misogynist? None of these guys are doing anything for me.",-6,1750393062.0,jenh6,1lfsbxo,Season 7 - Episode 15 - Post Episode Discussion
They do that on purpose every season.,12,1750392539.0,KawaiiiiSkyeeee,1lfsbxo,Season 7 - Episode 15 - Post Episode Discussion
Yeah I def think it’s intentional,12,1750392631.0,plantmama32,1lfsbxo,Season 7 - Episode 15 - Post Episode Discussion
Also there really should've been two male bombshells this time. The girls haven't had a true recoupling ceremony with their choice yet! wtf,18,1750395351.0,Regen-Gardener,1lfsbxo,Season 7 - Episode 15 - Post Episode Discussion
"mentioned in another comment but much fewer men apply for love island than women. they just have a bigger pool of applicants to choose from for women bombshells. its not public information, but it’s very normal for this to be the case for dating shows. its why a lot of dating shows tend to have hotter women than men",14,1750395788.0,korrarage,1lfsbxo,Season 7 - Episode 15 - Post Episode Discussion
"the curse of love island, sadly!",8,1750395286.0,sleepingqueen,1lfsbxo,Season 7 - Episode 15 - Post Episode Discussion
Gotta give 10s when 10s are due! I loved her confidence,24,1750424261.0,Top_Dentist2464,1lfsbxo,Season 7 - Episode 15 - Post Episode Discussion
Mad respect to Chelley for her attempt coz I would have stayed seated after seeing Huda and Ola.,13,1750429891.0,Lost-and-dumbfound,1lfsbxo,Season 7 - Episode 15 - Post Episode Discussion
Those we r professional moves for sure lol,20,1750424161.0,SydTheStreetFighter,1lfsbxo,Season 7 - Episode 15 - Post Episode Discussion
"whew, and she was first and i know she held back.",8,1750430686.0,osu24,1lfsbxo,Season 7 - Episode 15 - Post Episode Discussion
Excuse me but where is Olandria’s waist 😭😩,25,1750386343.0,mamatobsb,1lfsbxo,Season 7 - Episode 15 - Post Episode Discussion
Did not realize how tiny olandria is!!! I thought she was taller than chelley!,17,1750387180.0,kikdafreak,1lfsbxo,Season 7 - Episode 15 - Post Episode Discussion
they’re so beautiful,9,1750386732.0,Chemical_Range5333,1lfsbxo,Season 7 - Episode 15 - Post Episode Discussion
"literally like whispering doesn’t cancel out the fact that you are arguing!! not only did she pinky promise taylor she would be done speaking to him, but she promised jeremiah she wasn’t there to argue and both of those promises she broke.. i think cierra handled it well by telling her to get her shit together respectfully but at the same time i just don’t see huda changing. she wants this new bombshell so bad (rightfully so he’s sexy af) but based on the preview of him kissing iris, i bet huda will find a way to blame iris for ‘ruining her potential relationship’ and the toxic spirals and name calling is gonna start all over again.",6,1750386253.0,Content_Education_90,1lfsbxo,Season 7 - Episode 15 - Post Episode Discussion
"Why assume the worst when she could’ve just realized her behavior was unnecessary? She told Jeremiah they were both partially to blame for making the villa toxic, which is true. Jeremiah was the one who looked at her like she was wrong. Her actions in this episode showed her acting different from her previous behavior. Let the hate go",-7,1750386051.0,notalem0n,1lfsbxo,Season 7 - Episode 15 - Post Episode Discussion
I SAW THAT OMMGGGGG LIKE GIRL she can’t be serious. Thank god he didn’t kiss her,14,1750387559.0,Daisy-Dollop,1lfsbxo,Season 7 - Episode 15 - Post Episode Discussion
"I think she’s likely going home next when they recouple, so it’s nice of them to try to cool the hate a bit before she leaves",12,1750387464.0,Tacobelle_90,1lfsbxo,Season 7 - Episode 15 - Post Episode Discussion
Yesss like the way she was looking at him like bffr,12,1750387496.0,meekostoes,1lfsbxo,Season 7 - Episode 15 - Post Episode Discussion
"For the sake of world peace, I’m so glad he didn’t! She was gonna describe that kiss in detail and even add spice to make it look like he wanted to jump her bones right in the speakeasy",5,1750388231.0,Dizzy_Respect1413,1lfsbxo,Season 7 - Episode 15 - Post Episode Discussion
"I could be wrong but even if Iris and TJ vibe and Jeremiah and Adriana don’t, I still don’t think Jeremiah goes back to Huda. I think he rather go home at that point.",59,1750385449.0,SolarBeam12,1lfsbxo,Season 7 - Episode 15 - Post Episode Discussion
"See, I thought the bombshell was brought in for HIM. She’s exactly the type to a T, Jeremiah said he was attracted to. 

Now, I do think that this situation will likely put Jeremiah and Huda back together again.  However, only because of Iris and the bombshell clicking. ",31,1750385466.0,MzKRB,1lfsbxo,Season 7 - Episode 15 - Post Episode Discussion
Yes she will I can see them recoupling before casa,24,1750385300.0,Own_Explanation4080,1lfsbxo,Season 7 - Episode 15 - Post Episode Discussion
"This is my guess. Honestly, what chance do either of them have if they don't? Honestly, I think that new guy is more Iris' speed, and Huda and Jeremiah at least already know what they'd be getting. 

But it seems Hannah may be left out, so maybe Jeremiah will couple up with her to stay, but not have to be with Huda?",8,1750385416.0,Sea_Confusion2757,1lfsbxo,Season 7 - Episode 15 - Post Episode Discussion
oh she already tried to get back with jeremiah! when they hugged in the speakeasy she put her face right in his and gave him “kiss me” eyes sooooo blatantly,6,1750386487.0,andiebiscuit,1lfsbxo,Season 7 - Episode 15 - Post Episode Discussion
I haven’t laughed like that in so long that twerking contest was hilarious.,9,1750385594.0,Single-Asparagus-151,1lfsbxo,Season 7 - Episode 15 - Post Episode Discussion
i’m begging 🧎‍♀️she would be the best host ever,10,1750385581.0,Comfortable_Flow_317,1lfsbxo,Season 7 - Episode 15 - Post Episode Discussion
"As a long time Ariana stan, I have to agree. I don't think Peacock can afford her as host though :(",3,1750385675.0,Lost-and-dumbfound,1lfsbxo,Season 7 - Episode 15 - Post Episode Discussion
ilovemess.gif,7,1750385592.0,TheOneThatCameEasy,1lfsbxo,Season 7 - Episode 15 - Post Episode Discussion
"Jeremiah literally said that he wants a foreign baddie, I fear iris is on her own now 😭",6,1750385629.0,JeanieBeanie1007,1lfsbxo,Season 7 - Episode 15 - Post Episode Discussion
She’s about to breakup sisterhood island. Thank god!,4,1750385819.0,Right_Way_4258,1lfsbxo,Season 7 - Episode 15 - Post Episode Discussion
"When she spit on her hand I immediately clocked that, there ain’t no way they didn’t do something",22,1750385674.0,srita1212,1lfsbxo,Season 7 - Episode 15 - Post Episode Discussion
The did 💀,7,1750385670.0,Content_Career8154,1lfsbxo,Season 7 - Episode 15 - Post Episode Discussion
her spitting on her hand ☠️,4,1750385737.0,AwkwardBuy6001,1lfsbxo,Season 7 - Episode 15 - Post Episode Discussion
It looked like his hand was moving a lot under the covers so could have just been that 🤔 i didn’t notice the hop motion I’ll have to go back 😂,2,1750386183.0,SBisFree,1lfsbxo,Season 7 - Episode 15 - Post Episode Discussion
it looked like they were especially with hannah’s hand movement to her mouth (i dont know any other way to describe it😭),1,1750385833.0,chillibedrot,1lfsbxo,Season 7 - Episode 15 - Post Episode Discussion
Oh for sure. I clocked it too!,1,1750386037.0,Zeenith16,1lfsbxo,Season 7 - Episode 15 - Post Episode Discussion
I feel you,3,1750387571.0,shhmurdashewrote,1lfsbxo,Season 7 - Episode 15 - Post Episode Discussion
