comment,score,created_utc,author,episode_post_id,episode_title
"It’s the worst kind too because you can tell he has no idea he’s been indoctrinated. The Andrew Tate stan’s aren’t as scary because you can pick them out easily. Ace has a more neutral version of this red pilled ideology that almost fools you into thinking there’s nothing wrong. I had a feeling this would be the case when I realized he was the tiktok live dancing guy. No way a 22 year old who uses tiktok for several hours a day isn’t getting inundated with red pill content, whether they seek it out or not. He also doesn’t seem smart enough to realize how that kind of content can affect one’s outlook on the world.",21,1749906373.0,SydTheStreetFighter,1laxbqf,Season 7 - Episode 10 - Post Episode Discussion
"Omg so true, I totally missed that",15,1749876544.0,Far-Philosophy-3672,1laxbqf,Season 7 - Episode 10 - Post Episode Discussion
it was also very weird when he basically said he used to get obsessed with girls and “want to give them the world” but “that didn’t work out for me.” red flags!!!!!! ,12,1749940659.0,AloneAssistant5326,1laxbqf,Season 7 - Episode 10 - Post Episode Discussion
Right on the money!,7,1749879192.0,MysteriousResearch86,1laxbqf,Season 7 - Episode 10 - Post Episode Discussion
this is such a good comment! I did not pick up on the passport bro element of that comment but you’re so right.,5,1749941126.0,Big_Fix2905,1laxbqf,Season 7 - Episode 10 - Post Episode Discussion
Exactly! And the way he has been moving in the villa is giving “red pill” so much! He didn’t pick Chelley to nag her and not show her his interest too much! He said tonight that he used to actually treat women well but “it didn’t work out” so now he has changed! Ace needs to get therapy or sum,5,1749956799.0,Ok_Necessary2845,1laxbqf,Season 7 - Episode 10 - Post Episode Discussion
"as much as i like nic, i need cierra to pursue pepe regardless of the poll. you aren't with a serious man so please scout around 🙏",50,1749870005.0,Necessary-Cause3022,1laxbqf,Season 7 - Episode 10 - Post Episode Discussion
That was wild to me. After one chat? Crazy work.,27,1749870454.0,PrncssAnglBB,1laxbqf,Season 7 - Episode 10 - Post Episode Discussion
She’s being the cool girl … but also it’s teaching nic he can walk all over her ,44,1749869800.0,Dramatic_Formal_7356,1laxbqf,Season 7 - Episode 10 - Post Episode Discussion
She’s doing the right thing playing it cool,47,1749869695.0,vyzyxy,1laxbqf,Season 7 - Episode 10 - Post Episode Discussion
he did the same thing with cierra and bellea. he likes being chased by 2 girls at once and cierra is tolerating it hoping he’ll still pick her at the end 🤷‍♀️ we’ll see what happens,14,1749872950.0,meowplum,1laxbqf,Season 7 - Episode 10 - Post Episode Discussion
"It’s early days. Literally every other woman besides Huda is behaving the same way. Shes told him in the past when she was getting uncomfortable too. Let’s give her a minute this time around, this is only the first day of the bombshells being here",14,1749870137.0,Ruthie_pie,1laxbqf,Season 7 - Episode 10 - Post Episode Discussion
I just keep thinking about her describing herself as emotionally mature,30,1749869154.0,Tacobelle_90,1laxbqf,Season 7 - Episode 10 - Post Episode Discussion
Lmao came in here to say how weird that was,8,1749869098.0,Popculture-junky,1laxbqf,Season 7 - Episode 10 - Post Episode Discussion
soooo high school petty,6,1749869529.0,vladtheinhaler__,1laxbqf,Season 7 - Episode 10 - Post Episode Discussion
I can’t believe she thought that was a normal thing to ask like WHAT,41,1749872127.0,Express_Plant7476,1laxbqf,Season 7 - Episode 10 - Post Episode Discussion
ace and taylor actually have a crush on each other lmao,21,1749869578.0,Equivalent-Year-2857,1laxbqf,Season 7 - Episode 10 - Post Episode Discussion
"lol everything u said is true. Cierra should have learned if nick was ready to ditch bella he’s gonna ditch you too. Everyone’s so sick of Huda it’s obvious, and once J cuts the umbilical cord she’s done for. Ace has lost my heart, i was rooting for him and Chel but she deserves better. Ace thinks he’s all that but he’s rly just a moody boy who “opens up” to Iris more than Chel cuz Chel intimidates tf out of him. he knows she’s too good for him. I hope and pray Iris doesn’t fall for that shit, she has more in common with Nick and a better chance at being in a real relationship.",14,1749869802.0,Several_Sky_6249,1laxbqf,Season 7 - Episode 10 - Post Episode Discussion
[deleted],67,1749875463.0,None,1laxbqf,Season 7 - Episode 10 - Post Episode Discussion
"She too good, wish they brought her in as a later bombshell so we could get the full potential",29,1749867144.0,Affectionate-Bus4152,1laxbqf,Season 7 - Episode 10 - Post Episode Discussion
queen omg,9,1749867186.0,Prudent-Cat-1714,1laxbqf,Season 7 - Episode 10 - Post Episode Discussion
sooooo whaaaaat lol,0,1749867149.0,InternationalHair957,1laxbqf,Season 7 - Episode 10 - Post Episode Discussion
"https://preview.redd.it/qs68xfxg0t6f1.jpeg?width=1242&format=pjpg&auto=webp&s=8172f2a371607079fa821d1e57f48f263ad1ec26

Literally her",47,1749868171.0,Eastern_Effective_49,1laxbqf,Season 7 - Episode 10 - Post Episode Discussion
Reminding me of the toasties fight on UK I can’t remember which season,11,1749870304.0,vyzyxy,1laxbqf,Season 7 - Episode 10 - Post Episode Discussion
Felt like the cheese toastie crash out from season 2 of uk,3,1749870255.0,owynnever,1laxbqf,Season 7 - Episode 10 - Post Episode Discussion
It’s giving how 👏 many 👏 sandwiches 👏 have you made for me lol,2,1749912436.0,XOSnowWhite,1laxbqf,Season 7 - Episode 10 - Post Episode Discussion
"Yes!! Like the Cierra-Pepe-Nic-Iris situation is the exact kind of fun, low stakes drama I want on this show. Not emotional abuse and manosphere talk!!",40,1749871828.0,commelejardin,1laxbqf,Season 7 - Episode 10 - Post Episode Discussion
"I actually snorted when she said that, let the man SLEEP!! you’ve raised his cortisol levels enough girlie😭",90,1749868213.0,irritated_22,1laxbqf,Season 7 - Episode 10 - Post Episode Discussion
Girlfriend needs to do herself a favor and stop talking and go to bed.,24,1749868200.0,shadow87521,1laxbqf,Season 7 - Episode 10 - Post Episode Discussion
Right what kinda pillow talk is this 😭,18,1749870379.0,GigglebangsRiceball,1laxbqf,Season 7 - Episode 10 - Post Episode Discussion
Like girl he barely knows you,7,1749871006.0,Jazzlike-Promise-153,1laxbqf,Season 7 - Episode 10 - Post Episode Discussion
aftersun should b wednesday when we don't get an episode. cos realistically we only get 5 episodes & it's annoying. lmfaooo,55,1749916834.0,Intrepid-Money-9691,1laxbqf,Season 7 - Episode 10 - Post Episode Discussion
Now why would you use this picture 😂😂,8,1749887345.0,Im_an_ag5,1laxbqf,Season 7 - Episode 10 - Post Episode Discussion
Austin reeeeeall freaky deaky,20,1749867350.0,lavenderJayde,1laxbqf,Season 7 - Episode 10 - Post Episode Discussion
“He’s my enemy” 😂😂😂,86,1749873567.0,PuzzleheadedAd8701,1laxbqf,Season 7 - Episode 10 - Post Episode Discussion
"My exact vote!!!! We are all diabolical for wanting Huda and Jeremiah together 😂 I think Huda’s reaction to not being a fan favorite couple would be hilarious

ETA: Iris and Jeremiah together!! My bad",10,1749867954.0,Master-Buy-9872,1laxbqf,Season 7 - Episode 10 - Post Episode Discussion
This is the way!,1,1749869224.0,mittensfourkittens,1laxbqf,Season 7 - Episode 10 - Post Episode Discussion
Exact same for meee,1,1749871775.0,KawaiiiiSkyeeee,1laxbqf,Season 7 - Episode 10 - Post Episode Discussion
He doesn’t even look in her eyes,30,1749870826.0,vyzyxy,1laxbqf,Season 7 - Episode 10 - Post Episode Discussion
"So true, every time he tries to do something,she insults him so why is he gonna want to do more?? And the  fact that she told him to finish his food… He is growing tired of her, quickly! And I’m getting tired of watching it.",13,1749903682.0,TinyEmployment8020,1laxbqf,Season 7 - Episode 10 - Post Episode Discussion
So she says that he should do more cause she’s seeing the other men on the show do more and his response is a shitty breakfast and let her make the breakfast again by herself? It was pointed and this man DOES NOTHING FOR HER,-23,1749899808.0,IntroductionFlat5317,1laxbqf,Season 7 - Episode 10 - Post Episode Discussion
"He’s fine, I would be hannah if I was in that villa",20,1749866660.0,Minimum_Neat_7059,1laxbqf,Season 7 - Episode 10 - Post Episode Discussion
he’s fine but the joker tat is crazy 😭,15,1749867486.0,moonprincess642,1laxbqf,Season 7 - Episode 10 - Post Episode Discussion
The upper third of his face does nothing for me.,12,1749871562.0,Such-Salary8387,1laxbqf,Season 7 - Episode 10 - Post Episode Discussion
"He’s so respectful but also it’s obvious he’s eating her with his eyes, also he didn’t pull nobody else like he for real wants her and she deserve",32,1749875248.0,_valiii,1laxbqf,Season 7 - Episode 10 - Post Episode Discussion
I just took it as he has a big ego. He just can't see Chelly wanting someone over him.,54,1749872106.0,blaqeyerish,1laxbqf,Season 7 - Episode 10 - Post Episode Discussion
He’s an odd dude,36,1749872086.0,Extreme-Coach2043,1laxbqf,Season 7 - Episode 10 - Post Episode Discussion
"""she knows where home is"" 


oh, with austin? the guy who picked her?",48,1749872010.0,Necessary-Cause3022,1laxbqf,Season 7 - Episode 10 - Post Episode Discussion
i didnt even catch this. i was a fan of ace but i dont like this. Hes full of himself and for the wrong girl. Chelly is a 10,13,1749872526.0,Ill_Jackfruit_1483,1laxbqf,Season 7 - Episode 10 - Post Episode Discussion
Might have been cute if they were actually coupled up lol,7,1749874386.0,Realistic-Quiet-8856,1laxbqf,Season 7 - Episode 10 - Post Episode Discussion
Consent is sexy and I will die on that hill,25,1749868130.0,myskepticalbrowarch,1laxbqf,Season 7 - Episode 10 - Post Episode Discussion
I love them 😫😫😫,5,1749868012.0,helloimhere000,1laxbqf,Season 7 - Episode 10 - Post Episode Discussion
I did too!!! And plus my son’s name is Jalen so I’m here for it. Lol,1,1749904411.0,Realistic-Entry4800,1laxbqf,Season 7 - Episode 10 - Post Episode Discussion
Make your own tacos LMAOOOOOOOOOO,40,1749867403.0,Eastern_Effective_49,1laxbqf,Season 7 - Episode 10 - Post Episode Discussion
"For REAL. It’s still wild to me that chelley never once asked him why he picked Amaya and not her and then loved the way he did immediately after. Girl, be so for real.",18,1749867700.0,celaenos,1laxbqf,Season 7 - Episode 10 - Post Episode Discussion
Frfr. I can’t. I need this to Ace and Chelley stuff to be done. Ace is for the streets (respectfully),18,1749867467.0,Acceptable_Account15,1laxbqf,Season 7 - Episode 10 - Post Episode Discussion
Nah Iris is getting paired with Jeremiah. We are ready for the crash out,9,1749867559.0,Mojo_Gojo_,1laxbqf,Season 7 - Episode 10 - Post Episode Discussion
😭😭😭😭😭,1,1749869318.0,Subject-Midnight6662,1laxbqf,Season 7 - Episode 10 - Post Episode Discussion
"Austin has no other love interest, so i think they are telling Chelley to not make a decision on purpose. Charlie will be single soon and he love him some Chelley 😂",1,1749888352.0,Cleo_daisy7,1laxbqf,Season 7 - Episode 10 - Post Episode Discussion
"?!?!?!?!?!?!?!?!?!


okay everyone has an opinion. but people going to his ig page and spouting that is actual foul behavior like that's genuinely DERANGED.


we (the audience) owe jalen and pepe formal apologies because they did their damn jobs this episode",58,1749872697.0,Necessary-Cause3022,1laxbqf,Season 7 - Episode 10 - Post Episode Discussion
"Also he’s literally not ugly, he’s a cute looking man and seems sweet.",60,1749872498.0,softassassin69,1laxbqf,Season 7 - Episode 10 - Post Episode Discussion
"Him and Pepe are very good looking, those leather outfits just did nothing for them LOL.",35,1749872654.0,ClamzOut247,1laxbqf,Season 7 - Episode 10 - Post Episode Discussion
"agree, and from what i’ve seen so far, he seems so sweet! i don’t think he is bad looking at all and i think personality can make someone much more attractive. people are judging behind their screens. internet culture has made us more likely to judge appearances and rate people based on numbers which is so sad",24,1749872539.0,Ill-Ad5982,1laxbqf,Season 7 - Episode 10 - Post Episode Discussion
"You should look at Ace’s and Huda’s comments to, so vial! I gut not liking islanders but some of the comments people leave, I’m actually shocked! Like how can real people say this",13,1749872562.0,Sweetrk-2020,1laxbqf,Season 7 - Episode 10 - Post Episode Discussion
"I'd like to see what those people look like, Jaylen ugly--show yourselves, then we can talk. An unattractive personality can turn a 10 to a 4 real fast. This man carries himself like a man, converses and looks a woman in the eye when engaging in conversation and asks for consent for a peck on the cheek. Those are attractive qualities to me, idk 'bout you.",7,1749897459.0,TooPoorForHousing,1laxbqf,Season 7 - Episode 10 - Post Episode Discussion
that’s crazy to go to someone’s IG and tell them you don’t find them attractive. some of this fan base is as certifiable as Huda.,5,1749875818.0,not_ellewoods,1laxbqf,Season 7 - Episode 10 - Post Episode Discussion
That’s crazy. He and Charlie are the only ones I think are attractive. Everyone losing their minds over Nic and I’m like ?????,4,1749883220.0,CaliforniaBruja,1laxbqf,Season 7 - Episode 10 - Post Episode Discussion
Right!!!!,1,1749879470.0,MysteriousResearch86,1laxbqf,Season 7 - Episode 10 - Post Episode Discussion
how did this happen!!! i love our emotionally stable human doll with her pool boy himbo 🥹,18,1749870192.0,tealynnn,1laxbqf,Season 7 - Episode 10 - Post Episode Discussion
bye cause I like them 🥹 and I shouldn’t bc of him but I do fuuuck,9,1749871165.0,Outrageous_Ad6776,1laxbqf,Season 7 - Episode 10 - Post Episode Discussion
OMG why am I smiling at the screen now 🥲,18,1749869541.0,Askanything236,1laxbqf,Season 7 - Episode 10 - Post Episode Discussion
omg she's literally smiling,22,1749869613.0,GurAway2117,1laxbqf,Season 7 - Episode 10 - Post Episode Discussion
guys stay focused 😭 I don't want them to make it outside and have her see all these things about him,7,1749871951.0,Interesting_Race6965,1laxbqf,Season 7 - Episode 10 - Post Episode Discussion
They’re cute af,17,1749869717.0,AppearanceAsleep128,1laxbqf,Season 7 - Episode 10 - Post Episode Discussion
🥺🥹,7,1749869530.0,greenjilly,1laxbqf,Season 7 - Episode 10 - Post Episode Discussion
"I am mid episode and had to rewind, she looks so content… 🫠 

Why is Austin my favorite man at the moment in the villa",12,1749869529.0,Goodkoalie,1laxbqf,Season 7 - Episode 10 - Post Episode Discussion
I hope the show provides enough support cause she is going to be in a really dark space post show and I feel bad for her daughter to,36,1749870723.0,Sweetrk-2020,1laxbqf,Season 7 - Episode 10 - Post Episode Discussion
They kinda deserve each other. I almost feel bad for inflicting him on Iris.,25,1749871841.0,codingcrystal,1laxbqf,Season 7 - Episode 10 - Post Episode Discussion
"This is why I can’t find it in me to have much sympathy for him. He had a game plan from day one, and more than met his match.",20,1749872651.0,AgreeableLaugh1171,1laxbqf,Season 7 - Episode 10 - Post Episode Discussion
FAFO,15,1749871846.0,eurekadabra,1laxbqf,Season 7 - Episode 10 - Post Episode Discussion
i def see this being true and if so it's funny because like all the girls had pointed out unless you're also toxic you're seeing right through the love bombing and plan so either way he was fuckex,10,1749871794.0,Fair_Agent9320,1laxbqf,Season 7 - Episode 10 - Post Episode Discussion
Honestly kudos from the producers making it difficult for Jeremiah to scam! If he'd been paired with someone reasonably chill he'd be coming across as very smitten and respectful right now. Not sure he'd win but final 4 for sure.,2,1749892298.0,buffys_sushi_pjs,1laxbqf,Season 7 - Episode 10 - Post Episode Discussion
[deleted],70,1749868274.0,None,1laxbqf,Season 7 - Episode 10 - Post Episode Discussion
Doesn’t he have a girlfriend on the outside?,3,1749870688.0,shhmurdashewrote,1laxbqf,Season 7 - Episode 10 - Post Episode Discussion
well technically he did put the dance thing together like a day or two before so they can get into the physical stuff.,4,1749870821.0,simpforsanae,1laxbqf,Season 7 - Episode 10 - Post Episode Discussion
He's a Cancer ♋️ 🤗,23,1749875314.0,lil_peanutt,1laxbqf,Season 7 - Episode 10 - Post Episode Discussion
It helps that Hannah is just so obviously horny lol. Like I can feel her from the screen it’s crazy. And no shaming at all here bc I get it and I would be Hannah too if I was on Love Island.,23,1749875779.0,hanoihiltonsuites,1laxbqf,Season 7 - Episode 10 - Post Episode Discussion
Giving couple that should’ve broken up years ago. But they’ve known eachother for 9 days,32,1749871706.0,vyzyxy,1laxbqf,Season 7 - Episode 10 - Post Episode Discussion
no the crazy thing is it hasn’t even been two weeks yet 🫩 it’s only been like 9 days 😭😭😭,31,1749867444.0,lovebbygrapes,1laxbqf,Season 7 - Episode 10 - Post Episode Discussion
"Her asking Taylor was craaazy, like it blew my mind and was so insane",21,1749867620.0,Frenchorican,1laxbqf,Season 7 - Episode 10 - Post Episode Discussion
“Would you share your location?” 👀,14,1749867732.0,evilgiraffe04,1laxbqf,Season 7 - Episode 10 - Post Episode Discussion
"- talking to Amaya and editorializing the whole thing, making herself look like the kindest victim. When in reality she is doing all of thissss^^^",15,1749867842.0,Economy_Material_669,1laxbqf,Season 7 - Episode 10 - Post Episode Discussion
and the fact that she ASKED taylor. and lied to jeremiah to make him feel bad. smh.,9,1749868089.0,SnooCupcakes4799,1laxbqf,Season 7 - Episode 10 - Post Episode Discussion
Cooking together would have been cute. She was hounding him about doing cute things for her to show her he cares. She should keep that energy for herself as well. I’m not sure it would have saved her from all the other ways she was moving weird but it would have made the morning pleasant for them both instead of what she turned their day into.,10,1749867744.0,Lucy_Lucidity,1laxbqf,Season 7 - Episode 10 - Post Episode Discussion
"What about the “finish your breakfast, you’re a man and need to be strong” after he’s told her multiple times that he feels like she treats him alike a child or a dog.",7,1749879725.0,Odd-Sail-1694,1laxbqf,Season 7 - Episode 10 - Post Episode Discussion
And “would you share your location with me” huda cmon,7,1749867761.0,Mediocre_Tax_4171,1laxbqf,Season 7 - Episode 10 - Post Episode Discussion
She thinks her child pushes men away but in reality it's her.,7,1749875865.0,VotingRightsLawyer,1laxbqf,Season 7 - Episode 10 - Post Episode Discussion
"I knew something was off when she brought up her ""emotional maturity"" twice by episode 2. I couldn't pinpoint what it was, but my radar was going off. Turns out it was her manipulative, possessive, belittling, emotionally draining behavior radiating through my screen.   
  
Sad thing is, I don't think she realizes her behavior is the reason why she has trouble dating and not because ""I'm a Mom"".",2,1749900136.0,TooPoorForHousing,1laxbqf,Season 7 - Episode 10 - Post Episode Discussion
"Exactly. He is a pick me. Once he is with you, it’s over. I have a feeling he won’t be attracted to her once she is sharing a bed with him. It’s just keeping him entertained until he gets with someone near the end ",37,1749866892.0,Cleo_daisy7,1laxbqf,Season 7 - Episode 10 - Post Episode Discussion
I think she’s just a freaky gal,29,1749868239.0,anonxo02,1laxbqf,Season 7 - Episode 10 - Post Episode Discussion
"Yeah, she needs therapy ASAP.",12,1749870286.0,KDSD628,1laxbqf,Season 7 - Episode 10 - Post Episode Discussion
lol a man in week two asking about location sharing would be crucified,13,1749870442.0,Tacobelle_90,1laxbqf,Season 7 - Episode 10 - Post Episode Discussion
Her telling Jeremiah he should be doing more things for her like she’s ridiculous lol,12,1749870432.0,kdrizzyyy,1laxbqf,Season 7 - Episode 10 - Post Episode Discussion
"you don’t get it, she’s a mom.",12,1749870652.0,Several_Sky_6249,1laxbqf,Season 7 - Episode 10 - Post Episode Discussion
Girl I can't believe she asked for Taylor to make her pancakes and then gets mads Jeremiah didn't automatically do it without knowing she wanted help,6,1749870567.0,Inside-Athlete6631,1laxbqf,Season 7 - Episode 10 - Post Episode Discussion
"“Imagine a man acting like her” - that’s my biggest argument. Like I would love to say I support all women and “women’s wrongs” lol and I do see a piece of myself and my women friends in her… we all have our moments and especially while we’re young we are desperate for that undying love type of thing. But I really can’t make excuses for her behavior at this point. If a man acted that way, I know it would be extremely alarming

That being said, I don’t like how Jeremiah keeps using language towards her that references motherhood (specifically in a negative connotation). It’s clear she has a sensitive spot for that part of her identity. He seems to throw it in her face and that probably triggers some unhealthy behavior. Not excusing that behavior, just saying it isn’t fair for him to do that either",2,1749879432.0,Quinnietakes,1laxbqf,Season 7 - Episode 10 - Post Episode Discussion
I feel for Charlie idk😭 Coming in as a bombshell and getting hardly any attention from anyone must be a self esteem hit. This show is so brutal sometimes😂,42,1749872480.0,Express_Plant7476,1laxbqf,Season 7 - Episode 10 - Post Episode Discussion
She’s gonna call the public btches now,74,1749869469.0,Jazzlike-Hall7987,1laxbqf,Season 7 - Episode 10 - Post Episode Discussion
"Nah I like that he stood his ground, why should he have left?",17,1749870368.0,Wundle,1laxbqf,Season 7 - Episode 10 - Post Episode Discussion
Chelley is such an idiot for not pursuing Charlie he was so into her. And now she’s stuck with red pill incel manosphere guy and a bigot,17,1749870526.0,vyzyxy,1laxbqf,Season 7 - Episode 10 - Post Episode Discussion
No but why was he oozing testosterone it was so hot especially after his dog collar simping yesterday I almost got the ick,5,1749870871.0,B-la-trix,1laxbqf,Season 7 - Episode 10 - Post Episode Discussion
When Pepe put out his hand to shake it he looked at him mean as hell lol,2,1749871522.0,Realistic-Quiet-8856,1laxbqf,Season 7 - Episode 10 - Post Episode Discussion
"I think his stubble is making him a lot hotter as well.   
I thought that was rude of Pepe to ask him to leave, Pepe also did a similar ""friendly touch"" that he did with Nic earlier that would bug me too.

I think Charlie just isn't very funny, or perhaps isn't relaxed enough to show his humourous side, which is why a lot of girls haven't gravitated towards him.",2,1749872280.0,sparkling-spirit,1laxbqf,Season 7 - Episode 10 - Post Episode Discussion
He wants in that villaaaaa,18,1749871174.0,vyzyxy,1laxbqf,Season 7 - Episode 10 - Post Episode Discussion
"He straight up told Cierra she’s “not like other girls” and I immediately got the ick. She was trying to have a genuine conversation with him and he just kept lovebombing her. As goofy as Nic is, I think their conversations are genuine and they have a lot of fun together.",9,1749873302.0,PerceptionOk5407,1laxbqf,Season 7 - Episode 10 - Post Episode Discussion
Not a good look for movie night Pepe,7,1749871833.0,Spirited-Chemistry45,1laxbqf,Season 7 - Episode 10 - Post Episode Discussion
"Yep.  I’m not a Pepe fan.  Plus, even though he ‘opened a kids after school program’ I got the ick when he said he ‘hated the kids after 3 hours’",14,1749871800.0,MealPrepGenie,1laxbqf,Season 7 - Episode 10 - Post Episode Discussion
game is game,0,1749873891.0,kelekele27,1laxbqf,Season 7 - Episode 10 - Post Episode Discussion
Producers might only be showing us their bad moments. Not defending them I hate them together but I always try and remember production,10,1749880909.0,eternalteen,1laxbqf,Season 7 - Episode 10 - Post Episode Discussion
"😂😂😂😂 that last part just took me out, he’s plan couldn’t be going any worse. Bet he never expected to play step daddy. Can’t blame the guy for trying but he’s got to know when to quit.",5,1749878950.0,Loud-Sweet6095,1laxbqf,Season 7 - Episode 10 - Post Episode Discussion
I think he likes that she’s so crazy and possessive about him. But I don’t think he realizes he’s not having fun in the villa. He looks miserable and it’s not fun to watch as a viewer. I’d rather them both gone. I don’t think they will connect with anyone else,22,1749908650.0,Educational_Bother36,1laxbqf,Season 7 - Episode 10 - Post Episode Discussion
They are in a death spiral but it hasn’t progressed far enough for him to leave yet. He’s getting irritated and she senses it and then doubles down on things irritating him. It’s a cycle that will play out over time,11,1749910345.0,Ancient-Row-2144,1laxbqf,Season 7 - Episode 10 - Post Episode Discussion
he doesn’t  and they aren’t leaving each other trust. If he didn’t wanna be there he could have grafted more with Amaya & Cierra. but he didn’t,4,1749909417.0,Outrageous_Ad6776,1laxbqf,Season 7 - Episode 10 - Post Episode Discussion
[deleted],3,1749908207.0,None,1laxbqf,Season 7 - Episode 10 - Post Episode Discussion
💯,1,1749907161.0,ShortBread11,1laxbqf,Season 7 - Episode 10 - Post Episode Discussion
