comment,score,created_utc,author,episode_post_id,episode_title
Yeah he’s definitely wrong for using her being a mom against her. You can tell how much it hurts her every time.,14,1749890160.0,Admirable_Writer354,1laxbqf,Season 7 - Episode 10 - Post Episode Discussion
I’m not interested in Charlie’s reaction. I am interested in Nics,12,1749868133.0,vyzyxy,1laxbqf,Season 7 - Episode 10 - Post Episode Discussion
I was too! I picked Hannah bc I like Nic more tbh,6,1749868078.0,SnooGuavas4919,1laxbqf,Season 7 - Episode 10 - Post Episode Discussion
"I SCROLLED 500 TIMES you are the first person that matched my vote. I can sleep now, fuck.",2,1749868008.0,Software-Substantial,1laxbqf,Season 7 - Episode 10 - Post Episode Discussion
TWINNNNNNN,2,1749866855.0,Measamom,1laxbqf,Season 7 - Episode 10 - Post Episode Discussion
"100000% everything you said!! Mind you iris was interested and he said no so remind me again why we should “free him” ?? He’s a scammer and he wants that 100k!! He is no victim, even tho I agree with everything you said about hudas qualities and she needs to work on herself big time, he is grown AND she’s right breakfast IS bare minimum",6,1749873834.0,PuzzleheadedAd8701,1laxbqf,Season 7 - Episode 10 - Post Episode Discussion
I want her w Ace!,2,1749873954.0,Original-Disaster444,1laxbqf,Season 7 - Episode 10 - Post Episode Discussion
i’m so with you but we are in enemy territory 💔 these people are all jeremiah lovers,0,1749873520.0,tw1nklemarz,1laxbqf,Season 7 - Episode 10 - Post Episode Discussion
I’d love nothing less😭,7,1749869108.0,ripnoyaki,1laxbqf,Season 7 - Episode 10 - Post Episode Discussion
I voted Amaya!! Hannah will be around still for the drama,8,1749866870.0,seastar11,1laxbqf,Season 7 - Episode 10 - Post Episode Discussion
"The girls are picking this week, every girl is safe, including Amayah",10,1749866861.0,Rabitrights,1laxbqf,Season 7 - Episode 10 - Post Episode Discussion
i like hannah for him 🤷🏻‍♀️ they seem like they have stuff in common and match each others vibe,3,1749866899.0,bentleyrocks2,1laxbqf,Season 7 - Episode 10 - Post Episode Discussion
i can hate both of them! i want better for chelley,4,1749869368.0,kanjiklvb,1laxbqf,Season 7 - Episode 10 - Post Episode Discussion
[removed],1,1749869257.0,None,1laxbqf,Season 7 - Episode 10 - Post Episode Discussion
I agree but in this case we are trying to send a message to Jeremiah 😂 that’s not easy for us to do,7,1749870724.0,Maleficent-Orchid755,1laxbqf,Season 7 - Episode 10 - Post Episode Discussion
"despite austin's apparent chemistry with amaya, i do NOT want austin paired up with another black woman after hearing about how his high school peers shared that austin was very anti-black.",0,1749867898.0,thethuyvy,1laxbqf,Season 7 - Episode 10 - Post Episode Discussion
[deleted],6,1749867391.0,None,1laxbqf,Season 7 - Episode 10 - Post Episode Discussion
🍅🍅🍅🍅🍅🍅🍅,10,1749866911.0,emmiezonatea,1laxbqf,Season 7 - Episode 10 - Post Episode Discussion
"At least with this Austin would be free from the triangle, but he also might be free from the villa.",2,1749867124.0,DaemonDesiree,1laxbqf,Season 7 - Episode 10 - Post Episode Discussion
"No, we won’t find out until the show on Sunday",4,1749867039.0,hereforthedolla,1laxbqf,Season 7 - Episode 10 - Post Episode Discussion
No. We won't find out until Sunday.,3,1749867429.0,Waste_Dig_8439,1laxbqf,Season 7 - Episode 10 - Post Episode Discussion
Carrington even down to how he speaks,5,1749868228.0,Tasty-Temporary9456,1laxbqf,Season 7 - Episode 10 - Post Episode Discussion
Ace does not need this ego boost,9,1749867173.0,Affectionate-Bus4152,1laxbqf,Season 7 - Episode 10 - Post Episode Discussion
This was me too.,1,1749867184.0,InternationalHair957,1laxbqf,Season 7 - Episode 10 - Post Episode Discussion
why tf would you vote ace,0,1749867210.0,bromarmcbuckets,1laxbqf,Season 7 - Episode 10 - Post Episode Discussion
He’s literally talking up space atp.,5,1749868824.0,MysteriousResearch86,1laxbqf,Season 7 - Episode 10 - Post Episode Discussion
Same he’s so funny but he’s been slacking on the whole “love” part in love island,2,1749866884.0,acho-o-o-o,1laxbqf,Season 7 - Episode 10 - Post Episode Discussion
">don't care about iris's experience on the island

what show are you watching where the point is for the people to have a nice island experience. this thing is about a production team torturing hot people.",10,1749867696.0,glyphlevel,1laxbqf,Season 7 - Episode 10 - Post Episode Discussion
The way you don’t care about the VIEWERS experience is cringe as a viewer yourself,18,1749867495.0,ForgeFireNotWar,1laxbqf,Season 7 - Episode 10 - Post Episode Discussion
"if anything the producers don’t care, if they did they wouldn’t have sent out the vote. messiness is what we want to see not happily ever afters ALL the time. they have so much time left to go back to whoever they want to have an experience with we are just shaking things up",3,1749867968.0,SnooCupcakes4799,1laxbqf,Season 7 - Episode 10 - Post Episode Discussion
I agree!! She did say she’s interested but she also said she’s getting the ick. They also barely had any good conversation.,2,1749867769.0,veronimacaroni_,1laxbqf,Season 7 - Episode 10 - Post Episode Discussion
 I actually don’t give a damn about any of their experiences on this island. I watch this show for drama and I will vote accordingly.,2,1749902326.0,SydTheStreetFighter,1laxbqf,Season 7 - Episode 10 - Post Episode Discussion
Just because we choose to partner them up doesn't mean she canr get to know other people and choose someone else at the next recoupling,3,1749868936.0,octobry,1laxbqf,Season 7 - Episode 10 - Post Episode Discussion
I think Ace'll get immunity though 😭😭😭,3,1749866865.0,AnxiousAnonEh,1laxbqf,Season 7 - Episode 10 - Post Episode Discussion
You and me both!,2,1749867208.0,Measamom,1laxbqf,Season 7 - Episode 10 - Post Episode Discussion
I voted the same way 🩷,1,1749866957.0,Dry_Peak_5335,1laxbqf,Season 7 - Episode 10 - Post Episode Discussion
IF UR IN LINE…STAY IN LINE…YOU CAN VOTE,18,1749866573.0,Ratgarbagegirl,1laxbqf,Season 7 - Episode 10 - Post Episode Discussion
The sub includes aftersun in the episode count so technically only 9 episodes of the show but 10 including aftersun,2,1749867076.0,lkjhggfd1,1laxbqf,Season 7 - Episode 10 - Post Episode Discussion
aftersun counts as episodes so maybe the first aftersun,2,1749867216.0,slothhh28837938271,1laxbqf,Season 7 - Episode 10 - Post Episode Discussion
They'll be coupled and love island will do a dumping then have them recouple again for our first major vote of the season,2,1749867485.0,KindaTomas,1laxbqf,Season 7 - Episode 10 - Post Episode Discussion
Correct. It’s a majority vote (and could be rigged for all we know),2,1749867513.0,lolofreeb,1laxbqf,Season 7 - Episode 10 - Post Episode Discussion
"They will likely just stay single until the next recoupling which should be a couple days later.

But the single girl choosing a guy to couple up with would be interesting!",7,1749869134.0,iSocialista,1laxbqf,Season 7 - Episode 10 - Post Episode Discussion
If that were the case I feel like she would choose nic just bc she shared her secret with him,6,1749869042.0,Delusional-WithLove,1laxbqf,Season 7 - Episode 10 - Post Episode Discussion
I’m not even convinced it’s recoupling it might just be a date and recoupling Tuesday,-3,1749869046.0,vyzyxy,1laxbqf,Season 7 - Episode 10 - Post Episode Discussion
"Your post has been removed because it either violates our community mission, straddles the fence on our rules and site-wide rules, or may have received multiple reports.

Our mission is to be welcoming, friendly, and for all of us to have fun while discussing Love Island. We ask that you take this time to review our [rules](https://www.reddit.com/r/LoveIslandUSA/wiki/rules/) which can be found on the sidebar of LoveIslandUSA homepage.",1,1749947538.0,LoveIslandUSA-ModTeam,1laxbqf,Season 7 - Episode 10 - Post Episode Discussion
Lmaooo exactly 🤣🤣,1,1749868569.0,MysteriousResearch86,1laxbqf,Season 7 - Episode 10 - Post Episode Discussion
"Not happening BUT we need a bombshell for Austin, he deserves it",4,1749867364.0,UnbearablyCranky,1laxbqf,Season 7 - Episode 10 - Post Episode Discussion
maybe this one just isn’t for you. i’m loving it so far. but i’m here for the mess.,7,1749872334.0,not_ellewoods,1laxbqf,Season 7 - Episode 10 - Post Episode Discussion
"I can’t watch the UK this season because the racism is too much. It’s always bad there, but watching the Asian and Black women get mistreated time and again is exhausting. At least on US the people are actually attracted to each other",2,1749902461.0,SydTheStreetFighter,1laxbqf,Season 7 - Episode 10 - Post Episode Discussion
BYE 👋👋👋,1,1749873155.0,Realistic-Lake5897,1laxbqf,Season 7 - Episode 10 - Post Episode Discussion
If they were just going to send them on a date that would have been what the vote was for and it would have been stated plainly. They’ve had those type of votes before.,6,1749869195.0,iSocialista,1laxbqf,Season 7 - Episode 10 - Post Episode Discussion
It’s girls choice next so she’d probably be in a friendship couple with one of the vulnerable guys she’s friends with,4,1749869254.0,bellycoconut,1laxbqf,Season 7 - Episode 10 - Post Episode Discussion
Single 👏and 👏vulnerable 👏finally 👏😂,9,1749869173.0,peasandthankyous,1laxbqf,Season 7 - Episode 10 - Post Episode Discussion
Wouldn't be surprised if they dump all vulnerable islanders and then bring in a guy and girl bombshell the next day..,4,1749869171.0,dreamer-102,1laxbqf,Season 7 - Episode 10 - Post Episode Discussion
Lmaooo voting for huda is crazy,8,1749867195.0,Mobile-List-4333,1laxbqf,Season 7 - Episode 10 - Post Episode Discussion
Voting Huda is messy lol,3,1749867195.0,MixEffective,1laxbqf,Season 7 - Episode 10 - Post Episode Discussion
Omfg wait Huda going on a date would be crazy,3,1749867173.0,1010beeboo,1laxbqf,Season 7 - Episode 10 - Post Episode Discussion
Eyal is a HUGE zionist …,2,1749867758.0,iamabarbchile,1laxbqf,Season 7 - Episode 10 - Post Episode Discussion
don’t care we’re voting for them,21,1749866758.0,lovebbygrapes,1laxbqf,Season 7 - Episode 10 - Post Episode Discussion
Fr I don’t like Huda at all but if anyone needs to be humbled it is Jeremiah. Bare-minimum man does not need a bombshell “gifted” to him.,5,1749867160.0,happybluecheese,1laxbqf,Season 7 - Episode 10 - Post Episode Discussion
how has he made it clear he won’t budge? the only thing clear is that he’s starting to pick up on her red flags,2,1749866976.0,knpv91,1laxbqf,Season 7 - Episode 10 - Post Episode Discussion
"He’s in it to win. He’s mentioned it before. If he sees America doesn’t like their coupling, he will most likely jump ship",2,1749867043.0,EntertainmentFar2449,1laxbqf,Season 7 - Episode 10 - Post Episode Discussion
Call me delusional but SAME. She really likes him and I just want him to wake the fuck up see what he has and treat her like queen she is.,3,1749944323.0,Complete_Mud8726,1laxbqf,Season 7 - Episode 10 - Post Episode Discussion
"Ace looks good everyday. he’s a fuckboy, but i still have functioning eyes. thank god he’s short.",8,1749870397.0,not_ellewoods,1laxbqf,Season 7 - Episode 10 - Post Episode Discussion
"well, yes!",4,1749868864.0,missed_on3,1laxbqf,Season 7 - Episode 10 - Post Episode Discussion
he always looks good idc i am an Ace defender,2,1749868794.0,Alternative_Net_738,1laxbqf,Season 7 - Episode 10 - Post Episode Discussion
I don't want to see her crash out; I just think they aren't right for each other. Jeremiah ain't gonna be a step daddy; he's done. Huda needs to leave and work on herself.,8,1749870512.0,Complex-Present3609,1laxbqf,Season 7 - Episode 10 - Post Episode Discussion
"i’m not praying for anyone’s downfall, jeremaiah will be in the most controlling and codependent relationship if this goes all the way. he needs some intervention",5,1749870854.0,Aggravating_Ice9113,1laxbqf,Season 7 - Episode 10 - Post Episode Discussion
"If that’s the case she shouldn’t be on Love Island, no? That’s the show, and they’re not even deep enough in for a crash out to be justified.",5,1749871033.0,bbqsaucebaabe,1laxbqf,Season 7 - Episode 10 - Post Episode Discussion
"Also, it’s just going to be so lame - he doesn’t like Iris lol. He’s just going to ignore her and sleep in soul ties.",5,1749870332.0,KDSD628,1laxbqf,Season 7 - Episode 10 - Post Episode Discussion
"
We dont know what anyone’s mental health is…why do we have to put on kid gloves only when it’s involving Huda.",2,1749902730.0,SydTheStreetFighter,1laxbqf,Season 7 - Episode 10 - Post Episode Discussion
Yea the laughing was  uncalled for but huda is coming off so unlikeable I cant bring myself to root for her,6,1749866960.0,Affectionate-Bus4152,1laxbqf,Season 7 - Episode 10 - Post Episode Discussion
Nah that bigot can go,30,1749869835.0,mitzilarue,1laxbqf,Season 7 - Episode 10 - Post Episode Discussion
Yessss I wanna see him with someone on his level of freak,-6,1749869777.0,InterviewWeary5708,1laxbqf,Season 7 - Episode 10 - Post Episode Discussion
Yeah I did - I wanted to give her who she actually likes and who likes her back (the Jeremiah people are kind of shortsighted lol - he’s going to ignore Iris),2,1749870857.0,KDSD628,1laxbqf,Season 7 - Episode 10 - Post Episode Discussion
How does voting Ace make him go home?,1,1749868051.0,Glittering_Tax9287,1laxbqf,Season 7 - Episode 10 - Post Episode Discussion
oh no I’m sorry buddy never ask the internet to rate something you did,4,1749867510.0,hugemessanon,1laxbqf,Season 7 - Episode 10 - Post Episode Discussion
Jeremiah is the only acceptable man,6,1749866889.0,BagRight8939,1laxbqf,Season 7 - Episode 10 - Post Episode Discussion
Yikes,1,1749867128.0,SpookusDookus,1laxbqf,Season 7 - Episode 10 - Post Episode Discussion
Dang they did u dirty😭,1,1749867958.0,Software-Substantial,1laxbqf,Season 7 - Episode 10 - Post Episode Discussion
I don’t know why they downvoted you. Lol I don’t agree but I can see that because Jeremiah is playing a game just like she is.,1,1749912117.0,VMaterialistic,1laxbqf,Season 7 - Episode 10 - Post Episode Discussion
"Yall call every single episode boring. I’m sorry, atp I have no clue what fans are expecting.",54,1749923864.0,lurkingvinda,1laxbqf,Season 7 - Episode 10 - Post Episode Discussion
"the thing with ""if u not gonna treat me right im gone"" she obviously isn't getting what she wants from jeremiah but she hasn't ""left"" so that's why it's frustrating. 

let me also say, i followed huda on tiktok for like over a year! i was obsessed w her gym videos cos she rly went from flat to a fatty back there & she always seemed mad chill, she is the WHOLE REASON im watching love island. since i found out she was gonna b on s7 i watched s6 in it's entirety, & im on s5 rn... huda is acting crazy... & this is from a former faaaann. the shits she's doing isn't cute, it's possessive.... it's been what... 10, or 12 days??? it's way too much. even kaylor who was obsessed w aaron & was together from the start didn't act like this, this early on.",13,1749917279.0,Intrepid-Money-9691,1laxbqf,Season 7 - Episode 10 - Post Episode Discussion
"After the recoupling, she asked him what he had planned for them. He said “I’m gonna work hard to show you how much I care about you”. She responded “No. just be yourself.” ….. why say that if you actually DID want him to work harder and NOT just be himself? 😂 Himself actually seems very laid back and non performative.",15,1749912622.0,Cold-Air-9780,1laxbqf,Season 7 - Episode 10 - Post Episode Discussion
"Huda’s comments about Jeremiah not planning anything for her would be more valid if she wasn’t nitpicking every little thing the dude does. Some examples off the top of my head include: (1) her little comments whenever he brings her breakfast (almost every breakfast scene she is saying “oh no protein?” “Oh no water?”), (2) her little comments about how they are going to move in together and sharing his location when they get out when it’s only been about 10 days and he has clearly communicated that it is still too early to commit to all of that, (3) the tone she uses in these conversations with Jeremiah and how she spins it around to make Jeremiah feel like he is doing something wrong just because he didn’t give the exact answer she wants

Does she even truly like Jeremiah or does she just like the idea of being in a relationship? We never see her ask about him or his wants or needs. In fact there was that one time he said I don’t like when you mother me or make comments like that”you’re doing great” and Huda completely ignored that and continues to do exactly that",17,1749913114.0,kerrygoldlover,1laxbqf,Season 7 - Episode 10 - Post Episode Discussion
Once this sub hates someone everything else they do is wrong even when it’s kinda valid,5,1749914657.0,peachypolerina,1laxbqf,Season 7 - Episode 10 - Post Episode Discussion
Girl to be fair with what time she’s attached to his hip if it were up to her she would put him on a leash… he wouldn’t even be able to sneak out at night cause they be ***** in that room full of people. They skipped that step because she never gave the space for it.,3,1749912559.0,PlanktonFuture9477,1laxbqf,Season 7 - Episode 10 - Post Episode Discussion
"I make Birria Tacos, steaks, Lasagna, Shepherds Pie,  Chicken Fry rice, honestly a bunch of stuff and I fucking throw hands at pancakes.

Probably because it feels like baking in a frying pan and I hate baking",6,1749901665.0,ImSlowlyFalling,1laxbqf,Season 7 - Episode 10 - Post Episode Discussion
stop misusing that word.,10,1749895838.0,lovezukoooo,1laxbqf,Season 7 - Episode 10 - Post Episode Discussion
Girl I'm a 30 year old woman and I still fuck up pancakes. I've been cooking since I was 10. Get out of here with that,12,1749898349.0,CarolCroissant,1laxbqf,Season 7 - Episode 10 - Post Episode Discussion
You live in a fantasy world,8,1749895699.0,JamesMaldwin,1laxbqf,Season 7 - Episode 10 - Post Episode Discussion
It’s pancakes. If we were talking about boiling water then you’d have a point,5,1749897083.0,Dazzling_Turnip_9174,1laxbqf,Season 7 - Episode 10 - Post Episode Discussion
Your overall comment karma being near negatives tracks 🤣💀,1,1749925789.0,Caldel1992,1laxbqf,Season 7 - Episode 10 - Post Episode Discussion
Also he can’t just act like a victim when the whole house saw him love bomb and now act cold to Huda. Typical narcissistic cycle,0,1749895228.0,IntroductionFlat5317,1laxbqf,Season 7 - Episode 10 - Post Episode Discussion
but girlll he told Belledasha he wanted to save her if she weren’t still hung up on Nic… which woulda made Olandria go home. Olandria deserves better!!,11,1749870862.0,Express_Plant7476,1laxbqf,Season 7 - Episode 10 - Post Episode Discussion
"It’s reality tv, just have fun 🙄",11,1749867963.0,BuyPsychological3300,1laxbqf,Season 7 - Episode 10 - Post Episode Discussion
"No, no, no, we don’t want her out just yet. We want her to CRASH out.",-1,1749867715.0,Chemical-Ad1426,1laxbqf,Season 7 - Episode 10 - Post Episode Discussion
No no this is the plot lol,-1,1749867883.0,Economy_Material_669,1laxbqf,Season 7 - Episode 10 - Post Episode Discussion
"Also people should remember how Bell-A said in that interview that production is intentionally making Huda look worse with their edit, we barely even saw them making up outside of them hugging later.",7,1749890989.0,IntroductionFlat5317,1laxbqf,Season 7 - Episode 10 - Post Episode Discussion
"If people are bringing out the worst in each other, I don’t think that means they’re made for each other. I think the right partner would show better sides to them.",12,1749890980.0,TypicalClassroom7,1laxbqf,Season 7 - Episode 10 - Post Episode Discussion
Saying this with my whole chest… I won’t feel bad she pmo so bad.,12,1749868954.0,iforgotthtyouexisted,1laxbqf,Season 7 - Episode 10 - Post Episode Discussion
She cries every episode,11,1749869051.0,InterviewWeary5708,1laxbqf,Season 7 - Episode 10 - Post Episode Discussion
Nah we will be fine 😂,4,1749870477.0,Relative_shroom_323,1laxbqf,Season 7 - Episode 10 - Post Episode Discussion
"i’m the one who won’t. i’m here for mess, not love.",7,1749868946.0,not_ellewoods,1laxbqf,Season 7 - Episode 10 - Post Episode Discussion
she’d probably cry if we voted her off the villa too… i’d feel bad that she’s sad but i wouldn’t regret it at all. same way w jeremiah and her relationship,3,1749869391.0,Glittering-Bus-9971,1laxbqf,Season 7 - Episode 10 - Post Episode Discussion
ain’t reading that,0,1749869796.0,couuer,1laxbqf,Season 7 - Episode 10 - Post Episode Discussion
I think the producers are only showing Jalen with Olandria intentionally. I’m sure he talked to other people but they clearly want us to choose Olandria for him,11,1749903527.0,Advanced_Insect_4383,1laxbqf,Season 7 - Episode 10 - Post Episode Discussion
what lol if he was going for multiple people would also say it’s a red flag. maybe the man just knows what he wants and is willing to commit instead of play a game w others,12,1749902543.0,lbunny7,1laxbqf,Season 7 - Episode 10 - Post Episode Discussion
"If you watch his first conversation with Olandria, it sounds like they cut out him saying Chelley as well when she asks him who he has his eye on then Olandria replies “you got a type, you love your chocolate queens”",14,1749902983.0,None,1laxbqf,Season 7 - Episode 10 - Post Episode Discussion
There was a scene where him and Amaya were in the background talking so he’s not,4,1749905591.0,CameraAgile8019,1laxbqf,Season 7 - Episode 10 - Post Episode Discussion
I’m just wondering I did NOT vote that way 👩🏼‍🦯‍➡️,2,1749870221.0,bellelunameowmeow,1laxbqf,Season 7 - Episode 10 - Post Episode Discussion
i can’t believe y’all really think chelley is still pretending to be interested in austin after the last few episodes… she def likes him,11,1749894945.0,stardustlovrr,1laxbqf,Season 7 - Episode 10 - Post Episode Discussion
correct i don't like ace. he moves weird af,2,1749916729.0,sprgraphicultramodrn,1laxbqf,Season 7 - Episode 10 - Post Episode Discussion
"She’s gonna learn that anyway, it’s not like couples are permanent. He’s still gonna pursue Iris if he wants to",9,1749869871.0,Tacobelle_90,1laxbqf,Season 7 - Episode 10 - Post Episode Discussion
chelley knows she just bored lmaoo ace kept her entertained and austin is a placeholder,4,1749870271.0,Several_Sky_6249,1laxbqf,Season 7 - Episode 10 - Post Episode Discussion
Nic is the closest thing,1,1749871163.0,vyzyxy,1laxbqf,Season 7 - Episode 10 - Post Episode Discussion
This is a bizarre take,3,1749866892.0,maurugh,1laxbqf,Season 7 - Episode 10 - Post Episode Discussion
This comment is not it.,2,1749867053.0,wanderingAtlas,1laxbqf,Season 7 - Episode 10 - Post Episode Discussion
"Kind of agree, but haven’t seen enough. He just seems a bit corny boring so far",2,1749868133.0,Economy_Material_669,1laxbqf,Season 7 - Episode 10 - Post Episode Discussion
Why?,1,1749867399.0,Lilliepier,1laxbqf,Season 7 - Episode 10 - Post Episode Discussion
It’s crazy that people think any of what she is doing is close to normal,8,1749873969.0,Fair_Pilot_5127,1laxbqf,Season 7 - Episode 10 - Post Episode Discussion
They are both flawed,7,1749873914.0,Fair_Pilot_5127,1laxbqf,Season 7 - Episode 10 - Post Episode Discussion
What are you watching?,2,1749873857.0,Realistic-Lake5897,1laxbqf,Season 7 - Episode 10 - Post Episode Discussion
"The Leah cut? What?!

Leah was funny & charming & self-aware. She had amazing one liners.

Huda just whines & complains & drains all the energy out of every scene she’s in.",1,1749880794.0,staunch_character,1laxbqf,Season 7 - Episode 10 - Post Episode Discussion
[deleted],7,1749874411.0,None,1laxbqf,Season 7 - Episode 10 - Post Episode Discussion
“if” being the defining word here,12,1749869178.0,kanjiklvb,1laxbqf,Season 7 - Episode 10 - Post Episode Discussion
That dude is so camera-aware it is crazy. Not an authentic bone in that tiny short-legged body,5,1749869969.0,Relative_shroom_323,1laxbqf,Season 7 - Episode 10 - Post Episode Discussion
The downvotes im CRYING,14,1749869825.0,Jazzlike-Hall7987,1laxbqf,Season 7 - Episode 10 - Post Episode Discussion
That’s a throw away vote lmao,8,1749869911.0,Imactually6footfive,1laxbqf,Season 7 - Episode 10 - Post Episode Discussion
This is so random,8,1749869749.0,Particular-Ad5787,1laxbqf,Season 7 - Episode 10 - Post Episode Discussion
Wtf????,3,1749869735.0,InterviewWeary5708,1laxbqf,Season 7 - Episode 10 - Post Episode Discussion
I DIDNT EVEN VOTE THAT WAY I WAS JUST CURIOUS I WANT JERAMIAH TO BE RESCUED FROM SCARY HUDA,2,1749870315.0,bellelunameowmeow,1laxbqf,Season 7 - Episode 10 - Post Episode Discussion
OMG I MEANT NICK 😭,4,1749869802.0,bellelunameowmeow,1laxbqf,Season 7 - Episode 10 - Post Episode Discussion
lmao who did you originally say?? It says Nick & Iris?,1,1749871197.0,ortizj0987,1laxbqf,Season 7 - Episode 10 - Post Episode Discussion
YES! like “ok girl…” and I felt the exact same way. the strongest couple but they argue like everyday and they’re only 10 days in 💀,98,1749868729.0,nitp,1laxbqf,Season 7 - Episode 10 - Post Episode Discussion
Nobody agreeing killed me,39,1749870815.0,Jazzlike-Promise-153,1laxbqf,Season 7 - Episode 10 - Post Episode Discussion
He literally said it was only because Ace did the Hibachi thing for Chelly so he felt like he had to do something too.,60,1749871508.0,FredericBropin,1laxbqf,Season 7 - Episode 10 - Post Episode Discussion
Because the other guys have been telling him to do something for a week.,6,1750027638.0,lukaeber,1laxbqf,Season 7 - Episode 10 - Post Episode Discussion
