comment,score,created_utc,author,episode_post_id,episode_title
"### **SORT** this Discussion &#x1F3A8;
---
- sort **by** [BEST](https://www.reddit.com/r/LoveIslandUSA/comments/1laxbqf/season_7_episode_10_post_episode_discussion//?sort=confidence) comments
- sort **by** [FIRST](https://www.reddit.com/r/LoveIslandUSA/comments/1laxbqf/season_7_episode_10_post_episode_discussion//?sort=old) comments
- sort **by** [CONTROVERSIAL](https://www.reddit.com/r/LoveIslandUSA/comments/1laxbqf/season_7_episode_10_post_episode_discussion//?sort=controversial) comments

*I am a bot, and this action was performed automatically. Please [contact the moderators of this subreddit](/message/compose/?to=/r/LoveIslandUSA) if you have any questions or concerns.*",1,1749866460.0,AutoModerator,1laxbqf,Season 7 - Episode 10 - Post Episode Discussion
you vote for ace and iris to couple up and he’ll immediately go “i didn’t even choose you. america did. idk where they got that idea because i actually hate you. why are you even talking to me? i need to go pull chelley for a chat”,828,1749867197.0,drowningdaisies,1laxbqf,Season 7 - Episode 10 - Post Episode Discussion
"Huda is so insanely childish, she 100% gave Jeremiah that hickey on purpose. Iris hit the nail on the head with the “marking her territory” comment. I’m voting for Iris to couple up with Jeremiah, idc.",751,1749866553.0,nitp,1laxbqf,Season 7 - Episode 10 - Post Episode Discussion
nah I don’t like how Taylor is all of a sudden trying with Olandria. YOU HAVE HAD 8 FULLLLL DAYS TO DO THAT SIR,704,1749867134.0,flyinggarbanzobean,1laxbqf,Season 7 - Episode 10 - Post Episode Discussion
"“you need to eat all of your food bc you’re a man” i’m sorry huda, what??",702,1749867326.0,flyinggarbanzobean,1laxbqf,Season 7 - Episode 10 - Post Episode Discussion
So we all voted for Jermiah right 🤭,610,1749866533.0,Outrageous-Voice-591,1laxbqf,Season 7 - Episode 10 - Post Episode Discussion
"If our vote gets Iris and Jeremiah coupled up, do you think he’ll realize him and Huda are not liked as a couple and jump ship??? lmaoo",583,1749866722.0,bananamargarine,1laxbqf,Season 7 - Episode 10 - Post Episode Discussion
if you’re laying in bed would you rather deal with your sleep paralysis demon or huda asking if you’ll share your location,577,1749869036.0,31cats,1laxbqf,Season 7 - Episode 10 - Post Episode Discussion
"Huda on Sunday:

https://preview.redd.it/ihjoeolvws6f1.jpeg?width=720&format=pjpg&auto=webp&s=5015ef316fd67b6997b0bcd97b00b312357e9902",566,1749866960.0,lkjhggfd1,1laxbqf,Season 7 - Episode 10 - Post Episode Discussion
anyone else peep the girls side eye when huda said they were the strongest couple 😂😂😂,526,1749866792.0,cocolocochanel,1laxbqf,Season 7 - Episode 10 - Post Episode Discussion
Upvote if you voted for Olandria and Jalen,513,1749869174.0,bellelunameowmeow,1laxbqf,Season 7 - Episode 10 - Post Episode Discussion
Olandria is sooo good at clocking everybody the way she knew immediately Taylor got physical in bed because of the bombshell. Her read is amazing,510,1749868147.0,Jazzlike-Hall7987,1laxbqf,Season 7 - Episode 10 - Post Episode Discussion
"I think the producers also want Huda and Jeremiah broken up, so they gave us the assignment because none of the bombshells will do it.",463,1749867431.0,Mindless-Desk-7401,1laxbqf,Season 7 - Episode 10 - Post Episode Discussion
All Taylor’s dates are just enlisting another dude to entertain Olandrea. First Ace now Austin.,444,1749866521.0,birdnoa,1laxbqf,Season 7 - Episode 10 - Post Episode Discussion
"Taylor go ahead and put your bags nearby, it looks like your time in the villa is nearing the end!!

https://preview.redd.it/bbt0519qvs6f1.jpeg?width=828&format=pjpg&auto=webp&s=13500e03ecbc0db97b97f48fa4117400e901819c",411,1749866605.0,First-Flora39,1laxbqf,Season 7 - Episode 10 - Post Episode Discussion
i do not think hannah is playing a game i think she is just unfathomably horny,827,1749867440.0,Past_Brother_1266,1laxbqf,Season 7 - Episode 10 - Post Episode Discussion
For me it's not even about seeing Huda crash out (because I think it'll be more painful to watch than entertaining) but I'm desperately hoping this vote will help them see they are not trapped in this couple on day 10 and the audience doesn't think they're compatible,386,1749867021.0,GoneReader,1laxbqf,Season 7 - Episode 10 - Post Episode Discussion
"“me and jeremiah are the strongest couple in here”

https://preview.redd.it/y6rasow62t6f1.jpeg?width=941&format=pjpg&auto=webp&s=3605daae7384901dc101c103137b1ab498a9b2f4",377,1749868755.0,adinasarena,1laxbqf,Season 7 - Episode 10 - Post Episode Discussion
Iris is gonna wonder what the hell kinda edit they gave her for us to pair her with Jeremiah 😂😂,348,1749866897.0,Cinemaniacc,1laxbqf,Season 7 - Episode 10 - Post Episode Discussion
Has anyone noticed that everytime Huda perceives Jeremiah to be mad at something she’s saying she immediately changes the vibe to be sexual?,350,1749869250.0,Willing-Seaweed705,1laxbqf,Season 7 - Episode 10 - Post Episode Discussion
Pepes couple will be the only surprise of this vote,337,1749866559.0,Affectionate-Bus4152,1laxbqf,Season 7 - Episode 10 - Post Episode Discussion
"Ace charming Iris

https://preview.redd.it/8j7ftzk8ws6f1.jpeg?width=1200&format=pjpg&auto=webp&s=8824901dc1ce0b3aa6e7c49ad7c2a831ddd89091",325,1749866794.0,nxyzing,1laxbqf,Season 7 - Episode 10 - Post Episode Discussion
This cast needs to come up with a more interesting date idea than yoga or meditation,311,1749868047.0,SleepLopsided1478,1laxbqf,Season 7 - Episode 10 - Post Episode Discussion
"Producers are so evil. 

Chelley: It’s not like they are kissing or anything. Don’t worry about that man until she tells you to worry about that man. 

*Cut to Hannah straddling Pepe*",306,1749869244.0,shadow87521,1laxbqf,Season 7 - Episode 10 - Post Episode Discussion
Are we all voting for jeremiah and iris 👀,273,1749866526.0,neverhad0nelesson,1laxbqf,Season 7 - Episode 10 - Post Episode Discussion
“You have a whole kid” sent me to space,277,1749868445.0,TheHelpsMad,1laxbqf,Season 7 - Episode 10 - Post Episode Discussion
if huda was crashing out about pancakes i both fear and eagerly anticipate her reaction to the vote results,278,1749866675.0,drowningdaisies,1laxbqf,Season 7 - Episode 10 - Post Episode Discussion
"girl, chelley, ma’am, this yoga date was so much more effort by Nic than by Ace",272,1749867269.0,flyinggarbanzobean,1laxbqf,Season 7 - Episode 10 - Post Episode Discussion
"Huda is actually insane talking about “he’s gonna lose me if he doesn’t act right…” 

Watching her self destruct has been hella uncomfortable",278,1749867283.0,SNSN85,1laxbqf,Season 7 - Episode 10 - Post Episode Discussion
i think it’s crazy from a 30 seconds chat we’ve learned more abt jeremiah than we have for a whole two weeks….hmmmm,473,1749866717.0,torrrtia,1laxbqf,Season 7 - Episode 10 - Post Episode Discussion
I feel bad for Charlie tbh i think he was really feeling Hannah. also kudos to him for standing his ground cuz ik damn well i wouldn't budge if someone just told me to get tf out OF A COMMUNE KITCHEN while im cooking to talk to someone??,236,1749869055.0,drvgonraja,1laxbqf,Season 7 - Episode 10 - Post Episode Discussion
"Pick up your sticker on the way out yall

https://preview.redd.it/qpup9mszxs6f1.jpeg?width=1178&format=pjpg&auto=webp&s=391faf2f612c8deb03be9215078f4940273c6610",468,1749867336.0,Ratgarbagegirl,1laxbqf,Season 7 - Episode 10 - Post Episode Discussion
The way Jeremiah said “Ok mom” to Huda when she said he needs to eat all his food because he’s a man 💀He is so over her omg,219,1749870823.0,KBbabylonbaby,1laxbqf,Season 7 - Episode 10 - Post Episode Discussion
"https://preview.redd.it/3je822xwvs6f1.jpeg?width=640&format=pjpg&auto=webp&s=138293c3554ff5e286a45def72ad343add240b09

how it feels voting Jeremiah to couple up with iris",429,1749866648.0,funatko,1laxbqf,Season 7 - Episode 10 - Post Episode Discussion
jeremiah getting voted to couple w iris is going to fuck his head completely up lol,211,1749869244.0,AnotherAnon688264759,1laxbqf,Season 7 - Episode 10 - Post Episode Discussion
"Ok Charlie's ""what the fuck"" during the meditation* date had me cackling",198,1749869007.0,00destin,1laxbqf,Season 7 - Episode 10 - Post Episode Discussion
Never voted so fast IRIS AND JEREMIAH,388,1749866509.0,uhhhwutlol,1laxbqf,Season 7 - Episode 10 - Post Episode Discussion
"Takeaways:

Seeing the Queen Olandria all giddy and feeling wanted is everything 😭

Huda complaining about Jer not doing enough then shitting on his nice deed immediately the morning after…is she ok?? Legitimately concerned. 

I wasn’t expecting Iris to focus on/hit it off best with Nic or Ace. I really thought she’d pursue Jer. 

I may actually watch Aftersun for the first time ever.",176,1749867091.0,daemonxcaraxes,1laxbqf,Season 7 - Episode 10 - Post Episode Discussion
https://preview.redd.it/rannzzlmet6f1.jpeg?width=1284&format=pjpg&auto=webp&s=15ef900941145b302c885e70de48220099c87333,179,1749872934.0,lidolpringo,1laxbqf,Season 7 - Episode 10 - Post Episode Discussion
why was huda talking abt sharing a location??? girl you don't even have your phone on hand chill.,173,1749870870.0,AnotherAnon688264759,1laxbqf,Season 7 - Episode 10 - Post Episode Discussion
"If Jeremiah is voted with Iris, Hudas going to have a S2 Makenzie moment, why would america do this to meeeeee",163,1749866478.0,birdnoa,1laxbqf,Season 7 - Episode 10 - Post Episode Discussion
Huda shoulda woulda coulda been a little nicer because I fear her man will no longer be her man after this vote,167,1749866570.0,Xxrt12,1laxbqf,Season 7 - Episode 10 - Post Episode Discussion
"The only thing I thought about this entire episode was Jeremiah before doing his hair giving Civil Rights Daddy 😂

https://preview.redd.it/nk4acc7vzs6f1.jpeg?width=1152&format=pjpg&auto=webp&s=e1369a97d6563fe09485613d6fba438e5eae3c04",164,1749867984.0,JacquesTheHawk,1laxbqf,Season 7 - Episode 10 - Post Episode Discussion
Bro this is the first time I've heard Olandria giggle bro. She is feeling that man 👀👀👀👀,167,1749871785.0,Broad_Personality455,1laxbqf,Season 7 - Episode 10 - Post Episode Discussion
iris x jeremiah i am FOR THE DRAMA BABY,163,1749866540.0,444bri,1laxbqf,Season 7 - Episode 10 - Post Episode Discussion
olandria will be free from taylor and that’s what really matters,154,1749867002.0,shadysigs,1laxbqf,Season 7 - Episode 10 - Post Episode Discussion
"https://preview.redd.it/h76kpqnbzs6f1.jpeg?width=168&format=pjpg&auto=webp&s=107548f515257c76a4051e0aaec46e1faa561e9e

Huda holding Jeremiah hostage after the vote comes out.",314,1749867799.0,makeupwall,1laxbqf,Season 7 - Episode 10 - Post Episode Discussion
i NEED Jeremiah and iris to win the vote so we can see the mess of “what is the public seeing that i’m not”,153,1749866520.0,lu00010,1laxbqf,Season 7 - Episode 10 - Post Episode Discussion
The way Ace told Iris to go look at soul ties and just sat there instead of going with her to show her soul ties. What’s wrong with him chile??,152,1749866794.0,MysteriousResearch86,1laxbqf,Season 7 - Episode 10 - Post Episode Discussion
"also. JUSTICE FOR JALEN. seems like a normal, kind person!!!!",146,1749867524.0,justbesimple_,1laxbqf,Season 7 - Episode 10 - Post Episode Discussion
Wow I just realized that Hannah is the female version of Nic,153,1749869868.0,B-la-trix,1laxbqf,Season 7 - Episode 10 - Post Episode Discussion
"Iris: Choosing between Nic and Ace
Us: *votes her to be with Jeremiah*",145,1749869092.0,Critical_Fig1798,1laxbqf,Season 7 - Episode 10 - Post Episode Discussion
everyone voting for iris and jeremiah are so evil and wrong (i'm everyone),296,1749866605.0,amattack,1laxbqf,Season 7 - Episode 10 - Post Episode Discussion
BEFORE WE VOTE: let’s all collectively agree to pair iris with Jeremiah and get huda tf out of here,655,1749866466.0,No_Sail_4571,1laxbqf,Season 7 - Episode 10 - Post Episode Discussion
anyone catch during iris’s intro convo with all the girls in the beginning - everyone’s silence and straight faces when huda said her and jeremiah are the strongest couple in the villa 💀,144,1749871635.0,Bouncy-Mermaid525,1laxbqf,Season 7 - Episode 10 - Post Episode Discussion
loved iris clocking huda's high school drama bullshit,283,1749866867.0,Prudent-Cat-1714,1laxbqf,Season 7 - Episode 10 - Post Episode Discussion
Nick awkwardly announcing “he just hit me on the stomach like thanks buddy!” … I have not laughed that hard yet.,139,1749866763.0,Budget-Humor-7731,1laxbqf,Season 7 - Episode 10 - Post Episode Discussion
jeremiah and olandria are the only right answers here yall this is an open book test,135,1749867525.0,lovebbygrapes,1laxbqf,Season 7 - Episode 10 - Post Episode Discussion
I feel like these bombshells are making love island feel like love island again,139,1749876595.0,eternalteen,1laxbqf,Season 7 - Episode 10 - Post Episode Discussion
"“Me and Jeremiah are the strongest couple in here”

https://preview.redd.it/9cfowlulxt6f1.jpeg?width=1125&format=pjpg&auto=webp&s=b7bbb23cb32273e8a3d1f2a60f405af732fa3177",136,1749879312.0,alabamachick,1laxbqf,Season 7 - Episode 10 - Post Episode Discussion
Huda how dare you make me feel sorry for a man,503,1749866532.0,wtrtrb,1laxbqf,Season 7 - Episode 10 - Post Episode Discussion
Guarantee Huda is gonna jump to the conclusion that Jeremiah has been sneaking around with Iris or something… meanwhile we’re just voting to put an end to their mess☠️,134,1749867289.0,Express_Plant7476,1laxbqf,Season 7 - Episode 10 - Post Episode Discussion
“can you do more?” “are you dead ass?” JEREMIAH LMFAOOOO,131,1749880052.0,stardustlovrr,1laxbqf,Season 7 - Episode 10 - Post Episode Discussion
omg guys PLEASE imagine how great it will be once huda discovers that WE THE PEOPLE chose to break them up 😭 (i feel evil),127,1749867510.0,queenaqua7,1laxbqf,Season 7 - Episode 10 - Post Episode Discussion
Jalen actually seems very kind. I love that for Olandria,128,1749867535.0,AndreaThePsycho,1laxbqf,Season 7 - Episode 10 - Post Episode Discussion
I promise you those Ace & Iris scenes are nothing but producer propaganda. Nothing is gonna happen there. Do not lose focus. Vote for Jeremiah.,126,1749868110.0,None,1laxbqf,Season 7 - Episode 10 - Post Episode Discussion
Pepe and Hannah are giving Miguel and Nicole vibes to me. Strong physical connection off the rip but I don’t think they’ll actually be endgame in this process,126,1749869328.0,Competition-Over,1laxbqf,Season 7 - Episode 10 - Post Episode Discussion
Okay but the bombshells CLOCKED IN. They got everyone giggling and questioning their connections i'm deaddddd,129,1749876598.0,katrvdical,1laxbqf,Season 7 - Episode 10 - Post Episode Discussion
Charlie is super aware. Props on him for clocking it,128,1749873491.0,Castleprince,1laxbqf,Season 7 - Episode 10 - Post Episode Discussion
I hate Taylor sorry. The way he only started caring when someone showed interest in Olandria. I don’t even think he’s worried about Olandria but more about possibly being dumped he is just not interested and he has made that clear through his action Olandria and Jalen are it.,116,1749867297.0,Chemical-Froyo-6286,1laxbqf,Season 7 - Episode 10 - Post Episode Discussion
"I like Pepe but NGL I didn't like his whole demeanor with Charlie in the kitchen. You don't come into his space when he's making food and demand he leave, you just take the girl somewhere else. To his credit I think he realized and backtracked but that was so odd and unnecessarily aggressive. 

But I think he has a much better vibe with Cierra and I hope they explore that. I don't care much for Hannah anyway. I do feel bad for Charlie.",120,1749879957.0,vrschikasanaa,1laxbqf,Season 7 - Episode 10 - Post Episode Discussion
We’re about to get “AMERICAAAAAA WHY WOULD YOU TAKE MY BOYFRIENDDDDDD” 2.0 and I can’t wait,114,1749866534.0,nancy__drew,1laxbqf,Season 7 - Episode 10 - Post Episode Discussion
A vote for Jeremiah x iris is a vote to re-unite a family,112,1749869750.0,Ratgarbagegirl,1laxbqf,Season 7 - Episode 10 - Post Episode Discussion
I feel like Huda is only wanting Jeremiah to do those things so she can tell everyone look at what my mans is doing for me bc he wants me that much. It’s all optics for her.,111,1749875945.0,Ambitious-Swan-8683,1laxbqf,Season 7 - Episode 10 - Post Episode Discussion
"Ace has never been in a relationship because I'm positive he has extremely derogatory views on women and an unhealthy view on relationships because he's been formed by the manosphere. Almost everything he says is a clue, and you can see it by the way he negs, manipulates and straight up tells women what they need to do to earn him and what they're not going to do. 

Tonight he said ""I thought I'd have to go out of country to find a wife."" DING! Did that sound odd? Because it is! But also not - for anyone unfamiliar, that's a huge thing in the manosphere and red pill content. They preach that modern western women are too independent and to find a traditional, submissive wife men need to go abroad (ie, become a ""passport bro""). Their whole schtick is that western culture has killed femininity and gender roles, and western women don't respect male authority.

Trust that this guy is *deep* into that shit, he has all the signs.",224,1749875295.0,vrschikasanaa,1laxbqf,Season 7 - Episode 10 - Post Episode Discussion
Cierra is way too nice in my opinion because what do you mean you are okay with Nic making Iris breakfast. I don’t know that would speak volumes to me,105,1749869603.0,Asleep_Tap6199,1laxbqf,Season 7 - Episode 10 - Post Episode Discussion
I really like Charlie actually,102,1749871867.0,LoganBarryBush,1laxbqf,Season 7 - Episode 10 - Post Episode Discussion
The Jeremiah votes about to be a bigger landslide than the kordena win atp😂,105,1749867053.0,Jazzlike-Hall7987,1laxbqf,Season 7 - Episode 10 - Post Episode Discussion
Huda marking her territory giving Jeremiah a hickey….. I am soooo fucking sick of her,102,1749869033.0,Ok_Cookie9293,1laxbqf,Season 7 - Episode 10 - Post Episode Discussion
Huda asking Jeremiah if he would share his location. Omg,105,1749872067.0,yunghazel,1laxbqf,Season 7 - Episode 10 - Post Episode Discussion
Ace got a giggle out of me when he warned Taylor that Jalen’s accent is stronger than his. That was funny,102,1749908747.0,AgreeableLaugh1171,1laxbqf,Season 7 - Episode 10 - Post Episode Discussion
"Casa is going to be a shit show for Cierra if she’s still with Nic because the way that man is horned up 24/7, so easily tempted and the casa girls never hold back. 

Jeremiah and Huda are so toxic it’s actually draining me, I don’t know how they or anyone else in the villa even still has the energy for them. 

Ace likes the game, he doesn’t really like any of the girls and he prioritises getting screen time above all else but does he realise he needs to be in a semi serious couple at some point soon?",96,1749869006.0,lostinplatitudes,1laxbqf,Season 7 - Episode 10 - Post Episode Discussion
Now why charlie looked so good stressed out?? 🤭🤭,99,1749875302.0,_valiii,1laxbqf,Season 7 - Episode 10 - Post Episode Discussion
DID ANYONE NOTICE HANNAH did the same “maybe I need my memory refreshed…😉” bit with Pepe AND CHARLIE SHE DID IT WITH CHARLIE TOO,92,1749867084.0,Round_Banana3665,1laxbqf,Season 7 - Episode 10 - Post Episode Discussion
Disappointed Jeremiah didn’t even address the Huda exorcist moment,90,1749868140.0,yeah-okay-cool,1laxbqf,Season 7 - Episode 10 - Post Episode Discussion
Y’all better get your last goodbyes with Taylor cause he’s going home this week lol,93,1749869090.0,AppleGreenTwin,1laxbqf,Season 7 - Episode 10 - Post Episode Discussion
pancake-gate was lowkey television gold honestly im so glad i got to see it. insanity.,93,1749870117.0,444bri,1laxbqf,Season 7 - Episode 10 - Post Episode Discussion
we needed these bombshells so bad like these convos are actually not as boring now,91,1749871485.0,Ill-Ad5982,1laxbqf,Season 7 - Episode 10 - Post Episode Discussion
I’m so glad Olandria peeped Taylor lazy ass wanting to be all affectionate and romantic now. Too late lazy ass now pack those bags baby you got a plane to catch soon,94,1749872889.0,SeauxSurvivor,1laxbqf,Season 7 - Episode 10 - Post Episode Discussion
https://preview.redd.it/hy8alzuk8x6f1.jpeg?width=1284&format=pjpg&auto=webp&s=0715ac0c082e767e0ae4a2c1e3fe4b20f4f42f9c,95,1749919323.0,lurkingvinda,1laxbqf,Season 7 - Episode 10 - Post Episode Discussion
"https://preview.redd.it/3gcbvnizvs6f1.jpeg?width=1290&format=pjpg&auto=webp&s=3e28c2e86b7b7f42e4a2b8c7cc6df8454879cdcc

huda is gonna have a heart attack LMFAOOOO",177,1749866687.0,polaridium,1laxbqf,Season 7 - Episode 10 - Post Episode Discussion
Huda asking Jeremiah if he would share location is crazy 😭,182,1749868033.0,InserrtUsernameHere,1laxbqf,Season 7 - Episode 10 - Post Episode Discussion
Can we talk about the truth and dare game and how ace got all pouty because Chelley and Austin did the sex positions? 😂😂😂,86,1749872900.0,KDSD628,1laxbqf,Season 7 - Episode 10 - Post Episode Discussion
I feel like aftersun needs to be biweekly bc we don’t care  and want more episodes,88,1749916045.0,silly-goose112233,1laxbqf,Season 7 - Episode 10 - Post Episode Discussion
"Me watching Austin tell Olandria and Taylor to call him master

https://preview.redd.it/lwcrruhexs6f1.jpeg?width=823&format=pjpg&auto=webp&s=340744f9cfab70bdf51bc5323eb26a5da79fb1b0",164,1749867136.0,t-paintwirl,1laxbqf,Season 7 - Episode 10 - Post Episode Discussion
"""i think he sleeps on the couch or something. either way i don't give a fuck."" yeah keep her in my damn villa",169,1749873503.0,avariceavocado,1laxbqf,Season 7 - Episode 10 - Post Episode Discussion
"https://preview.redd.it/srro2149zs6f1.png?width=806&format=png&auto=webp&s=74dff84bafeb139bdc20da37e828711228f4d4c1

I did it girl, I did it",84,1749867757.0,spellofspells,1laxbqf,Season 7 - Episode 10 - Post Episode Discussion
Yall im cracking up bc you know Huda is gonna assume Jeremiah and Iris were really vibing and he’s gonna have to explain himself and I’m already laughing,81,1749869965.0,SnooGuavas4919,1laxbqf,Season 7 - Episode 10 - Post Episode Discussion
"i like that jalen seems to have a genuine interest in olandria, taylor doesn’t even ask her follow up questions half of the time",79,1749870733.0,traffeny,1laxbqf,Season 7 - Episode 10 - Post Episode Discussion
Huda is weird to the point where is doesn’t even make good TV it’s just scary,78,1749875601.0,Optimal_Expert5530,1laxbqf,Season 7 - Episode 10 - Post Episode Discussion
The hickey on the neck was egregious,81,1749876387.0,Realistic-Let-9522,1laxbqf,Season 7 - Episode 10 - Post Episode Discussion
The “oh so no protein?” comment from Huda actually made me so mad for Jeremiah. She asks him to do more and gets mad when he tries that’s so frustrating.,84,1749899563.0,SydTheStreetFighter,1laxbqf,Season 7 - Episode 10 - Post Episode Discussion
I’m glad people are starting to see the vision with Pepe 🙂‍↕️ I thought I was going crazy yesterday when people were calling him chopped,76,1749866571.0,theycallmestace,1laxbqf,Season 7 - Episode 10 - Post Episode Discussion
Is Huda playing Love Island or How To Lose A Man In 10 Days?,76,1749870763.0,Throwayaaaah,1laxbqf,Season 7 - Episode 10 - Post Episode Discussion
I’m so fucking happy for Olandria! Jalen is perfect for her! 🥹🥰,76,1749875187.0,AlphaDog0807,1laxbqf,Season 7 - Episode 10 - Post Episode Discussion
"I would absolutely lose my mind if I was Jeremiah dealing with Huda. Confronting him about doing more right before the last challenge, acting soo dramatic during the challenge, staying up that night asking if he would share his location with her, IMMEDIATELY nitpicking the no protein with breakfast the next day, throwing a fit bc the pancakes were undercooked and Taylor helped make new ones, nagging him to eat all his breakfast, it’s nuts. And the fact that he can sit there and act so cold towards the new bombshell just to keep the peace with Huda shows that he’s in it to win it. If he was really here for love, he wouldn’t put up with this cause no one would be happy with this. And it’s only like a week in!!",74,1749876318.0,Valuable_Soup_1508,1laxbqf,Season 7 - Episode 10 - Post Episode Discussion
" I wish we had Unseen Bits back instead of aftersun 😔

Huda is crazy manipulative for that hickey and I need Iris to replace her expeditiously.",78,1749917154.0,shrimpscity,1laxbqf,Season 7 - Episode 10 - Post Episode Discussion
ace saying “she knows where home is” about chelley was super odd… idk might just be me,144,1749871949.0,fulltimeprincesss,1laxbqf,Season 7 - Episode 10 - Post Episode Discussion
One of the funniest parts of this is how baffled Iris and Jeremiah are gonna be considering they had one conversation ☠️,70,1749867147.0,Competition-Over,1laxbqf,Season 7 - Episode 10 - Post Episode Discussion
I thought it was super sweet when Jalen asked to kiss Olandria on the cheek,70,1749867946.0,T-H-She,1laxbqf,Season 7 - Episode 10 - Post Episode Discussion
"Yulissa is so… out of touch. Her IG bio says “Love Island S7… 2 episodes is all I needed. 😉”

Girl you literally got kicked off for using an awful racial slur. Get tf out of here",69,1749870164.0,realvanitybear,1laxbqf,Season 7 - Episode 10 - Post Episode Discussion
I know it’s up to huda how to approach telling men she’s a mom but I genuinely feel she did a disservice to herself by not being open about it from the beginning,71,1749870933.0,Maleficent-Orchid755,1laxbqf,Season 7 - Episode 10 - Post Episode Discussion
