comment,score,created_utc,author,episode_post_id,episode_title
"https://preview.redd.it/umwa7q2nws6f1.jpeg?width=1170&format=pjpg&auto=webp&s=ada13aa701bb3e7b30806b42f95a28fd9b2e414c

my job here is done 🫡",47,1749866889.0,blackflowerpetals,1laxbqf,Season 7 - Episode 10 - Post Episode Discussion
"I said yesterday Chelley actually liked Austin deep down and was downvoted into oblivion for it just for this episode to once again prove me right that she does actually semi like him. I accept apologies in flowers and chocolate

https://preview.redd.it/q6w4h215at6f1.jpeg?width=1125&format=pjpg&auto=webp&s=4eea703b0ecf6a5b7c6975a88ddea22b83e1eef4",45,1749871424.0,SeauxSurvivor,1laxbqf,Season 7 - Episode 10 - Post Episode Discussion
"Throughout all of the humiliation ace has been putting on Amaya, she really has been mature throughout all of it. I can’t get over his cheering during the lace and leather thing. So disrespectful and childish",44,1749872012.0,None,1laxbqf,Season 7 - Episode 10 - Post Episode Discussion
The vote for Pepe will be the real surprise,13,1749866828.0,shih_tsu,1laxbqf,Season 7 - Episode 10 - Post Episode Discussion
"https://preview.redd.it/w7olptzxws6f1.jpeg?width=1179&format=pjpg&auto=webp&s=53c4ec1ad47e6bb910f4fd6a57a73ba539cd5648

👀",10,1749866991.0,Ready-Quail-7977,1laxbqf,Season 7 - Episode 10 - Post Episode Discussion
We are voting Jeremiah !,12,1749867001.0,kamikazoo,1laxbqf,Season 7 - Episode 10 - Post Episode Discussion
Audobillah Huda is a nut job,13,1749867042.0,TheHelpsMad,1laxbqf,Season 7 - Episode 10 - Post Episode Discussion
Charlie staring down Austin’s yoga session makes one of my favorite moments in LI history,12,1749867214.0,Leebeexxx9,1laxbqf,Season 7 - Episode 10 - Post Episode Discussion
Okay that haircut Taylor gave Jeremiah was really good lol. They always get someone that knows how to cut hair every season.,13,1749867611.0,mpelichet,1laxbqf,Season 7 - Episode 10 - Post Episode Discussion
10% of me wants to see Huda away from Jeremiah so she can…relax a little and enjoy her experience #girlsgirl and yes I voted Iris X Jeremiah 💋,12,1749867614.0,Eastern_Effective_49,1laxbqf,Season 7 - Episode 10 - Post Episode Discussion
"Why are people so against Nic/voting Cierra for Pepe? I know people ride hard for Belledasha and ended up liking her, but I really don’t think Nic did anything THAT crazy when exploring them lol… although maybe it could have been handled a little better of course",10,1749867969.0,bigman123456man,1laxbqf,Season 7 - Episode 10 - Post Episode Discussion
Cely and eyal on aftersun 👀,12,1749868604.0,Sweetrk-2020,1laxbqf,Season 7 - Episode 10 - Post Episode Discussion
Not Pepe saying I want a girl just like you to Cierra and getting down with Hannah the same day😭😂 this cast is so messy I love it,12,1749871305.0,pulltheplugjewelry,1laxbqf,Season 7 - Episode 10 - Post Episode Discussion
Finally some action 😂 ep was 🔥,12,1749874010.0,_valiii,1laxbqf,Season 7 - Episode 10 - Post Episode Discussion
"I do think it's funny if they go back to their normal couples because it's a Love Island staple for the fanbase to want better for the woman and she uses the bombshells to get more attention from the original man.

Happens every time. The Girls celebrating Taylor getting touchy at night I was like i've seen this tape before",13,1749877130.0,KindaTomas,1laxbqf,Season 7 - Episode 10 - Post Episode Discussion
Olandria and Jalen have me smiling & kicking my feet bc I like how he went in there knowing he wanted Olandria and I love that for her 🫶🏼,11,1749886760.0,smokindoinksinamishh,1laxbqf,Season 7 - Episode 10 - Post Episode Discussion
cierra has been promoted as my most elite employee idk i just think she’s so COOL and REAL,55,1749882989.0,stardustlovrr,1laxbqf,Season 7 - Episode 10 - Post Episode Discussion
Iris is pretty but also looks 35..,60,1749868137.0,Valuable-Science3743,1laxbqf,Season 7 - Episode 10 - Post Episode Discussion
"https://preview.redd.it/0apef1itvs6f1.jpeg?width=1179&format=pjpg&auto=webp&s=369194d3a0313727904d0375433aaa7f81fe502b

Save Jeremiah",23,1749866610.0,Chemical-Froyo-6286,1laxbqf,Season 7 - Episode 10 - Post Episode Discussion
Will Huda cuss us out for voting Jeremiah,25,1749866648.0,1010beeboo,1laxbqf,Season 7 - Episode 10 - Post Episode Discussion
"I never want weekends to go by fast, but I neeeeeeed to see Huda's face when Jeremiah gets in bed with Iris. C'mon, Sunday.",23,1749866656.0,TheUpbeatCrow,1laxbqf,Season 7 - Episode 10 - Post Episode Discussion
Huda is going to SPIRAL lol,25,1749866680.0,realvanitybear,1laxbqf,Season 7 - Episode 10 - Post Episode Discussion
"I voted Jeremiah, Olandria, & Cierra. I made my husband vote the same lol",25,1749866877.0,elimay,1laxbqf,Season 7 - Episode 10 - Post Episode Discussion
I gave Pepe to Hannah. I wanted him for Cierra initially but him and Hannah made me feel things.,25,1749866998.0,eternititi,1laxbqf,Season 7 - Episode 10 - Post Episode Discussion
https://preview.redd.it/2ln9h7t1xs6f1.jpeg?width=1320&format=pjpg&auto=webp&s=9eb77957db9117f5ca1a30938a4a634ab717be89,24,1749867020.0,FitCarpenter9685,1laxbqf,Season 7 - Episode 10 - Post Episode Discussion
"https://preview.redd.it/wtx8k8o2xs6f1.jpeg?width=1170&format=pjpg&auto=webp&s=59649efa98c24996ae8b2ca8027ceab9939dac79

Let’s change up this villa!",23,1749867077.0,CreativeAir7133,1laxbqf,Season 7 - Episode 10 - Post Episode Discussion
"https://preview.redd.it/xp3k46slxs6f1.jpeg?width=1284&format=pjpg&auto=webp&s=2ec1db36bcebe35ebd40fb7283db2f4dd944bb61

im very happy with my choices",24,1749867217.0,Mission-Date-1141,1laxbqf,Season 7 - Episode 10 - Post Episode Discussion
https://preview.redd.it/o0h3kmtays6f1.jpeg?width=1284&format=pjpg&auto=webp&s=39030d96079723b5e891574bbb9d10516e332693,23,1749867438.0,SolarBeam12,1laxbqf,Season 7 - Episode 10 - Post Episode Discussion
Huda stans are pissed about ppl voting Jeremiah and Iris 🤣,24,1749867473.0,LegalBlueberry1,1laxbqf,Season 7 - Episode 10 - Post Episode Discussion
https://preview.redd.it/th4oipahys6f1.jpeg?width=828&format=pjpg&auto=webp&s=b0a5d21e37e9cdfefd669c79f0e5a4ae233039bb,23,1749867499.0,Several_Quality4944,1laxbqf,Season 7 - Episode 10 - Post Episode Discussion
i feel like Amaya’s gonna yell at america because we didn’t give her a new man.,26,1749867586.0,not_ellewoods,1laxbqf,Season 7 - Episode 10 - Post Episode Discussion
Voted for Jeremiah to literally save a victim 🤣,25,1749867663.0,Economy_Material_669,1laxbqf,Season 7 - Episode 10 - Post Episode Discussion
"Austin STAYYSSS FREAKYYY and I’m here for
It😭",22,1749867798.0,ShowDog28,1laxbqf,Season 7 - Episode 10 - Post Episode Discussion
Nic already making breakfast for Iris omg I’m sick,25,1749868696.0,Queen1taurus2,1laxbqf,Season 7 - Episode 10 - Post Episode Discussion
Hannah really just decoupled herself with that mounting move no? Like a kiss is understandable but full make out and riding?,26,1749869066.0,Lavendermin,1laxbqf,Season 7 - Episode 10 - Post Episode Discussion
I think nic is messy but I actually like him a lot I hope he stays on for a while & I love olandria and cierra,24,1749869521.0,Maleficent-Orchid755,1laxbqf,Season 7 - Episode 10 - Post Episode Discussion
taylor is not interested in olandria i’m sorry.,23,1749871349.0,SpeechPlastic5634,1laxbqf,Season 7 - Episode 10 - Post Episode Discussion
amaya saying “it’s like mixing fire and water” when she’s a scorpio and ace is a leo did something for my astrology brain!!! 🥹,24,1749873801.0,luvmxnot,1laxbqf,Season 7 - Episode 10 - Post Episode Discussion
"I’ve been wondering this for a while… There must be something with Charlie and Austin… the fact that no girls pay either one of them any mind is crazy to me. Like Chelley only talks about Austin because they’re coupled up but NO ONE use to talk about Charlie, even when he came in. If Jeremiah were able to be chosen during the baseball challenge, I don’t think either boy would be hitting the field.

They’re both cute and should get some attention, but it’s feeling like they’re both placeholders until their match finds someone they think is better.",22,1749875578.0,pandaboy47,1laxbqf,Season 7 - Episode 10 - Post Episode Discussion
Jeremiah and Cierra would be a good match. They are both kinda nerdy and Jeremiah has probably actually watched the avatar!,27,1749878046.0,chichi_raldo,1laxbqf,Season 7 - Episode 10 - Post Episode Discussion
"My predictions:  
Jeremiah & Iris;
Ace & Chelley;
Jalen & Olandria;
Pepe & Cierra;
Austin & Amaya;
Charlie & Hannah;
Nic & Huda

Taylor eliminated. After recouping Ace and Iris will find their way to each other, Hannah and Pepe might too and Cierra and Nic will get back together. Idk about Jeremiah and Huda…he seems over it (rightfully so)",24,1749879155.0,Necessary_Nothing471,1laxbqf,Season 7 - Episode 10 - Post Episode Discussion
I understand why people voted for Jeremiah just to piss Huda off but I feel like it would be so much more dramatic to watch their relationship end naturally 😭 it's coming soon my friends we must be patient,25,1749879773.0,silk_worm8,1laxbqf,Season 7 - Episode 10 - Post Episode Discussion
"I can’t stand Ace…he never mentions chelly, he’s always just like “ oh yeah I’m open to getting to know everyone, I love when people come in” ugh",25,1749890039.0,Flimsy_Restaurant808,1laxbqf,Season 7 - Episode 10 - Post Episode Discussion
Dude I said I wanted to see more of Hannah and Charlie content…this is not what I wanted…..is it okay that I’m mad at Hannah for ruining it 😂😂😂let me be petty😭😭😭😭 why was she so quick? Why did she say she “the sexual energy” she has isn’t enough for 1 man? I HATE ITTTTR,24,1749890305.0,Flimsy_Restaurant808,1laxbqf,Season 7 - Episode 10 - Post Episode Discussion
The yoga scenes are so boring,27,1749894537.0,vanessamoth,1laxbqf,Season 7 - Episode 10 - Post Episode Discussion
"What did yall think about Jeremiah saying he hasn’t been actively applying pressure lately because he has “so much on his mind” after Huda dropped the baby bomb. I think she was wrong for telling him so late and for making him keep the secret such that he couldn’t talk to his friends about it, but him using that in this context as justification for not grafting harder was kind of mean to me.",24,1749903260.0,SydTheStreetFighter,1laxbqf,Season 7 - Episode 10 - Post Episode Discussion
"Iris is going to age horribly, yikes.
Charlie was talking too much for me at the start of the episode, I hope he keeps this energy up for when Hannah leaves him
I don’t feel bad for Jeremiah",25,1749910967.0,gthehippie2023,1laxbqf,Season 7 - Episode 10 - Post Episode Discussion
"Poor Charlie i didn't even think about bruv.

Olandria/Jalen
Hannah/Pepe
Iris/Jeremiah

every one else stays in their original couples that would leave Huda with the choice who to send home between Charlie/Taylor.",11,1749867132.0,Eatmyshorts43,1laxbqf,Season 7 - Episode 10 - Post Episode Discussion
Omggggg i love that we get to vote who they couple up with let's get Jeremiah awayyyyyy from huda,11,1749867222.0,Responsible-Sun-8920,1laxbqf,Season 7 - Episode 10 - Post Episode Discussion
Might be to late for Taylor to play catch up. Nic is well nic lol.,11,1749867628.0,DavidFairyTail,1laxbqf,Season 7 - Episode 10 - Post Episode Discussion
"This is my first season watching, the couples that get the most votes will definitely be coupled up or will they just be told that they got the most votes?",11,1749868005.0,Traditional_Star_832,1laxbqf,Season 7 - Episode 10 - Post Episode Discussion
Damn I missed the vote but from the comments looks like y’all voted the way I intended! 😭😭,11,1749868029.0,fuchsiatiger,1laxbqf,Season 7 - Episode 10 - Post Episode Discussion
"https://preview.redd.it/osho1mhc5t6f1.jpeg?width=3024&format=pjpg&auto=webp&s=d6ab9afa326370fe996ecd18bb194af44386b276

Sorry for the poor quality but…. Can these men sit up straight!!",13,1749869839.0,Silver-Front-1299,1laxbqf,Season 7 - Episode 10 - Post Episode Discussion
how do we feel abt iris???? i’m only 30 mins into this ep but curious at reactions,12,1749871386.0,Ill-Ad5982,1laxbqf,Season 7 - Episode 10 - Post Episode Discussion
"in the past when we have tried to send a message to the islanders through our votes, they always just rationalize the choice away as us being messy and wanting drama lol and tell each other not to read in to it lol",11,1749884548.0,Lavendermin,1laxbqf,Season 7 - Episode 10 - Post Episode Discussion
Yikes….yeah I need Jeremiah and Iris to couple up,12,1749910901.0,GoodStranger2664,1laxbqf,Season 7 - Episode 10 - Post Episode Discussion
"https://preview.redd.it/q0844sbgvs6f1.jpeg?width=1170&format=pjpg&auto=webp&s=720d2de526330615eac5acc26406c71c7a45fe4c

Let’s bring on the mess 😜",33,1749866501.0,SuccessfulCoffee4407,1laxbqf,Season 7 - Episode 10 - Post Episode Discussion
"https://preview.redd.it/fsq1om73ws6f1.jpeg?width=1179&format=pjpg&auto=webp&s=926f666f78a4c9556d9f075fe3615236c9c08526

Save Olandria plus max chaos",33,1749866708.0,Ok-Application-7079,1laxbqf,Season 7 - Episode 10 - Post Episode Discussion
https://preview.redd.it/b4qcyxmaws6f1.jpeg?width=1179&format=pjpg&auto=webp&s=691c992e11dd69115c139c56318e4ef2ce780d11,32,1749866764.0,maurugh,1laxbqf,Season 7 - Episode 10 - Post Episode Discussion
"https://preview.redd.it/rwopfpuews6f1.jpeg?width=1284&format=pjpg&auto=webp&s=0b6077d76108801feeb8275864b32696ea867632

My vote! I want all the DRAMAAAAAA",36,1749866832.0,emthehuiz,1laxbqf,Season 7 - Episode 10 - Post Episode Discussion
"I cannot take pepe seriously because every time I just think of this 😭

https://preview.redd.it/zm92fserws6f1.jpeg?width=976&format=pjpg&auto=webp&s=37bc5f7340dc0ed18dea04105d57a95055a14df8",36,1749866928.0,AndreaThePsycho,1laxbqf,Season 7 - Episode 10 - Post Episode Discussion
"Ready for a Huda crash out 🤣🤣

https://preview.redd.it/a58e0d25xs6f1.png?width=1300&format=png&auto=webp&s=23adf4a67a454d95a87c92bac7d559d33a57ec46",36,1749867090.0,LegalBlueberry1,1laxbqf,Season 7 - Episode 10 - Post Episode Discussion
i just need huda to know that we are done with her…cause i’m convinced she thinks she’s this season’s leah idk,30,1749867154.0,blackflowerpetals,1laxbqf,Season 7 - Episode 10 - Post Episode Discussion
AMAYA PAPAYA FANS PLEASE RISE 🙏🏽,35,1749867622.0,Mobile-List-4333,1laxbqf,Season 7 - Episode 10 - Post Episode Discussion
Voting Jeremiah might be a waste cuz you know Huda will bully him in to sleeping outside!,31,1749869785.0,Lavendermin,1laxbqf,Season 7 - Episode 10 - Post Episode Discussion
"I’m sorry yall but I am SICKKKKKK of Huda. The way she carries herself is so insanely delusional, dumb, and desperate. Jeremiah brings her breakfast and she complains “no protein” then lies to Jeremiah and says Taylor had to step in and help when she ASKED Taylor too like all she does is LIE. then starts talking about how men treat women over some dumb pancakes, then runs off crying. you’re hunching a guy u met 10 days ago and now u wanna complain how he’s treating you!?!?!? The insecurity and delusion is wild yall",30,1749870120.0,trulymango90,1laxbqf,Season 7 - Episode 10 - Post Episode Discussion
"I'm just sitting here going ""Did I miss something? Da faq did Charlie do??!"" Like I get that he and Hannah aren't closed off, but there was literally no context on why Hannah would just go from only having eyes for Charlie to pulling a bombshell into a private room and straddling him. It reads very ""I'm just playing around because I can"" and if Hannah never expressed to Charlie that there's more she wants from him, or is feeling under appreciated, then he really doesn't deserve that kind of sneakiness.",35,1749872781.0,Saphire282,1laxbqf,Season 7 - Episode 10 - Post Episode Discussion
https://preview.redd.it/bk6x6o3uet6f1.jpeg?width=1170&format=pjpg&auto=webp&s=934d132109b6c197e21579bf8acfd3fbe533e974,30,1749873000.0,InterviewWeary5708,1laxbqf,Season 7 - Episode 10 - Post Episode Discussion
"Ima do whatever it takes to save Cierra and find her love, even if I have to take a boat to Fiji and intervene myself.

Her and Pepe are kinda sexy together, but it's too soon to tell if they'll be the first couple worth investing in.",33,1749873727.0,hewitttt,1laxbqf,Season 7 - Episode 10 - Post Episode Discussion
I know the facebook moms are sick at that scene with Hannah and Pepe HAHAHAHAHHAHAHA they really thought,32,1749877281.0,_valiii,1laxbqf,Season 7 - Episode 10 - Post Episode Discussion
"Pepe is rubbing me the wrong way.. that comment he made to Charlie in the kitchen, him telling hannah and Cierra he was into both of them from the start, and him teasing hannah for talking highly of herself for being interested in medicine. Hes giving major red flag vibes",34,1749878439.0,Pitiful_Bit_5369,1laxbqf,Season 7 - Episode 10 - Post Episode Discussion
I think Pepe going about getting chats with the girls was a little disrespectful. Like how he slapped/patted Nic’s stomach or how he tried to tell Charlie to leave the kitchen…. Also him laughing when Hannah called herself smart. He seems off.,31,1749881233.0,SydneyB3,1laxbqf,Season 7 - Episode 10 - Post Episode Discussion
"https://preview.redd.it/lmroy9tt7w6f1.png?width=1269&format=png&auto=webp&s=0af0172146f495be92c92ea4305c1d5b2888a14e

Instagram has finally turned on Huda",36,1749906934.0,Particular-Ad5787,1laxbqf,Season 7 - Episode 10 - Post Episode Discussion
"How does Huda have stans? Genuinely

Is it just because she’s Middle Eastern since I’ve seen TikTok’s of people comparing her to Leah",33,1749911289.0,discombosure,1laxbqf,Season 7 - Episode 10 - Post Episode Discussion
"https://preview.redd.it/xuhepflxvs6f1.jpeg?width=1284&format=pjpg&auto=webp&s=b0ea28bbde2af47790f631e606f0ce77a5a59fbe

Very slightly preferred Amaya over Cierra",45,1749866710.0,AnatineBlitz,1laxbqf,Season 7 - Episode 10 - Post Episode Discussion
"Cierra and Pepe liking kids they can return, lmao I feel seen 😂",10,1749866499.0,birdnoa,1laxbqf,Season 7 - Episode 10 - Post Episode Discussion
I voted for chaos!,9,1749866584.0,g8rgrl15,1laxbqf,Season 7 - Episode 10 - Post Episode Discussion
I’m so pleased to step  into the chat and see everyone voted for Jeremiah,11,1749866836.0,weaselinsneakers,1laxbqf,Season 7 - Episode 10 - Post Episode Discussion
huda is probably gonna love the romeo and juliet us against them (fans) but im interested in jeremiah’s reaction loool  ,11,1749866981.0,Prudent-Cat-1714,1laxbqf,Season 7 - Episode 10 - Post Episode Discussion
Huda about to crash out like mackenzie from szn 2 after this vote😭😭,10,1749867019.0,cat-meleon,1laxbqf,Season 7 - Episode 10 - Post Episode Discussion
the captions are working tgod 😭😭😭,10,1749867066.0,givehail,1laxbqf,Season 7 - Episode 10 - Post Episode Discussion
"https://preview.redd.it/onueevhpxs6f1.jpeg?width=1170&format=pjpg&auto=webp&s=45001a28d1ef075e0017087df8ef5865306f3cf4

yup!",10,1749867241.0,Muted_Leg_8124,1laxbqf,Season 7 - Episode 10 - Post Episode Discussion
https://preview.redd.it/cmtxo0izys6f1.jpeg?width=1170&format=pjpg&auto=webp&s=556a989da950de47522c26c5ea6b8dacf058bba7,10,1749867669.0,ReverendTrident,1laxbqf,Season 7 - Episode 10 - Post Episode Discussion
It’s gotten to the point where I WANT Jeremiah to join Destiny’s Chaldish! Free him omg,9,1749867906.0,GlitterLiving,1laxbqf,Season 7 - Episode 10 - Post Episode Discussion
"If the results from the votes doesn't separate Jeremiah and Huda, then Casa Amor definitely will. I need her to get the biggest reality check of her life.",11,1749868381.0,fullofattitude2025,1laxbqf,Season 7 - Episode 10 - Post Episode Discussion
Why is no one mentioning Austin’s meditation instruction?! It had me dying.,10,1749870297.0,trenchcoatdude,1laxbqf,Season 7 - Episode 10 - Post Episode Discussion
"Can someone explain the pancake issue? I don't understand, he undercooked them but also someone else cooked her pancakes?",8,1749870300.0,NaiveSun367,1laxbqf,Season 7 - Episode 10 - Post Episode Discussion
"wait guys is the vote for a couple up or date? oooo this gon be messy if jeremiah and iris r coupled, im SAT",10,1749871181.0,KBbabylonbaby,1laxbqf,Season 7 - Episode 10 - Post Episode Discussion
i just realized olandria and chelley were wearing the same top wait they probably planned that that’s cute,10,1749886811.0,stardustlovrr,1laxbqf,Season 7 - Episode 10 - Post Episode Discussion
"On the most recent tik tok vid where Hannah is kissing Pepe, there are FAR WAY TOO MANY PEOPLE CALLING HER EASY, literally fuck off this isn’t conservative island",41,1749904120.0,Correct_Silver_5813,1laxbqf,Season 7 - Episode 10 - Post Episode Discussion
"Obviously we’ve said what we thought about Huda but tonight really sealed it for me. The hickey is absolutely diabolical. She needs serious therapy because something is chemically off in her brain. 

Not only is she ruining the experience for Jeremiah, but every person in the villa feels like they need to be on guard to not set her off. That is not what this experience is about. This isn’t “drama”. She’s making the villa uncomfortable and the viewers who are seeing mental illness in a young lady. She needs to go home and seek help.",35,1749867155.0,littleewanderer,1laxbqf,Season 7 - Episode 10 - Post Episode Discussion
Huda is CRAZY. Point blank period. I actually feel really bad for Jeremiah,39,1749870709.0,shhmurdashewrote,1laxbqf,Season 7 - Episode 10 - Post Episode Discussion
"I actually get where Huda’s coming from with the effort thing bc bare minimum things in the real world feel like grand gestures in a confined villa so if my partner couldn’t do that then I would be upset too. However, I think she needs to change her tone when addressing things bc she always sounds like she’s scolding him instead of having a conversation. 

I feel like both Huda and Jeremiah’s intuitions are telling them they’re not compatible which is why they keep arguing over little things but they’re both still holding on to the initial attraction they had.",37,1749873905.0,scoobydoov,1laxbqf,Season 7 - Episode 10 - Post Episode Discussion
Hannah and Pepe are HOT my girl lowkey a maneater,33,1749892127.0,vanessamoth,1laxbqf,Season 7 - Episode 10 - Post Episode Discussion
Oh my days it’s hard to look at Iris’ face,34,1749911177.0,gthehippie2023,1laxbqf,Season 7 - Episode 10 - Post Episode Discussion
"Sometimes, when I read these post show subreddits I'm thrown off by the comments. To give the benefit of the doubt, I am hoping that people may have commented before having watched the entire episode. But, if not then I'm wondering if we're watching the same show. 

One common theme is this Jeremiah and Iris topic. In my eyes, Iris is interested in Ace, and the feeling is mutual. Secondly, Huda is doing way too much. Seeing yourself as the prize doesn't mean that your partner has to center every little thing around you. Then, to find out that she asked Taylor to make her pancakes, but get mad that Jeremiah didn't step in to tell him to not make the breakfast so that he can??? My God, that woman is a self centered, spoiled control freak. Her facial expression annoys tf out of me. Plus, she's so draining! 


Side bar as it pertains to Chelley. She's doing what she's supposed to be doing! I can't stand Ace, especially with how he treated Amaya. And feel that he's only making any effort, because things didn't work out with Amaya. My only gripe is when she was cooking breakfast for Austin, but dropped everything for Ace when he wanted to do yoga, and having him lick the cream off of her was a bit too much. Especially in front of Austin. With that said, I hope Ace changes gears and pursues Iris, because Chelley deserves better than both Ace and Austin. So, I would love for her to meet a Bombshell. Kind of like how Jalen is pursuing Ola (thankfully, because I'm not fond of Taylor and I don't trust his sudden interest in her).",38,1749938052.0,lprdgds,1laxbqf,Season 7 - Episode 10 - Post Episode Discussion
Huda is a psychopath. I genuinely need her off of this show.,36,1749949631.0,Elegant_Tour_260,1laxbqf,Season 7 - Episode 10 - Post Episode Discussion
"It you’re in line to vote stay in line!

https://preview.redd.it/8n7dss6wws6f1.jpeg?width=1674&format=pjpg&auto=webp&s=2256c949789df0ca1c28082d3c10458aeb3d3ebb",26,1749866965.0,Ok_Scholar4192,1laxbqf,Season 7 - Episode 10 - Post Episode Discussion
Hannah and Pepe was soooo hot but Amaya has to be freed from Ace and Austin,26,1749867084.0,2yxuknow,1laxbqf,Season 7 - Episode 10 - Post Episode Discussion
"https://preview.redd.it/odl1cehhxs6f1.jpeg?width=1179&format=pjpg&auto=webp&s=844aec196fe455966dc323303092acf3fca64641

For the drama 🙏",29,1749867179.0,1th1,1laxbqf,Season 7 - Episode 10 - Post Episode Discussion
"https://preview.redd.it/s8b8kr2xys6f1.jpeg?width=1170&format=pjpg&auto=webp&s=0c8a00ec18f54b89c2a65ede13aa160c5e70bf7c

I feel like Cierra also needs to be saved from Nic he is tooo quick to jump ship although I like him I need my girl Cierra in a solid couple she’s my fav in the villa !!",26,1749867686.0,AmiableWallflower,1laxbqf,Season 7 - Episode 10 - Post Episode Discussion
i feel like the jeremiah huda split is only gonna bring them closer 😭😭😭 i have no faith,27,1749868076.0,Federal-Ad-6189,1laxbqf,Season 7 - Episode 10 - Post Episode Discussion
Wow Huda is super childish.. it is pretty embarrassing how she is behaving,29,1749868520.0,mrskassie,1laxbqf,Season 7 - Episode 10 - Post Episode Discussion
Huda is fucking insufferable. She’s using every manipulation tactic in the book. Jeremiah needs get out ASAP.,28,1749872905.0,silenced_soul,1laxbqf,Season 7 - Episode 10 - Post Episode Discussion
